,breakfast_calories,morning snacks_calories,afternoon snacks_calories,lunch_calories,dinner_calories,breakfast,morning snacks,afternoon snacks,lunch,dinner
201,350.0,100.0,200.0,400.0,200.0, Vegan Kale and Potato Frittata - 350 calories per portion | 1 portion | None | Origin, Fresh Fruit Salad, Vegan Thai Papaya Salad," Vegan Spinach and Mushroom Quiche
Total calories per portion"," Vegan Miso Soup - 200 calories per portion, 4 portions, Soy, Japan
"
202,150.0,90.0,180.0,400.0,100.0, Vegan Peanut Butter Banana Smoothie, Quinoa Energy Bites," Blueberry Oatmeal Muffins - 180 kcals per portion, 4 portions, no allergic warnings, origin", Vegan Cajun Red Beans and Rice," Japanese Miso Soup with Tofu (100 calories/portion, 4 portions) - Japan
"
203,250.0,100.0,560.0,250.0,200.0, Vegan Maple Pecan Overnight Oats - 250 calories per portion | 2 portions | Contains nuts | Origin, Baked Apple Chips, Vegan Chickpea Salad Sandwich, Caprese Salad," Lentil Curry (200 calories/portion, 4 portions) - India
"
204,400.0,100.0,110.0,200.0,250.0, Vegan Cinnamon Rolls, Toasted Coconut Chips," Oatmeal Raisin Energy Balls - 110 kcals per portion, 4 portions, no allergic warnings, origin"," Spanish Gazpacho
Total calories per portion", Veggie Stir-Fry with Quinoa
205,550.0,100.0,80.0,350.0,250.0, Granola with Soy Milk, Overnight Chia Pudding, Vegan Carrot Cake Energy Balls," Vegetable Stir-Fry with Tofu
Total calories per portion", Vegan Caesar Salad
206,300.0,80.0,120.0,400.0,250.0, Vegan Almond Butter Toast - 300 calories per portion | 1 portion | Contains nuts | Origin, Stuffed Dates," Vegan Chocolate Chip Cookies - 120 kcals per portion, 4 portions, no allergic warnings, origin", Thai Coconut Curry," Stuffed Portobello Mushrooms - 250 calories per portion, 4 portions, None, Various
"
207,250.0,90.0,80.0,400.0,300.0, Vegan Matcha Overnight Oats - 250 calories per portion | 2 portions | None | Origin, Stuffed Dates, Energy Balls, Veggie Bibimbap," Lentil Salad with Avocado Dressing - 300 calories per portion, 4 portions, None, Various

"
208,400.0,90.0,200.0,350.0,300.0, Vegan Breakfast Spanakopita, Stuffed Dates," Vegan Peanut Butter Banana Smoothie - 200 kcals per portion, 4 portions, allergic warning (peanuts), origin", Vegan Roasted Vegetable Pasta," Lentil Sloppy Joes - 300 calories per portion, 4 portions, Gluten, United States
"
209,250.0,100.0,100.0,400.0,300.0, Vegan Breakfast Oats and Berries, Chilled Gazpacho," Vegan Energy Balls - 100 kcals per portion, 4 portions, no allergic warnings, origin"," Vegan BBQ Jackfruit Sandwich
Total calories per portion", Quinoa Salad
210,550.0,80.0,640.0,200.0,300.0, Granola with Soy Milk, Fruit Salad, Vegan Ratatouille, Vegan Spinach and Artichoke Dip, Sweet Potato Curry
211,550.0,100.0,160.0,400.0,318.0, Granola with Soy Milk, Roasted Edamame," Vegan Raspberry Bars - 160 kcals per portion, 4 portions, no allergic warnings, origin"," Greek Vegan Moussaka
Total calories per portion", Lentil and Mushroom Burgers
212,300.0,100.0,400.0,350.0,300.0, Vegan Apple Cinnamon Quinoa - 300 calories per portion | 1 portion | None | Origin, Roasted Edamame, Vegan Tzatziki and Pita Bread, Vegan Spanish Gazpacho," Lentil Walnut Tacos - 300 calories per portion, 4 portions, Nuts, Mexico
"
213,350.0,100.0,180.0,350.0,280.0, Vegan Breakfast Bars, Roasted Edamame," Baked Falafel Salad - 180 kcals per portion, 4 portions, allergic warning (sesame), origin"," Vegan Moroccan Chickpea Salad
Total calories per portion", Sweet Potato Curry
214,250.0,90.0,160.0,300.0,320.0, Vegan Matcha Overnight Oats - 250 calories per portion | 2 portions | None | Origin, Stuffed Dates," Vegan Taco Lettuce Wraps - 160 kcals per portion, 4 portions, no allergic warnings, origin", Lebanese Tabbouleh Salad, Vegan Lentil Meatballs
215,250.0,100.0,600.0,300.0,200.0, Vegan Green Breakfast Bowl - 250 calories per portion | 2 portions | None | Origin, Energy Balls, Vegan Indonesian Gado Gado, Vegan Chinese Hot and Sour Soup," Vegan Miso Soup - 200 calories per portion, 4 portions, Soy, Japan
"
216,350.0,100.0,140.0,400.0,250.0, Vegan Protein Pancakes - 350 calories per portion | 1 portion | Contains gluten | Origin, Chilled Gazpacho," Vegan Mediterranean Pasta Salad - 140 kcals per portion, 4 portions, no allergic warnings, origin"," Thai Red Curry with Tofu
Total calories per portion"," Vegan Lentil and Vegetable Casserole - 250 calories per portion, 4 portions, may contain gluten"
217,250.0,100.0,180.0,250.0,180.0, Sweet Potato Toast - 250 calories per portion | 1 portion | None | Origin, Chilled Gazpacho," Quinoa Stuffed Bell Peppers - 180 kcals per portion, 4 portions, no allergic warnings, origin"," Vegan Pumpkin Soup
Total calories per portion"," Cauliflower Shawarma - 180 calories per portion, 6 portions, None, Middle East
"
218,500.0,90.0,120.0,300.0,350.0, Vegan Breakfast Burrito, Stuffed Dates, Vegan Mediterranean Hummus Bowl, Lentil Bolognese," Lentil Coconut Curry Soup - 350 calories per portion, 4 portions, None, India

Please note that the portion sizes and calorie counts are approximate, and you may need to adjust the recipe based on your specific dietary needs and restrictions"
219,400.0,80.0,180.0,300.0,300.0, Vegan Breakfast Tostadas - 400 calories per portion | 1 portion | Contains soy | Origin, Fruit Salad," Spinach and Mushroom Quesadillas - 180 kcals per portion, 4 portions, no allergic warnings, origin", Lentil Bolognese," Mexican Vegan Tortilla Soup (300 calories/portion, 4 portions) - Mexico
"
220,200.0,100.0,400.0,300.0,300.0, Vegan Matcha Chia Pudding - 200 calories per portion | 1 portion | None | Origin, Fresh Fruit Salad, Zucchini Fritters," Mediterranean Quinoa Salad
Total calories per portion", Vegan Gyros
221,350.0,100.0,120.0,350.0,350.0, Tofu Scramble, Toasted Coconut Chips, Vegan Mediterranean Hummus Bowl, Vegan Spanish Gazpacho, Falafel Wrap
222,300.0,100.0,160.0,400.0,350.0, Vegan Omelette, Baked Apple Chips," Vegan Pesto Pasta Salad - 160 kcals per portion, 4 portions, no allergic warnings, origin", Vegan Moroccan Vegetable Tagine," Greek Vegan Briam (350 calories/portion, 2 portions) - Greece
"
223,150.0,90.0,150.0,200.0,350.0, Chia Pudding - 150 calories per portion | 1 portion | None | Origin, Stuffed Dates, Vegan Banana Bread, Tom Yum Soup, Vegan Shepherd's Pie
224,200.0,100.0,180.0,300.0,300.0, Vegan Chocolate Chia Pudding - 200 calories per portion | 2 portions | None | Origin, Baked Apple Chips," Vegan Nachos with Salsa - 180 kcals per portion, 4 portions, no allergic warnings, origin", Vegan Black Bean Soup," Mexican Black Bean Tacos (300 calories/portion, 2 portions) - Mexico
"
225,200.0,80.0,120.0,350.0,350.0, Vegan Breakfast Cookies - 200 calories per portion | 2 portions | Contains gluten | Origin, Stuffed Dates," Chia Pudding with Fresh Berries - 120 kcals per portion, 4 portions, no allergic warnings, origin"," Indian Vegan Vegetable Korma
Total calories per portion"," Vegan Thai Red Curry - 350 calories per portion, 2 portions, may contain tofu"
226,400.0,100.0,240.0,400.0,320.0, Vegan Tofu Benedict - 400 calories per portion | 1 portion | Contains soy | Origin, Baked Apple Chips, Vegan Spinach Dip with Pita Chips, Falafel Wrap, Zucchini and Carrot Noodles with Peanut Sauce
227,450.0,100.0,100.0,500.0,320.0, Vegan Biscuits and Gravy - 450 calories per portion | 1 portion | Contains gluten | Origin, Roasted Edamame," Baked Tofu Nuggets - 100 kcals per portion, 4 portions, no allergic warnings, origin"," Black Bean Quesadillas with Guacamole
Total calories per portion", Mediterranean Vegan Wrap
228,150.0,100.0,120.0,400.0,180.0, Vegan Energy Balls - 150 calories per portion | 2 portions | Contains nuts | Origin, Roasted Almonds," Vegan Pumpkin Spice Energy Balls - 120 kcals per portion, 4 portions, no allergic warnings, origin", Chickpea Curry, Tofu Stir-Fry
229,550.0,100.0,680.0,400.0,300.0, Vegan Breakfast Chili, Energy Balls, Vegan Broccoli Cheddar Soup, Vegan Moroccan Vegetable Tagine, Beetroot Burger
230,500.0,100.0,180.0,250.0,331.0, Vegan Breakfast Risotto, Roasted Almonds," Roasted Chickpea Salad - 180 kcals per portion, 4 portions, no allergic warnings, origin", Lentil Salad, Vegan Tacos
231,400.0,100.0,130.0,300.0,300.0, Vegan Breakfast Skillet, Roasted Pumpkin Seeds," Oven-Baked Sweet Potato Fries - 130 kcals per portion, 4 portions, no allergic warnings, origin", Greek Style Chickpea Sandwich, Roasted Veggie Wrap
232,350.0,80.0,360.0,450.0,320.0, Vegan Blueberry Acai Smoothie Bowl - 350 calories per portion | 1 portion | None | Origin, Stuffed Dates, Vegan Turkish Delight," Vegan Mushroom and Spinach Pasta
Total calories per portion", Zucchini and Carrot Noodles with Peanut Sauce
233,250.0,100.0,160.0,400.0,300.0, Vegan Cinnamon Apple Oatmeal - 250 calories per portion | 2 portions | None | Origin, Chilled Gazpacho," Vegan Samosas - 160 kcals per portion, 4 portions, no allergic warnings, origin"," Lentil Tacos with Avocado Crema
Total calories per portion", Chickpea Curry
234,250.0,100.0,120.0,300.0,280.0, Vegan Breakfast Oats and Berries, Roasted Almonds," Roasted Cauliflower Bites - 120 kcals per portion, 4 portions, no allergic warnings, origin", Lentil Sloppy Joes, Vegan Quiche
235,50.0,100.0,620.0,350.0,250.0, Vegan Breakfast Sushi Burrito, Roasted Pumpkin Seeds, Bean Burritos, Vegan Gyros, Portobello Mushroom Burger
236,250.0,90.0,340.0,300.0,350.0, Vegan Maple Pecan Overnight Oats - 250 calories per portion | 2 portions | Contains nuts | Origin, Stuffed Dates, Vegan Nachos, Vegan Black Bean Soup, Mexican Quinoa Bowl
237,300.0,100.0,180.0,300.0,350.0, Vegan Omelette, Baked Apple Chips," Quinoa Stuffed Bell Peppers - 180 kcals per portion, 4 portions, no allergic warnings, origin", Lentil Shepherd's Pie, Chickpea Salad Sandwich
238,500.0,100.0,280.0,300.0,200.0, Vegan Breakfast Vegetable Stir-Fry, Energy Balls, Vegan Greek Salad, Vegan Singapore Noodles," Vegan Buffalo Cauliflower Wings - 200 calories per portion, 4 portions, None, United States
"
239,70.0,100.0,480.0,200.0,300.0, Fruit Salad, Roasted Pumpkin Seeds, Vegan Cucumber Sushi Rolls," Spanish Gazpacho
Total calories per portion"," Cauliflower Tikka Masala - 300 calories per portion, 4 portions, None, India

"
240,150.0,90.0,400.0,250.0,220.0, Vegan Pancakes, Quinoa Energy Bites, Vegan Japanese Mochi, Chickpea and Avocado Salad, Chickpea and Vegetable Stir Fry
241,400.0,100.0,360.0,250.0,250.0, Vegan Breakfast Stuffed Mushrooms - 400 calories per portion | 1 portion | None | Origin, Toasted Coconut Chips, Vegan Turkish Delight, Vegan Moroccan Chickpea Salad, Vegan Kung Pao Tofu
242,250.0,100.0,200.0,300.0,350.0, Avocado Toast, Toasted Coconut Chips," Vegan Broccoli Pesto Pasta - 200 kcals per portion, 4 portions, no allergic warnings, origin", Vegan Stuffed Bell Peppers with Quinoa and Black Beans, Vegan Nachos
243,350.0,100.0,600.0,250.0,300.0, Quinoa Porridge - 350 calories per portion | 1 portion | Contains nuts | Origin, Baked Apple Chips, Vegan Mushroom Risotto, Vegan Moroccan Chickpea Salad, Lentil Meatballs in Marinara Sauce
244,400.0,100.0,140.0,300.0,350.0, Vegan Breakfast Casserole - 400 calories per portion | 1 portion | None | Origin, Overnight Chia Pudding," Vegan Mediterranean Pasta Salad - 140 kcals per portion, 4 portions, no allergic warnings, origin", Vegan Spanish Paella," Italian Vegan Pasta Aglio e Olio (350 calories/portion, 2 portions) - Italy
"
245,600.0,100.0,380.0,250.0,350.0, Vegan Breakfast Danish, Fresh Fruit Salad, Vegan Chocolate Chip Cookies," Vegan Pumpkin Soup
Total calories per portion"," Quinoa Stuffed Bell Peppers - 350 calories per portion, 4 portions, None, Various
"
246,250.0,100.0,90.0,300.0,350.0, Vegan Breakfast Bruschetta, Roasted Pumpkin Seeds," Bruschetta with Fresh Tomatoes and Basil - 90 kcals per portion, 4 portions, no allergic warnings, origin", Lentil Burgers," Vegan Lentil Coconut Curry - 350 calories per portion, 2 portions, may contain mustard"
247,100.0,90.0,150.0,300.0,250.0, Vegan Breakfast Rice Pudding, Stuffed Dates," Cucumber and Avocado Sushi Rolls - 150 kcals per portion, 4 portions, allergic warning (avocado), origin", Mexican Rice Bowl," Stuffed Portobello Mushrooms - 250 calories per portion, 4 portions, None, Various
"
248,250.0,100.0,120.0,300.0,200.0, Vegan Breakfast Crepes, Roasted Edamame," Vegan Cucumber Sushi Rolls - 120 kcals per portion, 4 portions, no allergic warnings, origin", Lentil Sloppy Joes, Lentil and Vegetable Soup
249,300.0,100.0,160.0,350.0,300.0, Vegan Apple Cinnamon Quinoa - 300 calories per portion | 1 portion | None | Origin, Energy Balls, Vegan Mexican Street Corn, Vegan Cajun Jambalaya," Thai Curry Noodle Soup - 300 calories per portion, 4 portions, None, Thailand
"
250,350.0,100.0,660.0,250.0,212.0, Vegan Savory Breakfast Muffins - 350 calories per portion | 1 portion | Contains gluten | Origin, Chilled Gazpacho, Vegan Pesto Pasta, Vegan Sushi Rolls, Vegan Caesar Salad
251,250.0,80.0,150.0,350.0,220.0, Vegan Raspberry Almond Scones - 250 calories per portion | 2 portions | Contains gluten and nuts | Origin, Stuffed Dates," Vegan Zucchini Fritters with Vegan Sour Cream - 150 kcals per portion, 4 portions, no allergic warnings, origin", Mediterranean Wrap, Chickpea Salad
252,350.0,80.0,600.0,300.0,290.0, Vegan Breakfast Baked Potato - 350 calories per portion | 1 portion | None | Origin, Fruit Salad, Vegan Shepherd's Pie, Black Bean and Vegetable Quesadillas, Moroccan Lentil Salad
253,400.0,90.0,240.0,300.0,300.0, Vegan Spinach and Mushroom Breakfast Wrap - 400 calories per portion | 1 portion | None | Origin, Stuffed Dates, Vegan Spinach Dip with Pita Chips," Vegan Eggplant Rollatini
Total calories per portion", Vegan Lentil Tacos
254,300.0,100.0,240.0,200.0,250.0, Vegan Breakfast Tacos - 300 calories per portion | 2 portions | None | Origin, Fresh Fruit Salad, Veggie Sushi Rolls," Vegan Mushroom and Lentil Soup
Total calories per portion", Vegan Soba Noodle Salad
255,150.0,100.0,90.0,350.0,300.0, Vegan Breakfast Fajitas, Baked Apple Chips," Guacamole with Tortilla Chips - 90 kcals per portion, 4 portions, allergic warning (avocado), origin"," Mediterranean Baked Falafel
Total calories per portion", Veggie Fajitas
256,550.0,80.0,260.0,250.0,210.0, Vegan Breakfast Cobbler, Fruit Salad, Spicy Mango Salsa, Chickpea and Avocado Salad, Quinoa and Kale Salad
257,200.0,80.0,200.0,300.0,285.0, Vegan Chocolate Chia Pudding - 200 calories per portion | 2 portions | None | Origin, Stuffed Dates," Vegan Broccoli Pesto Pasta - 200 kcals per portion, 4 portions, no allergic warnings, origin", Black Bean Tacos, Stuffed Bell Peppers
258,250.0,100.0,80.0,250.0,320.0, Vegan Cacao Banana Smoothie - 250 calories per portion | 2 portions | None | Origin, Fresh Fruit Salad, Energy Balls, Greek Salad, Mediterranean Stuffed Peppers
259,300.0,90.0,260.0,250.0,300.0, Fruit Smoothie Bowl - 300 calories per portion | 1 portion | None | Origin, Stuffed Dates, Spicy Mango Salsa," Italian Caprese Salad
Total calories per portion", Vegetable Curry
260,150.0,100.0,320.0,400.0,350.0, Vegan Breakfast Pita Pockets, Roasted Edamame, Vegan Raspberry Oat Bars, Falafel Wrap, Vegan Meatballs in Tomato Sauce
261,300.0,100.0,180.0,350.0,300.0, Vegan Sweet Potato Pancakes - 300 calories per portion | 1 portion | Contains gluten | Origin, Fresh Fruit Salad," Sticky Coconut Rice Balls - 180 kcals per portion, 4 portions, no allergic warnings, origin", Veggie Curry, Sweet Potato Black Bean Burrito
262,450.0,90.0,160.0,400.0,300.0, Vegan Blueberry Muffins, Quinoa Energy Bites," Vegan Samosas - 160 kcals per portion, 4 portions, no allergic warnings, origin", Chickpea and Vegetable Curry, Quinoa Salad
263,300.0,80.0,140.0,450.0,350.0, Vegan Breakfast Parfait, Fruit Salad," Vegan Spinach Dip with Pita Chips - 140 kcals per portion, 4 portions, no allergic warnings, origin"," Vegan Mac and Cheese
Total calories per portion"," Vegan Fajitas - 350 calories per portion, 4 portions, None, Mexico
"
264,250.0,100.0,360.0,400.0,350.0, Vegan Breakfast Crepes, Roasted Pumpkin Seeds, Vegan Turkish Delight," Thai Green Curry with Mixed Vegetables
Total calories per portion", Quinoa Stuffed Tomatoes
265,150.0,100.0,150.0,450.0,200.0, Vegan Pancakes, Overnight Chia Pudding," Cucumber and Avocado Sushi Rolls - 150 kcals per portion, 4 portions, allergic warning (avocado), origin"," Mexican Quinoa Stuffed Peppers
Total calories per portion", Spicy Black Bean Soup
266,200.0,100.0,160.0,250.0,350.0, Vegan Breakfast Quiche Lorraine, Energy Balls," Chickpea Salad Lettuce Wraps - 160 kcals per portion, 4 portions, no allergic warnings, origin", Lentil and Kale Salad," Vegan Fajitas - 350 calories per portion, 4 portions, None, Mexico
"
267,450.0,80.0,180.0,400.0,350.0, Vegan Breakfast Pho, Fruit Salad," Spinach and Mushroom Quesadillas - 180 kcals per portion, 4 portions, no allergic warnings, origin", Vegan Thai Pineapple Fried Rice," Vegan Meatballs with Marinara Sauce - 350 calories per portion, 4 portions, Gluten, Italy
"
268,450.0,80.0,110.0,400.0,280.0, Quinoa Breakfast Bowl, Stuffed Dates," Oatmeal Raisin Energy Balls - 110 kcals per portion, 4 portions, no allergic warnings, origin", Vegan Bibimbap, Vegan Quiche
269,350.0,100.0,140.0,250.0,350.0, Vegan Mushroom and Spinach Omelette - 350 calories per portion | 1 portion | None | Origin, Energy Balls," Roasted Beetroot Dip with Pita Bread - 140 kcals per portion, 4 portions, no allergic warnings, origin", Chickpea and Avocado Salad," Vegan Tikka Masala - 350 calories per portion, 4 portions, None, India
"
270,50.0,100.0,580.0,250.0,250.0, Vegan Breakfast Stuffed Tomatoes, Roasted Almonds, Falafel with Tahini Sauce," Italian Minestrone Soup
Total calories per portion"," Moroccan Lentil Salad - 250 calories per portion, 4 portions, None, Morocco
"
271,400.0,100.0,600.0,350.0,250.0, Vegan Breakfast Fried Rice, Roasted Almonds, Vegan Indonesian Gado Gado, Vegan Stuffed Zucchini, Tofu Stir-Fry
272,300.0,100.0,160.0,300.0,300.0, Vegan Chocolate Protein Shake - 300 calories per portion | 1 portion | None | Origin, Toasted Coconut Chips," Vegan Bruschetta Pasta Salad - 160 kcals per portion, 4 portions, no allergic warnings, origin", Vegan Black Bean Soup, Vegan Spaghetti Carbonara
273,350.0,100.0,120.0,250.0,200.0, Vegan Pear and Walnut Oatmeal - 350 calories per portion | 1 portion | Contains nuts | Origin, Overnight Chia Pudding," Roasted Chickpeas - 120 kcals per portion, 4 portions, no allergic warnings, origin"," Ratatouille
Total calories per portion", Vegan Caprese Salad
274,150.0,100.0,200.0,400.0,350.0, Vegan Energy Balls - 150 calories per portion | 2 portions | Contains nuts | Origin, Fresh Fruit Salad," Quinoa Salad with Roasted Vegetables - 200 kcals per portion, 4 portions, no allergic warnings, origin", Quinoa and Vegetable Stir-Fry, Vegan Ramen
275,350.0,100.0,120.0,400.0,300.0, Vegan Breakfast Bars, Fresh Fruit Salad," Vegan Chocolate Chip Cookies - 120 kcals per portion, 4 portions, no allergic warnings, origin"," Lentil Tacos with Avocado Crema
Total calories per portion", Stuffed Bell Peppers
276,300.0,100.0,160.0,350.0,250.0, Vegan Breakfast Bars - 300 calories per portion | 1 portion | Contains nuts | Origin, Roasted Almonds," Vegan Coconut Curry Rice Balls - 160 kcals per portion, 4 portions, no allergic warnings, origin", Spinach and Mushroom Quesadillas, Portobello Mushroom Burger
277,400.0,100.0,90.0,350.0,250.0, Veggie Sausage and Hash Browns - 400 calories per portion | 1 portion | Contains soy | Origin, Energy Balls," Vegan Caprese Salad Skewers - 90 kcals per portion, 4 portions, no allergic warnings, origin", Veggie Curry Noodles, Vegan Caesar Salad
278,400.0,80.0,280.0,300.0,200.0, Vegan Breakfast Hand Pies, Stuffed Dates, Vegan Lemon Poppy Seed Muffins, Vegan Moroccan Lentil Soup, Lentil and Vegetable Soup
279,350.0,100.0,220.0,200.0,250.0, Vegan Apricot and Almond Granola Bars - 350 calories per portion | 1 portion | Contains nuts | Origin, Toasted Coconut Chips, Baked Sweet Potato Fries, Vegan Stuffed Bell Peppers," Vegan Teriyaki Tofu - 250 calories per portion, 4 portions, Soy, Japan
"
280,200.0,90.0,660.0,400.0,240.0, Vegan Oatmeal Raisin Cookies - 200 calories per portion | 2 portions | Contains gluten | Origin, Stuffed Dates, Vegan Pesto Pasta, Vegan Moroccan Vegetable Tagine, Vegan Lentil Soup
281,150.0,80.0,100.0,400.0,220.0, Chia Pudding - 150 calories per portion | 1 portion | None | Origin, Fruit Salad," Homemade Hummus with Carrot Sticks - 100 kcals per portion, 4 portions, no allergic warnings, origin"," Vegan Lentil Bolognese
Total calories per portion", Lentil and Vegetable Stir Fry
282,450.0,90.0,160.0,300.0,320.0, Vegan Breakfast Lassi, Stuffed Dates, Vegan Spinach and Mushroom Puff Pastry, Sweet Potato and Black Bean Chili, Mediterranean Pasta Salad
283,250.0,80.0,580.0,400.0,250.0, Vegan Berry Parfait - 250 calories per portion | 2 portions | Contains nuts | Origin, Fruit Salad, Falafel with Tahini Sauce," Vegan Cuban Sandwich
Total calories per portion"," Greek Vegan Fava Beans (250 calories/portion, 4 portions) - Greece
"
284,400.0,90.0,340.0,300.0,120.0, Vegan Breakfast Tostadas - 400 calories per portion | 1 portion | Contains soy | Origin, Quinoa Energy Bites, Vegan Nachos, Black Bean Tacos, Cucumber and Tomato Salad
285,450.0,100.0,200.0,350.0,350.0, Vegan Biscuits and Gravy - 450 calories per portion | 1 portion | Contains gluten | Origin, Baked Apple Chips, Hummus and Pita Bread, Vegan Curry Fried Rice, Vegan Burritos
286,400.0,100.0,520.0,350.0,355.0, Vegan Breakfast Casserole - 400 calories per portion | 1 portion | None | Origin, Roasted Edamame, Vegan Spinach and Artichoke Crostini, Vegan Fajitas, Chickpea Salad
287,450.0,100.0,160.0,350.0,213.0, Vegan Breakfast Lassi, Energy Balls," Sweet Potato and Black Bean Quesadillas - 160 kcals per portion, 4 portions, no allergic warnings, origin", Vegan Meatball Sub, Lentil Soup
288,600.0,100.0,130.0,300.0,250.0, Vegan Breakfast Tofu Bowl, Baked Apple Chips," Baked Falafel with Tahini Sauce - 130 kcals per portion, 4 portions, allergic warning (sesame), origin", Lentil Shepherd's Pie, Vegan Swedish Meatballs
289,350.0,100.0,180.0,300.0,300.0, Vegan Breakfast Sandwich - 350 calories per portion | 1 portion | Contains gluten | Origin, Roasted Edamame," Blueberry Oatmeal Muffins - 180 kcals per portion, 4 portions, no allergic warnings, origin", Vegan Singapore Noodles, Veggie Fajitas
290,400.0,100.0,160.0,400.0,350.0, Vegan Breakfast Quiche - 400 calories per portion | 1 portion | Contains gluten | Origin, Baked Apple Chips, Vegan Spinach and Mushroom Puff Pastry," Vegan Hungarian Goulash
Total calories per portion"," Vegan Sushi Bowl - 350 calories per portion, 4 portions, Soy, Japan
"
291,300.0,100.0,160.0,400.0,250.0, Berry Quinoa Breakfast Bowl - 300 calories per portion | 1 portion | Contains nuts | Origin, Roasted Pumpkin Seeds," Vegan Spinach and Artichoke Stuffed Breadsticks - 160 kcals per portion, 4 portions, no allergic warnings, origin", Chana Masala, Veggie Stir-Fry with Quinoa
292,350.0,100.0,640.0,200.0,318.0, Vegan Protein Pancakes - 350 calories per portion | 1 portion | Contains gluten | Origin, Fresh Fruit Salad, Vegan Baked Falafel Bowl, Vegan Stuffed Bell Peppers, Lentil and Mushroom Burgers
293,350.0,100.0,300.0,300.0,300.0, Vegan Breakfast Quinoa Bowl - 350 calories per portion | 1 portion | Contains nuts | Origin, Roasted Edamame, Veggie Spring Rolls, Vegan Mushroom and Chestnut Wellington," Moroccan Lentil Burgers (300 calories/portion, 4 portions) - Morocco
"
294,350.0,80.0,200.0,200.0,250.0, Vegan Breakfast Quinoa Bowl - 350 calories per portion | 1 portion | Contains nuts | Origin, Stuffed Dates," Vegan Pancakes with Maple Syrup - 200 kcals per portion, 4 portions, no allergic warnings, origin"," Vegan Greek Avgolemono Soup
Total calories per portion", Thai Peanut Noodles
295,250.0,100.0,200.0,350.0,320.0, Vegan Breakfast Crepes, Roasted Almonds," Vegan Pancakes with Maple Syrup - 200 kcals per portion, 4 portions, no allergic warnings, origin", Vegan Sweet Potato Curry, Roasted Vegetable Pasta
296,350.0,80.0,90.0,400.0,200.0, Vegan Tofu Scramble Breakfast Sandwich - 350 calories per portion | 1 portion | Contains soy | Origin, Fruit Salad," Vegan Caprese Salad Skewers - 90 kcals per portion, 4 portions, no allergic warnings, origin"," Vegan Shepherd's Pie
Total calories per portion"," Lentil Spinach Salad - 200 calories per portion, 4 portions, None, Various
"
297,350.0,80.0,200.0,250.0,350.0, Vegan Savory Breakfast Muffins - 350 calories per portion | 1 portion | Contains gluten | Origin, Fruit Salad, Vegan Thai Papaya Salad," Vegan Cauliflower ""Steak"""," Vegan Fajitas - 350 calories per portion, 4 portions, None, Mexico
"
298,300.0,100.0,140.0,250.0,256.0, Veggie Tofu Scramble Wrap - 300 calories per portion | 1 portion | None | Origin, Roasted Almonds," Vegan Mediterranean Pasta Salad - 140 kcals per portion, 4 portions, no allergic warnings, origin", Vegan Sushi Rolls, Vegan BLT Sandwich
299,300.0,80.0,130.0,250.0,280.0, Vegan Buckwheat Banana Pancakes - 300 calories per portion | 1 portion | Contains gluten | Origin, Stuffed Dates," Veggie Sushi Rolls with Quinoa - 130 kcals per portion, 4 portions, no allergic warnings, origin", Vegan Moroccan Couscous, Sweet Potato Curry
300,200.0,90.0,160.0,400.0,300.0, Vegan Breakfast Phyllo Cups, Quinoa Energy Bites," Vegan Pesto Pasta Salad - 160 kcals per portion, 4 portions, no allergic warnings, origin"," Greek Vegan Moussaka
Total calories per portion"," Lentil Curry - 300 calories per portion, 4 portions, Gluten (optional), India
"
301,250.0,90.0,200.0,400.0,250.0, Vegan Matcha Overnight Oats - 250 calories per portion | 2 portions | None | Origin, Quinoa Energy Bites, Stuffed Grape Leaves, Vegan Thai Pineapple Fried Rice with Tofu, Vegan Tofu Scramble
