,breakfast_calories,morning snacks_calories,afternoon snacks_calories,lunch_calories,dinner_calories,breakfast,morning snacks,afternoon snacks,lunch,dinner
339,320.0,100.0,280.0,20.0,200.0," Baked eggs with spinach and mushrooms (320 calories per portion, 2 portions, nut-free, American origin)
", Roasted Beetroot Chips, Cucumber and Avocado Sushi, Moroccan Mint Tea," Tomato and mozzarella tart - 200 calories per portion, 4 portions, contains gluten and dairy (Italy)
"
340,250.0,100.0,180.0,20.0,200.0," Blueberry almond muffins (250 calories per portion, 2 portions, contains nuts, American origin)
", Fruit salad, Apple with Peanut Butter, Moroccan Mint Tea," Lentil Spinach Salad - 200 calories per portion, 4 portions, None, Various
"
341,320.0,100.0,120.0,20.0,120.0," Caramelized onion and goat cheese tart (320 calories per portion, 2 portions, contains dairy, French origin)
", Greek yogurt with berries," Vegan Lentil Soup - 120 kcals per portion, 4 portions, no allergic warnings, origin", Moroccan Mint Tea, Cucumber and Tomato Salad
342,320.0,50.0,200.0,20.0,180.0," Baked eggs with asparagus and Parmesan (320 calories per portion, 2 portions, contains dairy, Italian origin)
", Baked Apple Chips - Approx, Mini Quiches, Moroccan Mint Tea," Moroccan Lentil Soup - 180 calories per portion, 6 portions, no allergic warnings, Origin"
343,280.0,50.0,210.0,20.0,220.0," Cottage cheese and tomato on rye bread (280 calories per portion, 2 portions, contains dairy, Russian origin)
"," Fruit Salad - 50kcals per portion, 2 portions
   Origin"," Caramelized Onion Tartlet - 210 kcals per portion, 3 portions, contains gluten, dairy (France)", Moroccan Mint Tea, Lentil and Vegetable Stir Fry
344,300.0,100.0,180.0,20.0,180.0," Yogurt parfait with granola and fruit - 300 calories per portion, 1 portion, may contain gluten, origin"," Mint Yogurt Dip with Vegetable Sticks - 100kcals per portion, 2 portions
    Origin", Mini quiche bites, Moroccan Mint Tea," Lentil and vegetable soup - 180 calories per portion, 6 portions, none
"
345,320.0,80.0,220.0,20.0,220.0," Sweet corn pancakes with tomato and avocado salsa (320 calories per portion, 2 portions, nut-free, American origin)
", Apple with Cinnamon, Veggie-Stuffed Pita Pockets, Moroccan Mint Tea, Quinoa and Vegetable Stir Fry
346,250.0,100.0,90.0,20.0,200.0, Stuffed French Toast, Tomato Basil Bruschetta," Vegan Sweet Potato Toast - 90 kcals per portion, 4 portions, no allergic warnings, origin", Moroccan Mint Tea," Lentil curry - 200 calories per portion, 6 portions, contains gluten (India)
"
347,200.0,90.0,150.0,20.0,180.0, Vegan Banana Bread, Quinoa Energy Bites, Strawberry Bruschetta, Moroccan Mint Tea," Caprese Skewers - 180kcals per portion, 4 portions, contains dairy (Italy)
"
348,200.0,100.0,100.0,20.0,200.0, Vegan Breakfast Tacos, Chilled Gazpacho, Edamame, Moroccan Mint Tea," Stuffed grape leaves (Dolmas) - 200 calories per portion, 4 portions, contains nuts (Middle East)
"
349,250.0,70.0,100.0,20.0,200.0, Spinach and Mushroom Oatmeal, Kale chips, Hummus with Veggies, Moroccan Mint Tea," Minestrone soup - 200 calories per portion, 6 portions, contains gluten (Italy)
"
350,300.0,100.0,180.0,20.0,200.0," Avocado toast - 300 calories per portion, 2 portions, may contain gluten, origin", Rice Paper Spring Rolls, Crispy Tofu Bites, Moroccan Mint Tea, Mediterranean Quinoa Bowl
351,300.0,90.0,180.0,20.0,180.0, Apple Cinnamon French Toast Casserole, Quinoa Energy Bites, Mini Crab Cakes, Moroccan Mint Tea, Vegan Ratatouille
352,250.0,100.0,120.0,20.0,200.0, Ragi (Finger Millet) Pancakes, Watermelon Fruit Pizza, Miso Soup with Tofu, Moroccan Mint Tea," Spanakopita - 200 calories per portion, 6 portions, contains gluten and dairy (Greece)
"
353,250.0,80.0,160.0,20.0,150.0," Overnight oats with berries and almond milk (250 calories per portion, 2 portions, nut-free, American origin)
", Fruit Salad, Roasted Eggplant Dip, Moroccan Mint Tea, Spinach and Feta Stuffed Mushrooms
354,250.0,90.0,90.0,20.0,200.0, Avocado Toast, Rice Paper Rolls, Baked Parmesan Zucchini Bites, Moroccan Mint Tea," Lentil Spinach Salad - 200 calories per portion, 4 portions, None, Various
"
355,300.0,100.0,170.0,20.0,170.0, Shakshuka, Vegetable Crudité with Hummus, Mushroom Bruschetta, Moroccan Mint Tea, Vegan Caprese Salad
356,300.0,100.0,300.0,20.0,200.0, Vegan Berry Protein Smoothie Bowl, Fresh Fruit Salad, Chicken Satay with Peanut Sauce, Moroccan Mint Tea," Stuffed Acorn Squash - 200 calories/portion, 4 portions, Origin"
357,300.0,100.0,320.0,20.0,180.0," Turkish Menemen with eggs, tomatoes, and peppers (300kcals per portion, 2 portions, origin", Chilled Gazpacho Soup - Approx," Nachos with Guacamole - 320 kcals per portion, 2 portions, contains dairy (Mexico)", Moroccan Mint Tea," Ratatouille - 180kcals per portion, 4 portions, vegan (France)
"
358,200.0,80.0,180.0,20.0,200.0," Yogurt and fruit smoothie (200 calories per portion, 2 portions, contains dairy, American origin)
", Fresh Watermelon Slices - Approx, Guacamole with vegetable sticks, Moroccan Mint Tea," Greek-style stuffed zucchini - 200 calories per portion, 4 portions, none (Greece)
"
359,200.0,100.0,100.0,20.0,200.0, Vegan Chocolate Chia Pudding - 200 calories per portion | 2 portions | None | Origin, Fruit Salad, Baked Zucchini Fries, Moroccan Mint Tea," Lentil Spinach Salad - 200 calories per portion, 4 portions, None, Various
"
360,250.0,100.0,250.0,20.0,200.0, Ragi (Finger Millet) Pancakes, Toasted Coconut Chips, Mini Beef Sliders, Moroccan Mint Tea, Greek Salad
361,300.0,100.0,80.0,20.0,150.0, Vegan Chocolate Protein Shake - 300 calories per portion | 1 portion | None | Origin, Baked Zucchini Chips - Approx, Roasted Cauliflower Bites, Moroccan Mint Tea, Greek Salad
362,250.0,100.0,120.0,20.0,200.0, Vegan Breakfast Sushi, Baked Apple Chips, Hummus and Pita, Moroccan Mint Tea," Greek stuffed bell peppers - 200 calories per portion, 4 portions, none (Greece)
"
363,250.0,100.0,320.0,20.0,213.0, Overnight Chia Oats, Overnight Chia Pudding, Spicy Peanut Noodles, Moroccan Mint Tea, Lentil Soup
364,300.0,100.0,200.0,20.0,240.0," Cheese omelette - 300 calories per portion, 1 portion, no allergic warnings, origin", Fruit Smoothie Popsicles - Approx, Mini Quiches, Moroccan Mint Tea, Vegetable Fried Rice
365,250.0,60.0,160.0,20.0,119.0, Tropical Smoothie, Cucumber and tomato salad," Vegan Bruschetta Pasta Salad - 160 kcals per portion, 4 portions, no allergic warnings, origin", Moroccan Mint Tea, Vegan Gazpacho
