,breakfast_calories,morning snacks_calories,afternoon snacks_calories,lunch_calories,dinner_calories,breakfast,morning snacks,afternoon snacks,lunch,dinner
330,400.0,100.0,230.0,20.0,320.0," Quinoa porridge with coconut milk - 400 calories per portion, 2 portions, no allergic warnings, origin"," Raspberry Yogurt Popsicles - 100kcals per portion, 2 portions
    Origin"," Baba Ganoush with Pita Bread - 230 kcals per portion, 4 portions, contains gluten (Middle East)", Moroccan Mint Tea," Vegan lasagna with cashew cheese – 320 calories per portion, 4 portions, vegan-friendly (origin"
331,400.0,70.0,250.0,100.0,380.0, Mushroom Breakfast Burrito, Fresh Fruit Salad, Falafel with Tahini Sauce, Israeli salad," Quinoa-Stuffed Bell Peppers with Cheese - 380kcals per portion, 4 portions, contains dairy
"
332,300.0,100.0,120.0,100.0,285.0, Saffron Yogurt with Fruit, Rice Paper Spring Rolls," Caprese salad skewers (cherry tomatoes, mozzarella, basil)", Israeli salad, Stuffed Bell Peppers
333,200.0,100.0,120.0,100.0,350.0, Congee, Caprese Skewers," Roasted Cauliflower Bites - 120 kcals per portion, 4 portions, no allergic warnings, origin", Israeli salad," Mexican Quinoa Stuffed Zucchini - 350 calories/portion, 4 portions, contains gluten (Mexico)
"
334,350.0,100.0,180.0,100.0,300.0," Veggie sausage and hash browns (350 calories per portion, 2 portions, contains soy, American origin)
", Chilled Gazpacho, Bacon-Wrapped Dates, Israeli salad, Shrimp and Broccoli Stir-Fry
335,450.0,100.0,90.0,20.0,200.0, Vegan Blueberry Muffins, Zesty Lime Popcorn - Approx," Guacamole with Tortilla Chips - 90 kcals per portion, 4 portions, allergic warning (avocado), origin", Moroccan Mint Tea, Greek Stuffed Peppers
336,300.0,100.0,220.0,20.0,300.0," Moroccan mint tea with almond cookies (300kcals per portion, 2 portions, nut allergies, origin", Roasted Pumpkin Seeds, Ratatouille, Moroccan Mint Tea," Quinoa Salad with Roasted Vegetables - 300 calories per portion, 4 portions, no allergic warnings, Origin"
337,320.0,100.0,200.0,20.0,250.0," Tomato and mozzarella bruschetta (320 calories per portion, 2 portions, contains dairy, Italian origin)
", Som Tam (Papaya Salad), Avocado toast, Moroccan Mint Tea," Vegetable Curry Puffs - 250 calories/portion, 4 portions, contains gluten (Various)
"
338,300.0,50.0,150.0,20.0,380.0, Vegan French Toast," Fruit Salad - 50kcals per portion, 2 portions
   Origin", Mini crustless quiche with spinach and feta, Moroccan Mint Tea," Vegetable Curry with Chickpeas - 380kcals per portion, 4 portions, contains legumes
"
339,250.0,100.0,120.0,20.0,250.0, Greek Yogurt Parfait Bowl, Fresh Juice - Approx," Vegan Lentil Soup - 120 kcals per portion, 4 portions, no allergic warnings, origin", Moroccan Mint Tea, Mediterranean Couscous Salad
340,350.0,100.0,120.0,100.0,200.0," Ethiopian injera (sourdough flatbread) with lentil stew (350kcals per portion, 2 portions, origin", Quinoa Energy Bites, Tuna Stuffed Avocado, Israeli salad," Mediterranean Stuffed Tomatoes - 200 calories/portion, 4 portions, Origin"
341,200.0,100.0,90.0,20.0,250.0, Vegan Breakfast Phyllo Cups," Raspberry Yogurt Popsicles - 100kcals per portion, 2 portions
    Origin", Zucchini Pizza Bites, Moroccan Mint Tea," Veggie fajitas - 250 calories per portion, 4 portions, contains gluten (Mexico)
"
342,150.0,90.0,200.0,20.0,294.0, Scrambled Tofu, Vegetarian Spring Rolls, Stuffed tomatoes with couscous and vegetables, Moroccan Mint Tea, Vegan Lentil Sloppy Joes
343,250.0,100.0,250.0,20.0,300.0, Mozzarella and Tomato Bruschetta, Cucumber Sandwich," Fiery Veggie Stir-Fry - 250 kcals per portion, 2 portions, contains soy (Various)", Moroccan Mint Tea, Lentil Sloppy Joes
344,300.0,80.0,150.0,20.0,250.0, Hash Brown Casserole, Stuffed Dates, Baked Sweet Potato Wedges, Moroccan Mint Tea," Italian Wedding Soup - 250 calories per portion, 6 portions, contains gluten (pasta), Origin"
345,400.0,80.0,160.0,20.0,350.0," Chinese congee with chicken and ginger (400kcals per portion, 2 portions, origin", Energy Balls," Cucumber Bites with Herbed Cream Cheese - 160 kcals per portion, 4 portions, contains dairy (Various)", Moroccan Mint Tea," Sweet potato and black bean tacos - 350 calories per portion, 4 portions, contains gluten
"
346,400.0,100.0,120.0,20.0,220.0, Vegan Chocolate Waffles, Roasted Edamame," Caprese salad skewers (cherry tomatoes, mozzarella, basil)", Moroccan Mint Tea, Lentil and Vegetable Stir Fry
347,400.0,100.0,90.0,20.0,200.0, Sourdough Biscuits and Mushroom Gravy, Fresh Juice - Approx, Watermelon and Mint Salad, Moroccan Mint Tea," Lentil curry - 200 calories per portion, 6 portions, contains gluten (India)
"
348,200.0,100.0,300.0,20.0,250.0, Avocado Toast, Cucumber and Tomato Salad, Mini meatball lettuce wraps, Moroccan Mint Tea," Italian Wedding Soup - 250 calories per portion, 6 portions, contains gluten (pasta), Origin"
349,450.0,100.0,180.0,100.0,220.0," Persian barbari bread with feta and cucumber (450kcals per portion, 2 portions, origin", Caprese Skewers, Mini Margherita Skewers, Israeli salad," Shrimp Stir-Fry with Vegetables - 220 calories per portion, 4 portions, contains shellfish, Origin"
350,100.0,100.0,180.0,100.0,200.0, Vegan Breakfast Falafel, Caprese Skewers," Berry Parfait - 180 kcals per portion, 2 portions, contains dairy (Various)", Israeli salad, Lentil and Vegetable Bolognese
351,250.0,100.0,150.0,20.0,350.0, Greek Yogurt with Honey and Nuts, Cucumber and Hummus Rolls, Cilantro lime shrimp skewers, Moroccan Mint Tea," Greek Spinach Pie - 350 calories/portion, 4 portions, contains gluten and dairy (Greece)
"
352,320.0,80.0,210.0,20.0,80.0," Sweet corn pancakes with tomato and avocado salsa (320 calories per portion, 2 portions, nut-free, American origin)
", Fresh Watermelon Slices - Approx," Caramelized Onion Tartlet - 210 kcals per portion, 3 portions, contains gluten, dairy (France)", Moroccan Mint Tea," Spinach and feta stuffed mushrooms - 80 calories per portion, 6 portions, contains dairy (Greece)
"
353,250.0,100.0,440.0,20.0,300.0, Stuffed French Toast, Baked Apple Chips, Vegan Chili, Moroccan Mint Tea, Lentil Bolognese
354,200.0,80.0,100.0,20.0,350.0, Spinach Tomato Feta Frittata, Avocado Deviled Eggs, Thai Fresh Spring Rolls, Moroccan Mint Tea," Quinoa and Black Bean Burritos - 350 calories/portion, 4 portions, Origin"
355,250.0,100.0,120.0,100.0,360.0, Vegan Breakfast Sushi Rolls, Chilled Gazpacho, Greek Yogurt with Berries, Israeli salad," Egg Fried Rice - 360kcals per portion, 4 portions, contains egg (China)
"
356,300.0,100.0,250.0,20.0,300.0, Pancakes with Maple Syrup, Cucumber Rolls with Hummus - Approx, Mini Falafel Burgers, Moroccan Mint Tea," Tuscan white bean and vegetable soup (300 calories per portion, 4 portions, vegan-friendly, origin"
357,400.0,100.0,160.0,100.0,300.0," Italian breakfast panini with prosciutto and mozzarella - 400 calories per portion, 1 portion, contains gluten and dairy, origin", Caprese Skewers, Vegan Spinach and Mushroom Puff Pastry, Israeli salad," Cauliflower Tikka Masala - 300 calories per portion, 4 portions, None, India

"
358,250.0,100.0,90.0,20.0,350.0, Vegan Oatmeal Chocolate Chip Cookies - 250 calories per portion | 2 portions | Contains gluten | Origin, Frozen Grapes, Chicken spring rolls, Moroccan Mint Tea, Spinach and Mushroom Omelette
359,450.0,80.0,100.0,20.0,350.0, Veggie Breakfast Burritos, Baked Apple Chips, Cheese and bacon stuffed mushrooms, Moroccan Mint Tea," Vegan Chili - 350 calories per portion, 4 portions, None, United States
"
360,400.0,80.0,760.0,20.0,350.0, Vegan Quinoa Breakfast Skillet - 400 calories per portion | 1 portion | None | Origin," Carrot Sticks with Hummus - 80kcals per portion, 2 portions
   Origin", Vegan Cinnamon Rolls, Moroccan Mint Tea, Vegan Gyros
361,300.0,100.0,160.0,20.0,330.0," Apple cinnamon oatmeal bake - 300 calories per portion, 2 portions, contains gluten, origin", Greek Salad Skewers," Rice Cakes with Avocado - 160 kcals per portion, 3 portions, gluten-free (Various)", Moroccan Mint Tea," Lentil and Vegetable Curry - 330kcals per portion, 4 portions, contains legumes
"
362,350.0,50.0,130.0,100.0,300.0, Vegan Breakfast Polenta - 350 calories per portion | 1 portion | None | Origin, Baked Apple Chips - Approx, Mini Vegetable Quesadillas, Israeli salad," Greek Lemon Chicken Soup - 300 calories per portion, 6 portions, contains egg, Origin"
363,250.0,90.0,140.0,100.0,250.0, Vegan Chocolate Banana Smoothie, Rice Paper Rolls, Tomato Bruschetta, Israeli salad," Borscht with sour cream – 250 calories per portion, 6 portions, contains dairy (origin"
364,500.0,100.0,280.0,20.0,240.0," Pancake cereal - 500 calories per portion, 2 portions, contains gluten and dairy, origin", Fresh Juice - Approx, Veggie Bruschetta Pizza, Moroccan Mint Tea," Caprese Stuffed Avocado - 240kcals per portion, 4 portions, contains dairy (Italy)
"
365,350.0,80.0,250.0,20.0,350.0," Greek yogurt and berry parfait (350 calories per portion, 2 portions, contains dairy, Greek origin)
", Hard-Boiled Eggs, Tomato Basil Bruschetta Pizza, Moroccan Mint Tea," Chicken Noodle Stir-Fry - 350 calories per portion, 4 portions, contains gluten (soy sauce), Origin"
