,breakfast_calories,morning snacks_calories,afternoon snacks_calories,lunch_calories,dinner_calories,breakfast,morning snacks,afternoon snacks,lunch,dinner
287,200.0,210.0,200.0,300.0,180.0, Vegan Breakfast Cookies - 200 calories per portion | 2 portions | Contains gluten | Origin, Quinoa Sushi Rolls," Vegan Pancakes with Maple Syrup - 200 kcals per portion, 4 portions, no allergic warnings, origin"," Chickpea Curry
Total calories per portion", Rainbow Salad
288,200.0,300.0,440.0,200.0,250.0, Vegan Breakfast Quiche Lorraine, Vegan Vegetable Samosas, Vegan Chili, Avocado and Cucumber Sushi Rolls," Greek Vegan Gigantes (250 calories/portion, 4 portions) - Greece
"
289,150.0,260.0,100.0,350.0,150.0, Vegan Energy Balls - 150 calories per portion | 2 portions | Contains nuts | Origin, Vegan Blueberry Scones," Vegan Energy Balls - 100 kcals per portion, 4 portions, no allergic warnings, origin", Vegan Sweet Potato Curry, Lentil Soup with Kale
290,250.0,260.0,150.0,400.0,250.0, Vegan Breakfast Quesadilla, Vegan Blueberry Muffins," Vegan Chocolate Avocado Mousse - 150 kcals per portion, 4 portions, allergic warning (avocado), origin", Chana Masala, Vegan Tofu Scramble
291,350.0,150.0,120.0,450.0,250.0, Vegan Pear and Walnut Oatmeal - 350 calories per portion | 1 portion | Contains nuts | Origin, Vegan Banana Pancakes," Vegan Oatmeal Raisin Cookies - 120 kcals per portion, 4 portions, no allergic warnings, origin"," Mexican Quinoa Stuffed Peppers
Total calories per portion", Vegan Caesar Salad
292,300.0,180.0,560.0,550.0,250.0, Vegan Breakfast Bars - 300 calories per portion | 1 portion | Contains nuts | Origin, Oatmeal Raisin Cookies, Vegan Chickpea Salad Sandwich," Thai Sweet and Spicy Noodles
Total calories per portion", Stuffed Bell Peppers
293,250.0,210.0,60.0,400.0,220.0, Vegan Breakfast Quesadilla, Quinoa Sushi Rolls," Sliced Apples with Cinnamon - 60 kcals per portion, 4 portions, no allergic warnings, origin"," Quinoa Black Bean Burgers
Total calories per portion", Quinoa and Vegetable Stir Fry
294,350.0,200.0,90.0,300.0,250.0, Vegan Kale and Potato Frittata - 350 calories per portion | 1 portion | None | Origin, Vegan Lemon Poppy Seed Muffins," Bruschetta with Fresh Tomatoes and Basil - 90 kcals per portion, 4 portions, no allergic warnings, origin", Ratatouille, Ratatouille-Stuffed Zucchini
295,250.0,250.0,120.0,200.0,220.0, Vegan Breakfast Quesadilla, Almond Butter Toast," Roasted Cauliflower Bites - 120 kcals per portion, 4 portions, no allergic warnings, origin", Vegan Mexican Street Corn, Lentil and Vegetable Stir Fry
296,150.0,150.0,160.0,400.0,250.0, Vegan Egg Muffins - 150 calories per portion | 2 portions | None | Origin, Chia Pudding, Vegan Mexican Street Corn," Vegan Goulash with Seitan
Total calories per portion", Tofu Tikka Masala
297,300.0,180.0,200.0,400.0,250.0, Vegan Granola - 300 calories per portion | 1 portion | Contains nuts | Origin, Pumpkin Energy Bars," Vegan Strawberry Banana Smoothie - 200 kcals per portion, 4 portions, no allergic warnings, origin"," Moroccan Vegetable Tagine
Total calories per portion", Vegetable Curry
298,250.0,200.0,160.0,350.0,200.0, Vegan Coconut Yogurt with Fruit - 250 calories per portion | 1 portion | None | Origin, Vegan Chia Seed Pancakes," Vegan Raspberry Bars - 160 kcals per portion, 4 portions, no allergic warnings, origin"," Vegan Teriyaki Tofu Stir-Fry
Total calories per portion"," Black Bean and Corn Salad - 200 calories per portion, 4 portions, None, Various
"
299,250.0,120.0,160.0,350.0,200.0, Vegan Overnight Chia Pudding - 250 calories per portion | 2 portions | None | Origin, Vegan Energy Balls," Vegan Spinach and Mushroom Tartlets - 160 kcals per portion, 4 portions, no allergic warnings, origin", Vegan Meatball Sub, Butternut Squash Soup
300,350.0,250.0,340.0,400.0,200.0, Vegan Breakfast Baked Potato - 350 calories per portion | 1 portion | None | Origin, Trail Mix, Vegan Nachos," Mexican Bean Burrito Bowl
Total calories per portion"," Italian Vegan Bruschetta (200 calories/portion, 4 portions) - Italy
"
301,300.0,300.0,120.0,250.0,180.0, Vegan Oatmeal Raisin Cookies, Vegan Vegetable Samosas," Vegan Almond Butter Energy Balls - 120 kcals per portion, 4 portions, allergic warning (almonds), origin"," Vegan Pumpkin Soup
Total calories per portion", Tofu Stir-Fry
302,300.0,150.0,170.0,300.0,270.0, Vegan Chocolate Protein Shake - 300 calories per portion | 1 portion | None | Origin, Vegan Banana Pancakes," Roasted Red Pepper Hummus with Pita Bread - 170 kcals per portion, 4 portions, no allergic warnings, origin"," Thai Mango Salad
Total calories per portion", Mexican Quinoa Bowl
303,300.0,280.0,200.0,500.0,250.0, Vegan Breakfast Parfait, Vegan Cinnamon Roll Pancakes," Quinoa Salad with Roasted Vegetables - 200 kcals per portion, 4 portions, no allergic warnings, origin", Veggie Burger with Sweet Potato Fries, Stuffed Bell Peppers
304,200.0,180.0,150.0,450.0,280.0, Vegan Oatmeal Raisin Cookies - 200 calories per portion | 2 portions | Contains gluten | Origin, Banana Bread," Vegan Chocolate Avocado Mousse - 150 kcals per portion, 4 portions, allergic warning (avocado), origin"," Mexican Quinoa Stuffed Peppers
Total calories per portion", Vegan Stuffed Shells
305,350.0,200.0,320.0,350.0,200.0, Vegan Breakfast Stuffed Peppers, Chocolate Chia Pudding, Vegan Mediterranean Flatbread Pizza, Vegan BBQ Sandwich, Greek Salad
306,250.0,130.0,110.0,250.0,200.0, Vegan Breakfast Oats and Berries, Almond Butter Stuffed Dates," Oatmeal Raisin Energy Balls - 110 kcals per portion, 4 portions, no allergic warnings, origin"," Italian Minestrone Soup
Total calories per portion", Lentil and Vegetable Bolognese
307,350.0,150.0,360.0,250.0,150.0, Vegan Mushroom and Spinach Omelette - 350 calories per portion | 1 portion | None | Origin, Oatmeal Raisin Cookies, Vegan Mushroom Soup, Lentil Salad, Veggie Stir-Fry
308,200.0,180.0,180.0,400.0,250.0, Vegan Breakfast Quiche Lorraine, Antipasto Skewers," Vegan Banana Bread - 180 kcals per portion, 4 portions, no allergic warnings, origin", Vegan Moroccan Vegetable Tagine, Vegan Sushi Bowl
309,350.0,180.0,150.0,300.0,200.0, Vegan Breakfast Bars, Vegan Breakfast Quinoa, Vegan Banana Bread, Vegan Stuffed Bell Peppers with Quinoa and Black Beans, Greek Stuffed Peppers
310,50.0,350.0,150.0,350.0,150.0, Vegan Breakfast Smoothie, Veggie Wrap," Vegan Ratatouille - 150 kcals per portion, 4 portions, no allergic warnings, origin", Vegan Stuffed Zucchini, Butternut Squash Soup
311,300.0,220.0,200.0,300.0,220.0, Vegan Oatmeal Raisin Cookies, Vegan Protein Bars, Vegan Chocolate Covered Strawberries, Vegan Greek Moussaka, Quinoa and Vegetable Stir Fry
312,300.0,150.0,200.0,350.0,220.0, Berry Quinoa Breakfast Bowl - 300 calories per portion | 1 portion | Contains nuts | Origin, Vegan Cinnamon Sugar Donuts," Vegan Mango Smoothie Bowl - 200 kcals per portion, 4 portions, no allergic warnings, origin"," Vegetable Stir-Fry with Tofu
Total calories per portion", Quinoa and Vegetable Stir Fry
313,50.0,260.0,130.0,400.0,150.0, Vegan Breakfast Energy Balls, Vegan Blueberry Scones," Oven-Baked Sweet Potato Fries - 130 kcals per portion, 4 portions, no allergic warnings, origin", Vegan Jackfruit Curry, Butternut Squash Soup
314,350.0,300.0,280.0,400.0,280.0, Quinoa Porridge - 350 calories per portion | 1 portion | Contains nuts | Origin, Vegan Protein Smoothie Bowl, Vegan Lemon Poppy Seed Muffins," Vegan Gnocchi with Pesto Sauce
Total calories per portion", Vegan Tikka Masala
315,250.0,200.0,130.0,300.0,250.0, Vegan Overnight Chia Pudding - 250 calories per portion | 2 portions | None | Origin, Vegan Protein Pancakes," Stuffed Mini Portobello Mushrooms - 130 kcals per portion, 4 portions, no allergic warnings, origin", Greek Style Chickpea Sandwich," Moroccan Vegan Zaalouk (250 calories/portion, 4 portions) - Morocco
"
316,50.0,180.0,440.0,250.0,250.0, Vegan Breakfast Energy Balls, Pita Bread with Baba Ganoush, Vegan Gyoza, Veggie Soba Noodles," Roasted Cauliflower Tacos - 250 calories per portion, 4 portions, None, Mexico
"
317,300.0,250.0,90.0,300.0,220.0, Vegan Breakfast Spring Rolls - 300 calories per portion | 1 portion | Contains soy | Origin, Quinoa Salad with Veggies," Baked Zucchini Chips - 90 kcals per portion, 4 portions, no allergic warnings, origin", Lebanese Tabbouleh Salad, Lentil and Vegetable Stir Fry
318,250.0,150.0,160.0,300.0,250.0, Vegan Breakfast Oats and Berries, Cucumber Avocado Rolls," Grilled Portobello Mushroom Burger - 160 kcals per portion, 4 portions, no allergic warnings, origin", Vegan Greek Moussaka, Buddha Bowl
319,300.0,220.0,280.0,250.0,260.0, Vegan Breakfast Tacos - 300 calories per portion | 2 portions | None | Origin, Guacamole with Tortilla Chips, Vegan Chocolate Mousse, Vegan Sushi Rolls, Mexican Stuffed Zucchini
320,300.0,220.0,120.0,400.0,285.0, Vegan Pumpkin Spice Granola - 300 calories per portion | 1 portion | Contains nuts | Origin, Vegan Banana Muffins," Vegan Oatmeal Raisin Cookies - 120 kcals per portion, 4 portions, no allergic warnings, origin"," Quinoa Salad with Roasted Vegetables
Total calories per portion", Stuffed Bell Peppers
321,250.0,150.0,160.0,250.0,250.0, Vegan Banana Bread - 250 calories per portion | 2 portions | Contains gluten | Origin, Baked Sweet Potato Fries," Chickpea Salad Lettuce Wraps - 160 kcals per portion, 4 portions, no allergic warnings, origin", Vegan Sushi Rolls, Moroccan Chickpea Stew
322,250.0,250.0,580.0,200.0,280.0, Vegan Oatmeal Raisin Overnight Oats - 250 calories per portion | 2 portions | Contains gluten | Origin, Quinoa Salad with Veggies, Falafel with Tahini Sauce, Vegan Spaghetti Aglio e Olio, Roasted Cauliflower Tacos
323,350.0,150.0,180.0,350.0,150.0, Vegan Breakfast Quinoa Bowl - 350 calories per portion | 1 portion | Contains nuts | Origin, Coconut Chia Pudding," Quinoa Stuffed Bell Peppers - 180 kcals per portion, 4 portions, no allergic warnings, origin", Tofu and Vegetable Kebabs, Ratatouille
324,350.0,200.0,200.0,300.0,250.0, Vegan Breakfast Banana Bread, Quinoa Stuffed Mushrooms," Vegan Mango Smoothie Bowl - 200 kcals per portion, 4 portions, no allergic warnings, origin"," Indian Aloo Gobi
Total calories per portion"," Vegan Caesar Salad - 250 calories per portion, 4 portions, None, United States
"
325,150.0,350.0,70.0,550.0,250.0, Vegan Energy Balls - 150 calories per portion | 2 portions | Contains nuts | Origin, Vegan Breakfast Burrito," Fruit Salad - 70 kcals per portion, 4 portions, no allergic warnings, origin"," Spicy Thai Peanut Noodles
Total calories per portion"," Vegan Black Bean Soup - 250 calories per portion, 3 portions, may contain gluten"
326,250.0,150.0,140.0,200.0,250.0, Vegan Oatmeal Raisin Overnight Oats - 250 calories per portion | 2 portions | Contains gluten | Origin, Vegan Cereal with Almond Milk," Vegan Spinach Dip with Pita Chips - 140 kcals per portion, 4 portions, no allergic warnings, origin", Greek Salad with Tofu, Mediterranean Couscous Salad
327,250.0,150.0,140.0,200.0,250.0, Vegan Breakfast Oats and Berries, Roasted Chickpeas," Vegan Greek Salad - 140 kcals per portion, 4 portions, no allergic warnings, origin", Vegan Spinach and Artichoke Dip, Quinoa Salad
328,350.0,180.0,180.0,400.0,200.0, Vegan Breakfast Grits - 350 calories per portion | 1 portion | None | Origin, Vegan Zucchini Bread," Roasted Chickpea Salad - 180 kcals per portion, 4 portions, no allergic warnings, origin", Quinoa and Vegetable Stir-Fry, Zucchini Noodles with Pesto
329,250.0,220.0,90.0,250.0,150.0, Vegan Berry Parfait - 250 calories per portion | 2 portions | Contains nuts | Origin, Vegan Apple Cinnamon Muesli," Caprese Skewers with Vegan Mozzarella - 90 kcals per portion, 4 portions, no allergic warnings, origin", Vegan Asian Slaw, Greek Salad
330,350.0,150.0,120.0,400.0,160.0, Vegan Breakfast Burrito Bowl, Chocolate Avocado Mousse, Guacamole and Veggie Sticks, Vegan Thai Basil Tofu Stir-Fry," Vegan Mediterranean Couscous Salad - 160 calories per portion, 3 portions, may contain gluten"
331,300.0,130.0,180.0,300.0,250.0, Vegan Cinnamon Rolls - 300 calories per portion | 1 portion | Contains gluten | Origin, Almond Butter Stuffed Dates," Vegan Blueberry Muffins - 180 kcals per portion, 4 portions, no allergic warnings, origin", Lentil and Spinach Curry," Vegan Caesar Salad - 250 calories per portion, 4 portions, None, United States
"
332,250.0,220.0,80.0,300.0,200.0, Vegan Breakfast Crepes, Vegan Chocolate Chip Waffles, Vegan Peanut Butter Energy Bars," Quinoa Stuffed Bell Peppers
Total calories per portion", Vegan Bibimbap
333,350.0,300.0,120.0,300.0,250.0, Tofu Scramble, Vegan Cinnamon French Toast," Black Bean Salsa with Tortilla Chips - 120 kcals per portion, 4 portions, no allergic warnings, origin", Vegan Chinese Hot and Sour Soup, Cauliflower Buffalo Wings
334,250.0,250.0,300.0,350.0,250.0, Vegan Raspberry Almond Scones - 250 calories per portion | 2 portions | Contains gluten and nuts | Origin, Vegan Peanut Butter Banana Pancakes, Veggie Spring Rolls, Sweet Potato and Black Bean Enchiladas," Moroccan Vegan Harira Soup (250 calories/portion, 4 portions) - Morocco

"
335,250.0,250.0,280.0,250.0,160.0, Vegan Breakfast Crepes, Vegan Protein Brownies, Vegan Chocolate Mousse, Veggie Sushi Bowl," Vegan Mediterranean Couscous Salad - 160 calories per portion, 3 portions, may contain gluten"
336,300.0,250.0,120.0,550.0,160.0, Vegan Breakfast Stromboli, Overnight Oats," Vegan Cucumber Sushi Rolls - 120 kcals per portion, 4 portions, no allergic warnings, origin"," Vegan Mushroom Risotto
Total calories per portion"," Vegan Lentil and Vegetable Shepherd's Pie - 160 calories per portion, 4 portions, may contain gluten"
337,250.0,250.0,440.0,250.0,150.0, Vegan Blueberry Muffin Overnight Oats - 250 calories per portion | 2 portions | Contains gluten | Origin, Vegan Peanut Butter and Jelly Overnight Oats, Vegan Roasted Red Pepper Dip, Greek Salad, Swiss Chard and Lentil Soup
338,250.0,200.0,100.0,350.0,250.0, Vegan Oatmeal Chocolate Chip Cookies - 250 calories per portion | 2 portions | Contains gluten | Origin, Vegan Yogurt Parfait," Stuffed Mini Peppers with Vegan Cream Cheese - 100 kcals per portion, 4 portions, no allergic warnings, origin", Vegan Tacos with Avocado Salsa," Greek Vegan Revithokeftedes (250 calories/portion, 4 portions) - Greece

Please note that the calorie counts are approximate and may vary based on specific ingredient choices and preparation methods"
339,250.0,200.0,420.0,300.0,250.0, Tofu Scramble - 250 calories per portion | 2 portions | None | Origin, Vegan Energy Muffins, Vegan Potato Salad, Vegan Sweet and Sour Tofu, Tofu Tikka Masala
340,250.0,150.0,90.0,300.0,200.0, Vegan Oatmeal Chocolate Chip Cookies - 250 calories per portion | 2 portions | Contains gluten | Origin, Hummus and Veggie Sticks," Baked Zucchini Chips - 90 kcals per portion, 4 portions, no allergic warnings, origin"," Middle Eastern Falafel Salad
Total calories per portion", Lentil and Vegetable Bolognese
341,300.0,180.0,200.0,400.0,220.0, Vegan Breakfast Spring Rolls - 300 calories per portion | 1 portion | Contains soy | Origin, Apple Cinnamon Muffins," Vegan Baked Raspberry Oatmeal - 200 kcals per portion, 4 portions, no allergic warnings, origin", Vegan Pad Thai, Lentil and Kale Soup
342,250.0,300.0,600.0,200.0,250.0, Vegan Breakfast Quesadilla, Vegan Chocolate Banana Bread, Vegan Shepherd's Pie," Spanish Gazpacho
Total calories per portion"," Greek Vegan Fava Beans (250 calories/portion, 4 portions) - Greece
"
343,300.0,120.0,120.0,250.0,250.0, Vegan Oatmeal Raisin Cookies, Vegan Energy Balls," Vegan Chocolate Chip Cookies - 120 kcals per portion, 4 portions, no allergic warnings, origin", Vegan Lentil Salad," Vegan Tofu and Vegetable Skewers - 250 calories per portion, 2 portions, may contain soy"
344,250.0,200.0,320.0,400.0,250.0, Vegan Breakfast Bruschetta - 250 calories per portion | 2 portions | Contains gluten | Origin, Vegan Protein Pancakes, Vegan Breaded Zucchini Sticks, Coconut Curry with Tofu," Vegan Black Bean Soup - 250 calories per portion, 3 portions, may contain gluten"
345,150.0,250.0,320.0,350.0,250.0, Vegan Breakfast Pita Pockets, Rice Pudding, Quinoa Salad," Eggplant Parmesan
Total calories per portion", Portobello Mushroom Burger
346,350.0,200.0,120.0,250.0,208.0, Vegan Pear and Walnut Oatmeal - 350 calories per portion | 1 portion | Contains nuts | Origin, Chocolate Chia Pudding," Vegan Pumpkin Spice Energy Balls - 120 kcals per portion, 4 portions, no allergic warnings, origin", Vegan Mushroom Risotto, Spinach and Mushroom Quesadillas
347,350.0,250.0,150.0,250.0,200.0, Vegan Pear and Walnut Oatmeal - 350 calories per portion | 1 portion | Contains nuts | Origin, Raspberries and Cream Oatmeal," Cucumber and Avocado Sushi Rolls - 150 kcals per portion, 4 portions, allergic warning (avocado), origin", Vegan Sushi Rolls, Quinoa Stuffed Mushrooms
348,300.0,250.0,80.0,350.0,100.0, Vegan Breakfast Spring Rolls - 300 calories per portion | 1 portion | Contains soy | Origin, Vegan Berry Crumble, Energy Balls, Vegan Cajun Jambalaya," Japanese Miso Soup with Tofu (100 calories/portion, 4 portions) - Japan
"
349,200.0,150.0,120.0,450.0,240.0, Vegan Breakfast Enchiladas, Rainbow Veggie Skewers," Vegan Coconut Lime Energy Balls - 120 kcals per portion, 4 portions, no allergic warnings, origin"," Vegan Lasagna
Total calories per portion", Vegan Lentil Soup
350,50.0,200.0,240.0,250.0,213.0, Vegan Breakfast Stuffed Tomatoes, Vegan Lemon Poppy Seed Muffins, Vegan Stuffed Portobello Mushrooms," Vegan Pumpkin Soup
Total calories per portion", Lentil Soup
351,300.0,300.0,120.0,300.0,150.0, Vegan Blueberry Muffins - 300 calories per portion | 1 portion | Contains gluten | Origin, Vegan Cinnamon Funnel Cake, Vegan Caprese Skewers, Vegan Singapore Noodles," Low-Calorie Veggie Stir-Fry (150 calories/portion, 3 portions) - China
"
352,300.0,180.0,80.0,300.0,250.0, Vegan Breakfast Tiramisu, Apple Cinnamon Muffins," Veggie Spring Rolls with Peanut Sauce - 80 kcals per portion, 4 portions, allergic warning (peanuts), origin", Vegan Jamaican Jerk Tofu," Indian Aloo Gobi (250 calories/portion, 4 portions) - India
"
353,300.0,300.0,130.0,350.0,250.0, Vegan Pumpkin Spice Pancakes - 300 calories per portion | 1 portion | Contains gluten | Origin, Smoothie Bowl," Oven-Baked Sweet Potato Fries - 130 kcals per portion, 4 portions, no allergic warnings, origin", Vegan Meatball Pasta, Mediterranean Couscous Salad
354,300.0,250.0,200.0,350.0,220.0, Vegan Mango Turmeric Smoothie Bowl - 300 calories per portion | 1 portion | None | Origin, Vegan Protein Shake, Stuffed Grape Leaves," Greek Spanakopita
Total calories per portion", Quinoa and Vegetable Stir Fry
355,350.0,250.0,200.0,400.0,120.0, Vegan Mushroom and Spinach Omelette - 350 calories per portion | 1 portion | None | Origin, Overnight Oats, Vegan Thai Papaya Salad," Moroccan Couscous Salad
Total calories per portion", Cucumber and Tomato Salad
356,300.0,100.0,80.0,300.0,150.0, Vegan Blueberry Muffins - 300 calories per portion | 1 portion | Contains gluten | Origin, Roasted Pumpkin Seeds," Baked Apple Chips - 80 kcals per portion, 4 portions, no allergic warnings, origin", Vegan Jamaican Rice and Peas, Lentil Soup with Kale
357,300.0,180.0,480.0,400.0,200.0, Vegan Almond Butter Toast - 300 calories per portion | 1 portion | Contains nuts | Origin, Vegan Banana Nut Bread, Vegan Cucumber Sushi Rolls, Vegan Chickpea Tikka Masala, Spaghetti Aglio e Olio
358,350.0,250.0,240.0,400.0,150.0, Vegan Protein Pancakes - 350 calories per portion | 1 portion | Contains gluten | Origin, Vegan Chocolate Oat Bars, Veggie Sushi Rolls, Thai Red Curry with Vegetables," Lentil Soup - 150 calories per portion, 6 portions, None, Various
"
359,350.0,280.0,140.0,350.0,200.0, Vegan Breakfast Grits - 350 calories per portion | 1 portion | None | Origin, Tofu Scramble," Vegan Greek Salad - 140 kcals per portion, 4 portions, no allergic warnings, origin"," Vegetable Stir-Fry with Tofu
Total calories per portion"," Tofu Stir-Fry - 200 calories per portion, 4 portions, Soy, China
"
360,200.0,90.0,120.0,400.0,250.0, Vegan Matcha Chia Pudding - 200 calories per portion | 1 portion | None | Origin, Quinoa Energy Bites," Vegan Almond Butter Energy Balls - 120 kcals per portion, 4 portions, allergic warning (almonds), origin", Lentil and Vegetable Pot Pie, Vegan Pizza
361,350.0,180.0,200.0,300.0,208.0, Vegan Breakfast Banana Bread, Vegan Blueberry Muffins," Vegan Mango Smoothie Bowl - 200 kcals per portion, 4 portions, no allergic warnings, origin", Lentil and Vegetable Stir-Fry, Spinach and Mushroom Quesadillas
362,150.0,150.0,90.0,300.0,200.0, Vegan Pancakes, Coconut Chia Pudding," Baked Zucchini Chips - 90 kcals per portion, 4 portions, no allergic warnings, origin", Lentil Bolognese, Lentil Curry
363,250.0,250.0,120.0,400.0,160.0, Vegan Breakfast Quesadilla, Vegan Protein Donuts," Vegan Spinach and Mushroom Frittata - 120 kcals per portion, 4 portions, no allergic warnings, origin"," Vegan Ratatouille Pasta
Total calories per portion"," Vegan Quinoa and Kale Salad - 160 calories per portion, 2 portions, may contain gluten"
364,100.0,350.0,160.0,300.0,250.0, Vegan Breakfast Falafel, Veggie Wrap," Chickpea Salad Lettuce Wraps - 160 kcals per portion, 4 portions, no allergic warnings, origin", Chinese Vegetable Stir-Fry, Chickpea Salad
365,200.0,120.0,80.0,250.0,250.0, Vegan Breakfast Enchiladas, Vegan Energy Balls," Edamame Beans - 80 kcals per portion, 4 portions, no allergic warnings, origin", Vegan Thai Mango Salad," Falafel - 250 calories per portion, 4 portions, Gluten, Middle East

"
