,breakfast_calories,morning snacks_calories,afternoon snacks_calories,lunch_calories,dinner_calories,breakfast,morning snacks,afternoon snacks,lunch,dinner
344,200.0,440.0,400.0,400.0,200.0, Mexican Rice Bowl, Vegan Gyoza, Zucchini Fritters, Vegan Pastrami Reuben Sandwich, Lentil and Vegetable Bolognese
345,200.0,820.0,200.0,450.0,250.0, Stuffed Grape Leaves, Vegan Lasagna, Stuffed Grape Leaves, Mushroom Risotto, Cauliflower Buffalo Wings
346,200.0,800.0,320.0,880.0,200.0, Lentil and Vegetable Bolognese, Vegan Mexican Churros, Quinoa Salad, Jackfruit Tacos, Vegan Goulash
347,160.0,350.0,480.0,200.0,250.0, Vegan Spinach and Mushroom Puff Pastry, Vegan Ravioli, Spinach and Mushroom Quesadillas, Lentil and Vegetable Bolognese, Vegan Nachos
348,240.0,350.0,480.0,400.0,200.0, Vegan Spinach Dip with Pita Chips, Vegan BBQ Sandwich, Vegan Lentil Burgers, Vegan Carbonara, Lentil and Vegetable Bolognese
349,240.0,300.0,300.0,760.0,250.0, Vegan Spinach Dip with Pita Chips, Vegan Bao Buns, Veggie Spring Rolls, Vegan Indian Samosa Chaat, Vegan Fettuccine Alfredo
350,300.0,450.0,300.0,450.0,200.0, Jackfruit Tacos, Tomato Basil Pasta, Veggie Spring Rolls, Tomato Basil Pasta, Vegan Goulash
351,200.0,480.0,200.0,760.0,200.0, Mexican Rice Bowl, Vegan Lentil Burgers, Stuffed Grape Leaves, Vegan Indian Samosa Chaat, Lentil and Vegetable Bolognese
352,300.0,450.0,400.0,620.0,200.0, Veggie Spring Rolls, Mushroom Risotto, Zucchini Fritters, Bean Burritos, Mexican Rice Bowl
353,300.0,720.0,150.0,400.0,250.0, Couscous Salad, Vegan Black Bean Quesadillas, Vegan Banana Bread, Falafel Wrap, Vegan Fettuccine Alfredo
354,250.0,480.0,520.0,450.0,200.0, Vegan Nachos, Vegan Lentil Burgers, Vegan Spinach and Artichoke Crostini, Chickpea Tacos, Mexican Rice Bowl
355,300.0,520.0,300.0,450.0,200.0, Vegan Spaghetti Carbonara, Vegan Mac and Cheese, Veggie Spring Rolls, Chickpea Tacos, Mexican Rice Bowl
356,300.0,400.0,360.0,400.0,250.0, Couscous Salad, Sweet Potato and Black Bean Enchiladas, Vegetable Tempura, Zucchini Fritters, Cauliflower Buffalo Wings
357,320.0,300.0,520.0,320.0,250.0, Vegan Mediterranean Flatbread Pizza, Vegan Spaghetti Carbonara, Vegan Spinach and Artichoke Crostini, Vegan Mediterranean Flatbread Pizza, Cauliflower Buffalo Wings
358,150.0,560.0,520.0,300.0,200.0, Vegan Banana Bread, Vegan Pancakes, Vegan Spinach and Artichoke Crostini, Vegan Gyros, Lentil and Vegetable Bolognese
359,300.0,150.0,560.0,840.0,200.0, Jackfruit Tacos, Vegan Banana Bread, Vegan Pancakes, Vegan Tomato Bruschetta, Mexican Rice Bowl
360,150.0,350.0,560.0,960.0,250.0, Vegan Banana Bread, Vegan BBQ Sandwich, Vegan Chickpea Salad Sandwich, Vegan Meatballs with Marinara Sauce, Vegan Nachos
361,300.0,350.0,480.0,400.0,200.0, Veggie Spring Rolls, Mushroom Risotto Stuffed Peppers, Spinach and Mushroom Quesadillas, Vegan Sausage and Peppers, Vegan Goulash
362,320.0,560.0,320.0,450.0,250.0, Quinoa Salad, Vegan Pancakes, Vegan Mediterranean Flatbread Pizza, Ratatouille Tart, Cauliflower Buffalo Wings
363,250.0,560.0,560.0,460.0,200.0, Vegan Nachos, Vegan Chickpea Salad Sandwich, Vegan Chickpea Salad Sandwich, Veggie Tacos, Mexican Rice Bowl
364,250.0,400.0,560.0,460.0,200.0, Cauliflower Buffalo Wings, Vegan Pastrami Reuben Sandwich, Vegan Chickpea Salad Sandwich, Veggie Tacos, Lentil and Vegetable Bolognese
365,250.0,920.0,520.0,400.0,250.0, Cauliflower Buffalo Wings, Vegan Thai Spring Rolls, Vegan Spinach and Artichoke Crostini, Sweet Potato and Black Bean Enchiladas, Cauliflower Buffalo Wings
