,breakfast_calories,morning snacks_calories,afternoon snacks_calories,lunch_calories,dinner_calories,breakfast,morning snacks,afternoon snacks,lunch,dinner
1,200.0,120.0,120.0,150.0,350.0, Vegan Breakfast Quinoa Salad, Kale Chips," Vegan Lentil Soup - 120 kcals per portion, 4 portions, no allergic warnings, origin", Ratatouille, Vegan Lasagna
2,300.0,90.0,120.0,150.0,300.0, Vegan Breakfast Bars - 300 calories per portion | 1 portion | Contains nuts | Origin, Stuffed Dates, Guacamole and Veggie Sticks, Tom Yum Soup, Couscous Salad
3,250.0,100.0,480.0,150.0,400.0, Avocado Toast, Fresh Fruit Salad, Vegan Lentil Burgers, Ratatouille, Vegan Tofu Katsu Curry
4,400.0,100.0,740.0,150.0,150.0, Vegan Breakfast Quiche - 400 calories per portion | 1 portion | Contains gluten | Origin, Toasted Coconut Chips, Vegan Buffalo Cauliflower Wings, Lentil Soup, Lentil Soup
5,100.0,120.0,640.0,150.0,400.0, Vegan Breakfast Rice Pudding, Vegan Energy Balls, Vegan Tofu Scramble, Veggie Spring Rolls, Vegan Ramen
6,700.0,100.0,90.0,150.0,300.0, Vegan Breakfast Crepe Cake, Energy Balls," Roasted Brussels Sprouts with Balsamic Glaze - 90 kcals per portion, 4 portions, no allergic warnings, origin", Tomato Basil Soup," Moroccan Lentil Soup (300 calories/portion, 4 portions) - Morocco
"
7,300.0,100.0,130.0,150.0,300.0, Vegan Coconut Chia Pancakes - 300 calories per portion | 1 portion | Contains gluten | Origin, Overnight Chia Pudding," Vegan Thai Spring Rolls - 130 kcals per portion, 4 portions, no allergic warnings, origin", Cabbage Stir-Fry," Greek Vegan Tzatziki with Pita Bread (300 calories/portion, 2 portions) - Greece
"
8,250.0,80.0,700.0,150.0,317.0, Vegan Pancakes - 250 calories per portion | 2 portions | Contains gluten | Origin, Fruit Salad, Vegan Pad Thai, Ratatouille, Quinoa Stuffed Bell Peppers
9,350.0,100.0,760.0,150.0,450.0, Vegan Protein Pancakes - 350 calories per portion | 1 portion | Contains gluten | Origin, Fresh Fruit Salad, Vegan Indian Samosa Chaat, Tom Yum Soup," Indian Vegan Malai Kofta (450 calories/portion, 3 portions) - India
"
10,250.0,120.0,140.0,150.0,300.0, Vegan Breakfast Bruschetta, Vegan Energy Balls," Vegan Sweet Potato Wedges - 140 kcals per portion, 4 portions, no allergic warnings, origin", Tomato Basil Soup, Quinoa Fried Rice
11,300.0,120.0,380.0,150.0,300.0, Vegan Breakfast Stromboli, Vegan Energy Balls, Vegan Chocolate Chip Cookies, Tomato Basil Soup," Greek Vegan Tzatziki with Pita Bread (300 calories/portion, 2 portions) - Greece
"
12,400.0,100.0,900.0,150.0,300.0, Vegan Breakfast Stuffed Sweet Potatoes - 400 calories per portion | 1 portion | None | Origin, Fresh Fruit Salad, Vegan Stuffed Mushrooms, Tomato Basil Soup, Veggie Fajitas
13,250.0,80.0,680.0,150.0,220.0, Vegan Matcha Overnight Oats - 250 calories per portion | 2 portions | None | Origin, Fruit Salad, Vegan Broccoli Cheddar Soup, Tomato Basil Soup, Chickpea and Vegetable Stir Fry
14,250.0,100.0,130.0,150.0,450.0, Tofu Scramble - 250 calories per portion | 2 portions | None | Origin, Overnight Chia Pudding," Veggie Sushi Rolls with Spicy Tofu - 130 kcals per portion, 4 portions, no allergic warnings, origin", Lentil Soup," Vegan Vegetable Biryani - 450 calories per portion, 2 portions, may contain mustard"
15,400.0,100.0,120.0,150.0,300.0, Vegan Breakfast Tamales - 400 calories per portion | 1 portion | Contains gluten | Origin, Energy Balls," Vegan Chocolate Chip Cookies - 120 kcals per portion, 4 portions, no allergic warnings, origin", Ratatouille, Lentil and Vegetable Curry
16,250.0,90.0,200.0,150.0,250.0, Vegan Berry Parfait - 250 calories per portion | 2 portions | Contains nuts | Origin, Stuffed Dates," Quinoa Salad with Roasted Vegetables - 200 kcals per portion, 4 portions, no allergic warnings, origin", Lentil Soup, Vegan Pizza
17,650.0,100.0,140.0,150.0,240.0, Vegan Breakfast Zucchini Bread, Toasted Coconut Chips," Maple Roasted Nuts - 140 kcals per portion, 4 portions, no allergic warnings, origin", Veggie Spring Rolls, Vegetable Fried Rice
18,500.0,120.0,80.0,150.0,350.0, Vegan Breakfast Burrito, Roasted Brussels Sprouts," Baked Kale Chips - 80 kcals per portion, 4 portions, no allergic warnings, origin", Tomato Basil Soup, Falafel Wrap
19,300.0,100.0,200.0,150.0,220.0, Vegan Breakfast Spring Rolls - 300 calories per portion | 1 portion | Contains soy | Origin, Roasted Pumpkin Seeds," Vegan Mango Smoothie Bowl - 200 kcals per portion, 4 portions, no allergic warnings, origin", Cabbage Stir-Fry, Lentil and Vegetable Stir Fry
20,400.0,100.0,160.0,150.0,350.0, Vegan Breakfast Empanadas - 400 calories per portion | 1 portion | Contains gluten | Origin, Roasted Edamame," Vegan Broccoli and Cheese Bites - 160 kcals per portion, 4 portions, no allergic warnings, origin", Tom Yum Soup," Greek Vegan Gigantes Plaki (350 calories/portion, 2 portions) - Greece
"
21,400.0,100.0,160.0,150.0,400.0, Vegan Breakfast Nachos - 400 calories per portion | 1 portion | Contains soy | Origin, Toasted Coconut Chips," Vegan Spinach and Artichoke Stuffed Mushrooms - 160 kcals per portion, 4 portions, no allergic warnings, origin", Ratatouille," Moroccan Vegetable Paella (400 calories/portion, 2 portions) - Morocco
"
22,200.0,120.0,360.0,150.0,289.0, Vegan Oatmeal Raisin Cookies - 200 calories per portion | 2 portions | Contains gluten | Origin, Hummus with Veggies, Vegan Turkish Delight, Veggie Spring Rolls, Chickpea and Spinach Stew
23,400.0,80.0,640.0,150.0,400.0, Vegan Breakfast Skillet, Stuffed Dates, Vegan Tofu Scramble, Tomato Basil Soup, Vegan Pad See Ew
24,250.0,80.0,120.0,150.0,250.0, Vegan Green Breakfast Bowl - 250 calories per portion | 2 portions | None | Origin, Fruit Salad," Vegan Lentil Soup - 120 kcals per portion, 4 portions, no allergic warnings, origin", Veggie Spring Rolls," Vegan Black Bean Soup - 250 calories per portion, 3 portions, may contain gluten"
25,350.0,100.0,920.0,150.0,250.0, Quinoa Porridge - 350 calories per portion | 1 portion | Contains nuts | Origin, Roasted Pumpkin Seeds, Vegan Butter Chicken, Tomato Basil Soup," Mediterranean Quinoa Salad (250 calories/portion, 2 portions) - Greece
"
26,70.0,100.0,280.0,150.0,159.0, Fruit Salad, Roasted Almonds, Vegan Lemon Poppy Seed Muffins, Veggie Spring Rolls, Quinoa Stuffed Mushrooms
27,350.0,120.0,820.0,150.0,350.0, Vegan Breakfast Pizza - 350 calories per portion | 1 portion | Contains gluten | Origin, Kale Chips, Vegan Lasagna, Ratatouille," Vegan Cauliflower Fried Rice - 350 calories per portion, 4 portions, None, China
"
28,50.0,90.0,300.0,150.0,350.0, Vegan Breakfast Stuffed Tomatoes, Stuffed Dates, Veggie Spring Rolls, Cabbage Stir-Fry," Vegan Sweet and Sour Tofu - 350 calories per portion, 4 portions, None, China
"
29,300.0,100.0,160.0,150.0,350.0, Vegan Breakfast Potato Hash - 300 calories per portion | 1 portion | None | Origin, Roasted Pumpkin Seeds, Roasted Chickpeas, Lentil Soup, Vegan Eggplant Parmesan
30,400.0,120.0,960.0,150.0,400.0, Vegan French Toast, Roasted Chickpeas, Vegan Meatballs with Marinara Sauce, Tomato Basil Soup," Chickpea and Vegetable Tagine - 400 calories per portion, 2 portions, may contain gluten"
31,300.0,120.0,180.0,150.0,400.0, Vegan Mango Coconut Chia Pudding - 300 calories per portion | 1 portion | None | Origin, Roasted Chickpeas," Vegan Banana Bread - 180 kcals per portion, 4 portions, no allergic warnings, origin", Lentil Soup, Vegan Pad See Ew
32,50.0,120.0,140.0,150.0,300.0, Vegan Breakfast Smoothie, Kale Chips," Vegan Mediterranean Pasta Salad - 140 kcals per portion, 4 portions, no allergic warnings, origin", Ratatouille," Vegan Thai Green Curry - 300 calories per portion, 2 portions, may contain tofu"
33,300.0,120.0,160.0,150.0,100.0, Vegan Blueberry Muffins - 300 calories per portion | 1 portion | Contains gluten | Origin, Hummus with Veggies, Vegan Mexican Street Corn, Veggie Spring Rolls," Japanese Miso Soup with Tofu (100 calories/portion, 4 portions) - Japan
"
34,400.0,100.0,200.0,150.0,350.0, Vegan Cinnamon Rolls, Chilled Gazpacho," Vegan Peanut Butter Banana Smoothie - 200 kcals per portion, 4 portions, allergic warning (peanuts), origin", Tom Yum Soup, Falafel Wrap
35,700.0,80.0,400.0,150.0,350.0, Vegan Breakfast Crepe Cake, Stuffed Dates, Vegan Caesar Salad, Tom Yum Soup, Thai Red Curry
36,750.0,90.0,720.0,150.0,419.0, Vegan Breakfast Casserole, Quinoa Energy Bites, Vegetable Samosas, Tomato Basil Soup, Lentil Shepherd's Pie
37,300.0,90.0,100.0,150.0,350.0, Vegan Chocolate Banana Smoothie Bowl - 300 calories per portion | 1 portion | None | Origin, Quinoa Energy Bites," Roasted Cauliflower Hummus - 100 kcals per portion, 4 portions, no allergic warnings, origin", Ratatouille, Mushroom Risotto Stuffed Peppers
38,300.0,100.0,120.0,150.0,350.0, Vegan Breakfast Bars - 300 calories per portion | 1 portion | Contains nuts | Origin, Chilled Gazpacho," Vegan Lentil Soup - 120 kcals per portion, 4 portions, no allergic warnings, origin", Tom Yum Soup, Vegan Curry with Rice
39,350.0,100.0,90.0,150.0,200.0, Vegan Breakfast Pizza - 350 calories per portion | 1 portion | Contains gluten | Origin, Fresh Fruit Salad," Guacamole with Tortilla Chips - 90 kcals per portion, 4 portions, allergic warning (avocado), origin", Lentil Soup," Chinese Vegan Hot and Sour Soup (200 calories/portion, 4 portions) - China

"
40,150.0,120.0,160.0,150.0,300.0, Vegan Egg Muffins - 150 calories per portion | 2 portions | None | Origin, Roasted Brussels Sprouts, Vegan Mexican Street Corn, Tom Yum Soup, Stuffed Bell Peppers
41,150.0,120.0,90.0,150.0,210.0, Vegan Breakfast Fajitas, Roasted Chickpeas," Roasted Brussels Sprouts with Balsamic Glaze - 90 kcals per portion, 4 portions, no allergic warnings, origin", Tomato Basil Soup, Lentil and Vegetable Stir Fry
42,250.0,120.0,660.0,150.0,400.0, Vegan Blueberry Muffin Overnight Oats - 250 calories per portion | 2 portions | Contains gluten | Origin, Toasted Coconut Chips, Vegan Pesto Pasta, Tomato Basil Soup," Mexican Vegan Quesadillas (400 calories/portion, 2 portions) - Mexico
"
43,150.0,100.0,130.0,150.0,250.0, Vegan Breakfast Pita Pockets, Chilled Gazpacho," Stuffed Mini Portobello Mushrooms - 130 kcals per portion, 4 portions, no allergic warnings, origin", Tom Yum Soup, Mediterranean Couscous Salad
44,300.0,120.0,120.0,150.0,300.0, Vegan Pumpkin Spice Granola - 300 calories per portion | 1 portion | Contains nuts | Origin, Toasted Coconut Chips," Roasted Chickpeas - 120 kcals per portion, 4 portions, no allergic warnings, origin", Ratatouille," Vegan Thai Green Curry - 300 calories per portion, 2 portions, may contain tofu"
45,250.0,90.0,100.0,150.0,250.0, Vegan Oatmeal Chocolate Chip Cookies - 250 calories per portion | 2 portions | Contains gluten | Origin, Quinoa Energy Bites," Stuffed Mini Peppers with Vegan Cream Cheese - 100 kcals per portion, 4 portions, no allergic warnings, origin", Veggie Spring Rolls," Vegan Sushi Rolls (250 calories/portion, 4 portions) - Japan
"
46,250.0,100.0,940.0,150.0,119.0, Raw Vegan Breakfast Bars - 250 calories per portion | 2 portions | Contains nuts | Origin, Overnight Chia Pudding, Chickpea Curry with Rice, Tomato Basil Soup, Vegan Gazpacho
47,650.0,100.0,160.0,150.0,150.0, Vegan Breakfast Muesli, Roasted Edamame," Sweet Potato and Black Bean Quesadillas - 160 kcals per portion, 4 portions, no allergic warnings, origin", Tomato Basil Soup, Minestrone Soup
48,400.0,90.0,200.0,150.0,200.0, Vegan Breakfast Quiche - 400 calories per portion | 1 portion | Contains gluten | Origin, Stuffed Dates," Vegan Pancakes with Maple Syrup - 200 kcals per portion, 4 portions, no allergic warnings, origin", Tomato Basil Soup," Italian Vegan Bruschetta (200 calories/portion, 4 portions) - Italy
"
49,300.0,100.0,240.0,150.0,200.0, Vegan Breakfast Tiramisu, Toasted Coconut Chips, Vegan Stuffed Portobello Mushrooms, Cabbage Stir-Fry, Butternut Squash Soup
50,550.0,100.0,130.0,150.0,250.0, Vegan Breakfast Chili, Roasted Edamame," Veggie Sushi Rolls with Spicy Tofu - 130 kcals per portion, 4 portions, no allergic warnings, origin", Ratatouille, Vegetable Curry
51,200.0,80.0,130.0,150.0,400.0, Vegan Breakfast Quiche Lorraine, Fruit Salad," Baked Falafel with Tahini Sauce - 130 kcals per portion, 4 portions, allergic warning (sesame), origin", Tomato Basil Soup," Mexican Vegan Pozole (400 calories/portion, 3 portions) - Mexico

"
52,350.0,120.0,130.0,150.0,300.0, Vegan Breakfast Couscous - 350 calories per portion | 1 portion | Contains gluten | Origin, Roasted Brussels Sprouts," Veggie Sushi Rolls with Spicy Tofu - 130 kcals per portion, 4 portions, no allergic warnings, origin", Cabbage Stir-Fry," Lentil Tacos - 300 calories per portion, 4 portions, None, Mexico
"
53,350.0,100.0,760.0,150.0,400.0, Vegan Breakfast Croissant, Roasted Pumpkin Seeds, Vegan Indian Samosa Chaat, Ratatouille, Vegan Mapo Tofu
54,750.0,120.0,280.0,150.0,300.0, Vegan Breakfast Sweet Potato Hash, Vegan Energy Balls, Vegan Chocolate Mousse, Ratatouille, Vegan Tikka Masala
55,350.0,120.0,150.0,150.0,250.0, Vegan Apricot and Almond Granola Bars - 350 calories per portion | 1 portion | Contains nuts | Origin, Toasted Coconut Chips," Caponata Bruschetta - 150 kcals per portion, 4 portions, no allergic warnings, origin", Tom Yum Soup, Mediterranean Couscous Salad
56,300.0,120.0,200.0,150.0,350.0, Vegan Granola - 300 calories per portion | 1 portion | Contains nuts | Origin, Roasted Brussels Sprouts, Vegan Thai Papaya Salad, Tomato Basil Soup," Vegan Meatballs with Marinara Sauce - 350 calories per portion, 4 portions, Gluten, Italy
"
57,250.0,90.0,280.0,150.0,450.0, Tofu Scramble - 250 calories per portion | 2 portions | None | Origin, Quinoa Energy Bites, Vegan Lemon Poppy Seed Muffins, Ratatouille, Vegan Pad Thai
58,300.0,120.0,90.0,150.0,300.0, Vegan Coconut Chia Pancakes - 300 calories per portion | 1 portion | Contains gluten | Origin, Roasted Chickpeas," Baked Zucchini Chips - 90 kcals per portion, 4 portions, no allergic warnings, origin", Tomato Basil Soup," Cauliflower Tikka Masala - 300 calories per portion, 4 portions, None, India

"
59,400.0,100.0,240.0,150.0,150.0, Vegan Breakfast Empanadas - 400 calories per portion | 1 portion | Contains gluten | Origin, Roasted Almonds, Vegan Spinach Dip with Pita Chips, Tomato Basil Soup, Cauliflower Fried Rice
60,300.0,120.0,180.0,150.0,300.0, Vegan Apple Cinnamon Quinoa - 300 calories per portion | 1 portion | None | Origin, Vegan Energy Balls," Vegan Strawberry Shortcake - 180 kcals per portion, 4 portions, no allergic warnings, origin", Tomato Basil Soup," Indian Chana Masala (300 calories/portion, 3 portions) - India

"
61,200.0,100.0,140.0,150.0,221.0, Vegan Breakfast Enchiladas, Overnight Chia Pudding," Vegan Greek Salad - 140 kcals per portion, 4 portions, no allergic warnings, origin", Lentil Soup, Zucchini Noodles with Pesto
62,600.0,100.0,400.0,150.0,250.0, Vegan Breakfast Danish, Energy Balls, Vegan Japanese Mochi, Tom Yum Soup, Lentil Salad
63,350.0,80.0,140.0,150.0,150.0, Vegan Chocolate Peanut Butter Smoothie - 350 calories per portion | 1 portion | Contains nuts | Origin, Fruit Salad," Mexican Street Corn Salad - 140 kcals per portion, 4 portions, no allergic warnings, origin", Tom Yum Soup, Veggie Stir-Fry
64,300.0,90.0,170.0,150.0,320.0, Vegan Pumpkin Spice Pancakes - 300 calories per portion | 1 portion | Contains gluten | Origin, Quinoa Energy Bites," Vegan Mediterranean Flatbread - 170 kcals per portion, 4 portions, no allergic warnings, origin", Tom Yum Soup, Vegan Lentil Meatballs
65,50.0,100.0,560.0,150.0,300.0, Vegan Breakfast Energy Balls, Baked Apple Chips, Vegan Pancakes, Ratatouille," Vegan Baked Falafel - 300 calories per portion, 3 portions, may contain gluten"
66,200.0,100.0,200.0,150.0,250.0, Vegan Green Smoothie - 200 calories per portion | 2 portions | None | Origin, Chilled Gazpacho, Stuffed Grape Leaves, Tomato Basil Soup, Vegan Zucchini Bread
67,400.0,120.0,200.0,150.0,150.0, Vegan Breakfast Casserole - 400 calories per portion | 1 portion | None | Origin, Roasted Chickpeas," Vegan Strawberry Banana Smoothie - 200 kcals per portion, 4 portions, no allergic warnings, origin", Ratatouille, Lentil Soup
68,300.0,120.0,60.0,150.0,250.0, Vegan Granola - 300 calories per portion | 1 portion | Contains nuts | Origin, Roasted Brussels Sprouts," Sliced Apples with Cinnamon - 60 kcals per portion, 4 portions, no allergic warnings, origin", Lentil Soup, Cauliflower Buffalo Wings
69,200.0,100.0,150.0,150.0,250.0, Overnight Chia Pudding, Chilled Gazpacho," Vegan Zucchini Fritters with Vegan Sour Cream - 150 kcals per portion, 4 portions, no allergic warnings, origin", Cabbage Stir-Fry, Portobello Mushroom Steaks
70,450.0,120.0,640.0,150.0,188.0, Vegan Breakfast Lassi, Roasted Brussels Sprouts, Vegan Tofu Scramble, Ratatouille, Lentil and Vegetable Stir Fry
71,400.0,120.0,200.0,150.0,280.0, Vegan Breakfast Quesadilla - 400 calories per portion | 1 portion | Contains gluten | Origin, Kale Chips," Vegan Pancakes with Maple Syrup - 200 kcals per portion, 4 portions, no allergic warnings, origin", Lentil Soup, Lentil Bolognese
72,300.0,120.0,480.0,150.0,400.0, Vegan Peanut Butter Banana Smoothie - 300 calories per portion | 1 portion | Contains nuts | Origin, Kale Chips, Vegan Cucumber Sushi Rolls, Ratatouille," Vegan Tamales - 400 calories per portion, 4 portions, None, Mexico
"
73,200.0,100.0,140.0,150.0,300.0, Vegan Oatmeal Raisin Cookies - 200 calories per portion | 2 portions | Contains gluten | Origin, Fresh Fruit Salad," Roasted Beetroot Dip with Pita Bread - 140 kcals per portion, 4 portions, no allergic warnings, origin", Ratatouille," British Vegan Ploughman's Lunch (300 calories/portion, 3 portions) - United Kingdom
"
74,250.0,100.0,120.0,150.0,250.0, Vegan Blueberry Muffin Overnight Oats - 250 calories per portion | 2 portions | Contains gluten | Origin, Fresh Fruit Salad," Roasted Cauliflower Bites - 120 kcals per portion, 4 portions, no allergic warnings, origin", Lentil Soup, Tofu and Vegetable Kebabs
75,200.0,100.0,640.0,150.0,200.0, Vegan Chocolate Chia Pudding - 200 calories per portion | 2 portions | None | Origin, Overnight Chia Pudding, Vegan Tofu Scramble, Lentil Soup," Mexican Vegan Guacamole (200 calories/portion, 4 portions) - Mexico
"
76,200.0,120.0,640.0,150.0,450.0, Vegan Green Smoothie - 200 calories per portion | 2 portions | None | Origin, Roasted Chickpeas, Vegan Ratatouille, Tom Yum Soup, Veggie Paella
77,350.0,120.0,120.0,150.0,350.0, Vegan Protein Pancakes - 350 calories per portion | 1 portion | Contains gluten | Origin, Toasted Coconut Chips, Guacamole and Veggie Sticks, Cabbage Stir-Fry, Vegan Pizza
78,350.0,120.0,720.0,150.0,180.0, Vegan Savory Breakfast Muffins - 350 calories per portion | 1 portion | Contains gluten | Origin, Hummus with Veggies, Vegan Black Bean Quesadillas, Ratatouille, Tofu Stir-Fry
79,350.0,80.0,960.0,150.0,300.0, Vegan Mushroom and Spinach Omelette - 350 calories per portion | 1 portion | None | Origin, Stuffed Dates, Vegan Southwestern Black Bean Salad, Ratatouille," Moroccan Vegetable Lentil Stew (300 calories/portion, 4 portions) - Morocco
"
80,400.0,120.0,440.0,150.0,450.0, Vegan Breakfast Sushi - 400 calories per portion | 1 portion | Contains soy | Origin, Toasted Coconut Chips, Vegan Chili, Lentil Soup, Vegan Sushi Sandwich
81,200.0,80.0,200.0,150.0,250.0, Vegan Chocolate Chia Pudding - 200 calories per portion | 2 portions | None | Origin, Stuffed Dates, Stuffed Grape Leaves, Tomato Basil Soup, Sushi Roll
82,300.0,120.0,900.0,150.0,100.0, Fruit Smoothie Bowl - 300 calories per portion | 1 portion | None | Origin, Vegan Energy Balls, Vegan Stuffed Mushrooms, Ratatouille," Japanese Miso Soup with Tofu (100 calories/portion, 4 portions) - Japan
"
83,750.0,120.0,340.0,150.0,350.0, Vegan Breakfast Stuffed Mushrooms, Vegan Energy Balls, Vegan Nachos, Ratatouille, Vegan Stuffed Peppers
84,300.0,100.0,940.0,150.0,200.0, Vegan Pumpkin Spice Pancakes - 300 calories per portion | 1 portion | Contains gluten | Origin, Roasted Pumpkin Seeds, Chickpea Curry with Rice, Tomato Basil Soup," Italian Caprese Salad (200 calories/portion, 2 portions) - Italy
"
85,100.0,100.0,80.0,150.0,320.0, Vegan Breakfast Bagel, Roasted Almonds, Vegan Carrot Cake Energy Balls, Cabbage Stir-Fry, Zucchini and Carrot Noodles with Peanut Sauce
86,550.0,100.0,400.0,150.0,300.0, Vegan Breakfast Cobbler, Energy Balls, Vegan Japanese Mochi, Tomato Basil Soup, Vegan Fajitas
87,500.0,100.0,420.0,150.0,300.0, Vegan Breakfast Croque Madame, Energy Balls, Vegan Potato Salad, Cabbage Stir-Fry, Vegetable Curry
88,300.0,90.0,580.0,150.0,305.0, Vegan Chocolate Protein Shake - 300 calories per portion | 1 portion | None | Origin, Quinoa Energy Bites, Falafel with Tahini Sauce, Tomato Basil Soup, Sweet Potato and Black Bean Enchiladas
89,200.0,90.0,380.0,150.0,160.0, Vegan Breakfast Cookies - 200 calories per portion | 2 portions | Contains gluten | Origin, Quinoa Energy Bites, Vegan Chocolate Chip Cookies, Lentil Soup," Vegan Tofu Scramble - 160 calories per portion, 1 portion, may contain soy"
90,400.0,100.0,170.0,150.0,350.0, Vegan Breakfast Tater Tots - 400 calories per portion | 1 portion | Contains gluten | Origin, Fresh Fruit Salad," Roasted Red Pepper Hummus with Pita Bread - 170 kcals per portion, 4 portions, no allergic warnings, origin", Ratatouille," Vegan Lentil Coconut Curry - 350 calories per portion, 2 portions, may contain mustard"
91,350.0,120.0,480.0,150.0,350.0, Vegan Breakfast Pizza - 350 calories per portion | 1 portion | Contains gluten | Origin, Hummus with Veggies, Vegan Cucumber Sushi Rolls, Cabbage Stir-Fry, Lentil and Vegetable Curry with Coconut Milk
92,150.0,100.0,160.0,150.0,300.0, Vegan Breakfast Fruit Pizza, Roasted Pumpkin Seeds," Vegan Raspberry Bars - 160 kcals per portion, 4 portions, no allergic warnings, origin", Ratatouille," Lentil Samosas - 300 calories per portion, 4 portions, None, India
"
93,300.0,100.0,80.0,150.0,350.0, Vegan Granola - 300 calories per portion | 1 portion | Contains nuts | Origin, Roasted Almonds," Edamame Beans - 80 kcals per portion, 4 portions, no allergic warnings, origin", Ratatouille, Vegan Gyros
94,250.0,120.0,660.0,150.0,250.0, Vegan Breakfast Bruschetta - 250 calories per portion | 2 portions | Contains gluten | Origin, Hummus with Veggies, Vegan Pesto Pasta, Veggie Spring Rolls, Mediterranean Couscous Salad
95,50.0,120.0,120.0,150.0,400.0, Vegan Breakfast Energy Balls, Toasted Coconut Chips," Vegan Lentil Soup - 120 kcals per portion, 4 portions, no allergic warnings, origin", Ratatouille," Vegan Quiche - 400 calories per portion, 4 portions, Gluten, Various
"
96,400.0,100.0,200.0,150.0,380.0, Vegan Breakfast Stuffed Sweet Potatoes - 400 calories per portion | 1 portion | None | Origin, Roasted Edamame," Vegan Peanut Butter Banana Smoothie - 200 kcals per portion, 4 portions, allergic warning (peanuts), origin", Tomato Basil Soup, Vegan Bibimbap
97,300.0,120.0,70.0,150.0,200.0, Vegan Chocolate Protein Shake - 300 calories per portion | 1 portion | None | Origin, Roasted Chickpeas," Fruit Salad - 70 kcals per portion, 4 portions, no allergic warnings, origin", Ratatouille, Quinoa Salad
98,750.0,100.0,180.0,150.0,350.0, Vegan Breakfast Sweet Potato Hash, Roasted Almonds," Baked Falafel Salad - 180 kcals per portion, 4 portions, allergic warning (sesame), origin", Lentil Soup, Mexican Quinoa Bowl
99,300.0,100.0,90.0,150.0,419.0, Vegan Buckwheat Banana Pancakes - 300 calories per portion | 1 portion | Contains gluten | Origin, Toasted Coconut Chips," Guacamole with Tortilla Chips - 90 kcals per portion, 4 portions, allergic warning (avocado), origin", Ratatouille, Lentil Shepherd's Pie
100,550.0,100.0,200.0,150.0,300.0, Granola with Soy Milk, Roasted Edamame," Vegan Strawberry Banana Smoothie - 200 kcals per portion, 4 portions, no allergic warnings, origin", Tom Yum Soup," Chickpea Curry - 300 calories per portion, 4 portions, may contain mustard"
101,400.0,100.0,100.0,150.0,300.0, Vegan Breakfast Tostadas - 400 calories per portion | 1 portion | Contains soy | Origin, Overnight Chia Pudding," Homemade Hummus with Carrot Sticks - 100 kcals per portion, 4 portions, no allergic warnings, origin", Tomato Basil Soup," Peanut Noodle Salad - 300 calories per portion, 4 portions, Peanuts, Various
"
102,450.0,80.0,240.0,150.0,400.0, Vegan Breakfast Muffins, Stuffed Dates, Vegan Spinach Dip with Pita Chips, Cabbage Stir-Fry," Italian Pasta Primavera (400 calories/portion, 2 portions) - Italy
"
103,350.0,120.0,100.0,150.0,250.0, Vegan Sweet Potato Hash Browns - 350 calories per portion | 1 portion | None | Origin, Roasted Chickpeas," Stuffed Mini Peppers with Vegan Cream Cheese - 100 kcals per portion, 4 portions, no allergic warnings, origin", Tom Yum Soup, Stuffed Bell Peppers
104,300.0,120.0,120.0,150.0,300.0, Vegan Breakfast Parfait, Roasted Brussels Sprouts, Vegan Caprese Skewers, Tomato Basil Soup, Lentil Shepherd's Pie
105,300.0,100.0,140.0,150.0,200.0, Fruit Smoothie Bowl - 300 calories per portion | 1 portion | None | Origin, Roasted Almonds," Vegan Mediterranean Pasta Salad - 140 kcals per portion, 4 portions, no allergic warnings, origin", Lentil Soup," Butternut Squash Soup - 200 calories per portion, 4 portions, None, Various
"
106,150.0,100.0,200.0,150.0,390.0, Vegan Energy Balls - 150 calories per portion | 2 portions | Contains nuts | Origin, Roasted Pumpkin Seeds, Hummus and Pita Bread, Ratatouille, Vegan Lasagna
107,200.0,100.0,100.0,150.0,350.0, Overnight Chia Pudding, Roasted Edamame," Crispy Baked Tofu Bites - 100 kcals per portion, 4 portions, no allergic warnings, origin", Lentil Soup," Vegan Lentil Coconut Curry - 350 calories per portion, 2 portions, may contain mustard"
108,400.0,120.0,840.0,150.0,150.0, Vegan Cinnamon Rolls, Roasted Brussels Sprouts, Vegan Tomato Bruschetta, Ratatouille," Lentil Soup - 150 calories per portion, 6 portions, None, Various
"
