,breakfast_calories,morning snacks_calories,afternoon snacks_calories,lunch_calories,dinner_calories,breakfast,morning snacks,afternoon snacks,lunch,dinner
320,250.0,80.0,180.0,20.0,340.0," Fruit smoothie bowl topped with granola (250kcals per portion, 2 portions, nut allergies, origin", Mango with Chili Powder, Caprese Bruschetta, Moroccan Mint Tea," Spinach and Artichoke Stuffed Portobello Mushrooms - 340kcals per portion, 2 portions, contains dairy
"
321,320.0,50.0,80.0,20.0,150.0," Baked eggs with asparagus and Parmesan (320 calories per portion, 2 portions, contains dairy, Italian origin)
"," Fruit Salad - 50kcals per portion, 2 portions
   Origin", Gazpacho, Moroccan Mint Tea, Swiss Chard and Lentil Soup
322,550.0,80.0,150.0,20.0,250.0," Eggs Benedict - 550 calories per portion, 2 portions, contains gluten and dairy, origin"," Carrot Sticks with Hummus - 80kcals per portion, 2 portions
   Origin", Cucumber and Tomato Salsa with Tortilla Chips, Moroccan Mint Tea, Portobello Mushroom Steaks
323,250.0,80.0,250.0,20.0,300.0, Vegan Breakfast Strata, Kale Chips, Mini Buffalo Chicken Wraps, Moroccan Mint Tea, Lentil Biryani
324,350.0,80.0,180.0,20.0,300.0, Quinoa Breakfast Bake, Baked Apple Chips, Vegetable sushi rolls, Moroccan Mint Tea," Vegan Mushroom and Spinach Quesadilla - 300 calories per portion, 2 portions, may contain gluten"
325,150.0,80.0,200.0,20.0,200.0, Vegan Egg Muffins - 150 calories per portion | 2 portions | None | Origin, Kale Chips, Spinach and Cheese Puffs, Moroccan Mint Tea, Zucchini Noodles with Pesto
326,350.0,80.0,250.0,20.0,300.0, Homemade Granola with Yogurt," Carrot Sticks with Hummus - 80kcals per portion, 2 portions
   Origin", Quinoa Salad, Moroccan Mint Tea," Caprese Quinoa Bowls - 300 calories/portion, 4 portions, Origin"
327,250.0,50.0,150.0,20.0,200.0, Vegan Breakfast Sausage," Homemade Fruit Popsicles - 50kcals per portion, 2 portions
    Origin", Avocado Toast, Moroccan Mint Tea," Vegan Tomato Soup - 200 calories per portion, 4 portions, None, Various
"
328,500.0,80.0,220.0,20.0,300.0, Breakfast Burrito, Fruit Salad, Quinoa Salad, Moroccan Mint Tea, Quinoa Stuffed Peppers
329,300.0,70.0,110.0,20.0,250.0, Cheesy Grits, Fresh Fruit Salad, Vegetable spring rolls, Moroccan Mint Tea, Caprese Quinoa Salad
330,250.0,80.0,220.0,20.0,300.0, Vegan Breakfast Sushi, Hard-Boiled Eggs, Vegetarian sushi rolls, Moroccan Mint Tea, Lentil Biryani
331,350.0,60.0,180.0,20.0,312.0," Fruit and yogurt parfait with granola (350 calories per portion, 2 portions, contains dairy, American origin)
", Fruit Salad - Approx, Shrimp Summer Rolls, Moroccan Mint Tea, Vegan Enchiladas
332,200.0,60.0,170.0,20.0,200.0, Vegan Oatmeal Raisin Cookies - 200 calories per portion | 2 portions | Contains gluten | Origin, Fruit Salad - Approx," Egg Salad Lettuce Wraps - 170 kcals per portion, 3 portions, contains egg (USA)", Moroccan Mint Tea, Vegan Caprese Salad
333,350.0,60.0,100.0,20.0,300.0," Lemon poppy seed pancakes (350 calories per portion, 2 portions, nut-free, American origin)
", Cucumber and tomato salad, Veggie Pinwheels, Moroccan Mint Tea," Quinoa Salad with Roasted Vegetables - 300 calories per portion, 4 portions, no allergic warnings, Origin"
334,300.0,80.0,80.0,20.0,250.0, Vegan Breakfast Tacos - 300 calories per portion | 2 portions | None | Origin," Carrot Sticks with Hummus - 80kcals per portion, 2 portions
   Origin"," Rice Paper Veggie Rolls - 80 kcals per portion, 4 portions, contains soy (Vietnam)", Moroccan Mint Tea," Falafel salad with tahini dressing - 250 calories per portion, 4 portions, contains gluten (Middle East)
"
335,100.0,80.0,210.0,20.0,300.0, Vegan Breakfast Steamed Buns, Fruit Salad, Greek Feta and Olive Tapenade Crostini, Moroccan Mint Tea," Greek lemon chicken soup with orzo (300 calories per portion, 4 portions, contains gluten, origin"
336,350.0,80.0,170.0,20.0,200.0," Mexican sopes with refried beans and salsa (350kcals per portion, 2 portions, origin", Mango with Chili Powder," Vegan Mediterranean Flatbread - 170 kcals per portion, 4 portions, no allergic warnings, origin", Moroccan Mint Tea," Stuffed grape leaves (Dolmas) - 200 calories per portion, 4 portions, contains nuts (Middle East)
"
337,200.0,60.0,150.0,20.0,250.0, Spinach and Feta Stuffed Portobello Mushrooms, Cucumber and tomato salad, Stuffed mushrooms, Moroccan Mint Tea," Falafel salad with tahini dressing - 250 calories per portion, 4 portions, contains gluten (Middle East)

Please note that these calorie estimates are approximate and can vary based on specific ingredients and portion sizes used"
338,450.0,80.0,180.0,20.0,300.0, Breakfast Tostadas, Hard-Boiled Eggs, Veggie Quesadillas, Moroccan Mint Tea," Spicy Black Bean Burgers - 300 calories/portion, 4 portions, Origin"
339,400.0,50.0,130.0,20.0,300.0," Sri Lankan hoppers with coconut sambol - 400 calories per portion, 2 portions, contains gluten, origin"," Fruit Salad - 50kcals per portion, 2 portions
   Origin"," Veggie Sushi Rolls with Spicy Tofu - 130 kcals per portion, 4 portions, no allergic warnings, origin", Moroccan Mint Tea," Roasted Vegetable Pasta - 300 calories per portion, 4 portions, Gluten, Italy
"
340,430.0,80.0,180.0,20.0,180.0," Cinnamon raisin French toast (430 calories per portion, 2 portions, contains dairy, American origin)
", Fresh Watermelon Slices - Approx," Vegan Blueberry Muffins - 180 kcals per portion, 4 portions, no allergic warnings, origin", Moroccan Mint Tea, Ratatouille
341,300.0,80.0,250.0,20.0,320.0, Quinoa Breakfast Bowl, Cheesy Popcorn, Chicken and vegetable lettuce wraps, Moroccan Mint Tea," Caprese quinoa salad – 320 calories per portion, 4 portions, contains dairy
"
342,350.0,70.0,120.0,20.0,300.0," Irish soda bread with butter and jam - 350 calories per portion, 2 portions, contains gluten and dairy, origin", Fresh Fruit Salad, Greek Yogurt Dip with Veggies, Moroccan Mint Tea, Eggplant Parmesan Sliders
343,400.0,50.0,100.0,20.0,300.0, Vegan Breakfast Quesadilla - 400 calories per portion | 1 portion | Contains gluten | Origin," Homemade Fruit Popsicles - 50kcals per portion, 2 portions
    Origin", Spinach and feta triangles, Moroccan Mint Tea, Vegan Chickpea Curry
344,300.0,80.0,80.0,20.0,300.0, Greek Yogurt with Honey and Pistachios, Baked Apple Chips, Cucumber cream cheese roll-ups, Moroccan Mint Tea, Sweet Potato and Black Bean Enchiladas
345,400.0,80.0,300.0,20.0,200.0, Avocado and Egg Breakfast Salad, Energy Balls, Veggie Quesadilla, Moroccan Mint Tea, Vegan Caprese Salad
346,350.0,80.0,150.0,20.0,150.0," Pancetta and mushroom omelette (350 calories per portion, 2 portions, nut-free, Italian origin)
", Fruit Salad," Hummus with Veggies - 150 kcals per portion, 3 portions, may contain sesame (Middle East)", Moroccan Mint Tea," Low-Calorie Veggie Stir-Fry (150 calories/portion, 3 portions) - China
"
347,350.0,50.0,150.0,20.0,200.0," Finnish Karelian pasties with egg butter - 350 calories per portion, 2 portions, contains gluten and dairy, origin"," Fruit Salad - 50kcals per portion, 2 portions
   Origin", Black Bean and Corn Salsa with Tortilla Chips, Moroccan Mint Tea," Greek stuffed bell peppers - 200 calories per portion, 4 portions, none (Greece)
"
348,300.0,80.0,180.0,20.0,300.0, Chia Seed Smoothie, Cheesy Popcorn, Baked Coconut Shrimp, Moroccan Mint Tea," Quinoa Stuffed Bell Peppers - 300 calories per portion, 4 portions, no allergic warnings, Origin"
349,400.0,80.0,160.0,20.0,300.0," Turkish breakfast (tomato, cucumber, olives, cheese, bread) - 400 calories per portion, 2 portions, contains gluten and dairy, origin", Energy Balls," Cucumber Bites with Herbed Cream Cheese - 160 kcals per portion, 4 portions, contains dairy (Various)", Moroccan Mint Tea," Greek-style roasted vegetables with feta – 300 calories per portion, 4 portions, contains dairy (origin"
350,400.0,50.0,200.0,20.0,200.0," Venezuelan arepas with cheese and avocado - 400 calories per portion, 1 portion, contains gluten and dairy, origin", Baked Apple Chips - Approx, Caramelized Onion and Goat Cheese Tartlets, Moroccan Mint Tea," Vegan Lentil and Vegetable Stir-Fry - 200 calories per portion, 3 portions, may contain soy"
351,350.0,80.0,90.0,20.0,300.0," Scottish porridge with honey and berries (350kcals per portion, 2 portions, origin", Fruit Salad," Israeli Salad - 90 kcals per portion, 4 portions, gluten-free (Israel)", Moroccan Mint Tea," Vegan Spaghetti with Marinara Sauce - 300 calories per portion, 2 portions, may contain gluten"
352,350.0,60.0,250.0,20.0,250.0, Banana Walnut Bread, Cucumber and tomato salad, Mini Buffalo Chicken Wraps, Moroccan Mint Tea, Cauliflower Buffalo Wings
353,500.0,80.0,110.0,20.0,200.0, Waffles with Strawberries and Whipped Cream, Fruit Salad," Sweet Potato Rounds - 110 kcals per portion, 4 portions, gluten-free (USA)", Moroccan Mint Tea, Spicy Black Bean Soup
354,350.0,70.0,80.0,20.0,300.0, Breakfast Bruschetta, Kale chips, Chocolate-dipped strawberries, Moroccan Mint Tea, Quinoa-Stuffed Bell Peppers
355,500.0,50.0,80.0,20.0,300.0, Breakfast Burrito, Baked Apple Chips - Approx, Stuffed Mushroom Caps, Moroccan Mint Tea, Quinoa Stuffed Bell Peppers with Cashew Cream
356,300.0,80.0,180.0,20.0,250.0, Vegan Breakfast Tostadas, Baked Apple Chips," Vegan Apple Cinnamon Granola Bars - 180 kcals per portion, 4 portions, no allergic warnings, origin", Moroccan Mint Tea, Chickpea Flour Pancakes
357,350.0,80.0,200.0,20.0,150.0," Veggie omelette with sweet potato hash (350 calories per portion, 2 portions, nut-free, American origin)
", Kale Chips," Vegan Strawberry Banana Smoothie - 200 kcals per portion, 4 portions, no allergic warnings, origin", Moroccan Mint Tea, Caprese Salad
358,250.0,80.0,150.0,20.0,300.0," British eggy soldiers - 250 calories per portion, 1 portion, contains gluten, origin", Fruit Salad, Roasted Red Pepper and Feta Dip, Moroccan Mint Tea," Japanese Vegan Sushi Bowl (300 calories/portion, 3 portions) - Japan
"
359,300.0,80.0,150.0,20.0,100.0," Congee (Chinese rice porridge) with century eggs - 300 calories per portion, 2 portions, no allergic warnings, origin", Kale Chips, Caprese skewers with balsamic glaze, Moroccan Mint Tea," Japanese Miso Soup with Tofu (100 calories/portion, 4 portions) - Japan
"
360,380.0,50.0,120.0,20.0,250.0," Veggie-packed breakfast skillet with sweet potatoes (380 calories per portion, 2 portions, nut-free, American origin)
"," Fruit Salad - 50kcals per portion, 2 portions
   Origin", Roasted Cauliflower Popcorn, Moroccan Mint Tea," Falafel salad with tahini dressing - 250 calories per portion, 4 portions, contains gluten (Middle East)

Please note that these calorie estimates are approximate and can vary based on specific ingredients and portion sizes used"
361,400.0,80.0,180.0,20.0,250.0," Shakshuka with crusty bread (400 calories per portion, 2 portions, contains eggs, Israeli origin)
", Fruit Salad, Chocolate Peanut Butter Protein Balls, Moroccan Mint Tea, Veggie Stir-Fry with Quinoa
362,200.0,80.0,180.0,20.0,250.0, Blueberry Almond Baked Oatmeal, Fresh Squeezed Orange Juice, Baked Falafel with Yogurt Sauce, Moroccan Mint Tea," Panzanella salad - 250 calories per portion, 4 portions, contains gluten (Italy)
"
363,300.0,80.0,160.0,20.0,300.0," Shakshuka - 300 calories per portion, 2 portions, no allergic warnings, origin", Stuffed Dates, Black Olive Tapenade with Crackers, Moroccan Mint Tea," Chickpea Curry - 300 calories per portion, 4 portions, may contain mustard"
364,350.0,50.0,180.0,20.0,300.0, Broccoli and Cheese Frittata," Homemade Fruit Popsicles - 50kcals per portion, 2 portions
    Origin"," Tapioca Pudding - 180 kcals per portion, 3 portions, contains dairy (World)", Moroccan Mint Tea," Italian Vegan Pizza (300 calories/portion, 2 portions) - Italy
"
365,200.0,80.0,180.0,20.0,300.0, Vegan Breakfast Enchiladas, Energy Balls, Strawberry and banana smoothie, Moroccan Mint Tea," Thai Curry Noodle Soup - 300 calories per portion, 4 portions, None, Thailand
"
