,breakfast_calories,morning snacks_calories,afternoon snacks_calories,lunch_calories,dinner_calories,breakfast,morning snacks,afternoon snacks,lunch,dinner
307,350.0,180.0,150.0,20.0,250.0, Vegan Breakfast Couscous - 350 calories per portion | 1 portion | Contains gluten | Origin, Banana Pancakes, Caprese Salad Skewers, Moroccan Mint Tea, Ratatouille-Stuffed Zucchini
308,350.0,150.0,120.0,20.0,320.0," Apple cinnamon overnight French toast (350 calories per portion, 2 portions, nut-free, American origin)
", Chocolate Protein Balls," Cold Cucumber Soup - 120 kcals per portion, 4 portions, gluten-free (World)", Moroccan Mint Tea, Thai Noodle Salad
309,350.0,260.0,90.0,20.0,350.0, Breakfast Bruschetta, Vegan Blueberry Scones," Bruschetta with Fresh Tomatoes and Basil - 90 kcals per portion, 4 portions, no allergic warnings, origin", Moroccan Mint Tea," Thai Pineapple Fried Rice (350 calories/portion, 3 portions) - Thailand
"
310,400.0,180.0,100.0,100.0,380.0," Huevos divorciados (Mexican-style eggs with red and green salsa) (400 calories per portion, 2 portions, nut-free, Mexican origin)
", Whole Wheat Pancakes," Vegan Spinach and Artichoke Dip - 100 kcals per portion, 4 portions, no allergic warnings, origin", Israeli salad," Tofu and vegetable curry with basmati rice – 380 calories per portion, 3 portions, vegan-friendly (origin"
311,160.0,150.0,100.0,100.0,350.0," Cream cheese stuffed strawberries (160 calories per portion, 2 portions, contains dairy, American origin)
", Tomato Bruschetta, Baked zucchini fries, Israeli salad," Greek Moussaka Stuffed Peppers - 350 calories per portion, 4 portions, contains dairy (cheese), Origin"
312,350.0,120.0,90.0,20.0,400.0, Tomato and Basil Bruschetta Scramble, Vegetable Samosas, Watermelon Feta Bites, Moroccan Mint Tea," Vegan Lentil Bolognese - 400 calories/portion, 4 portions, contains gluten (Italy)
"
313,350.0,150.0,180.0,20.0,400.0, Apple Cinnamon Muffins, Pear with Goat Cheese, Greek Spanakopita, Moroccan Mint Tea, Stuffed Portobello Mushrooms with Quinoa
314,300.0,180.0,250.0,100.0,350.0, Vegan Pumpkin Spice Granola - 300 calories per portion | 1 portion | Contains nuts | Origin, Almond Butter Rice Cakes, Vegetarian Chili, Israeli salad, Stuffed Zucchini
315,300.0,150.0,120.0,20.0,200.0, Vegan Breakfast Parfait, Mango Coconut Chia Popsicles, Greek Feta Dip with Veggies, Moroccan Mint Tea," Greek stuffed bell peppers - 200 calories per portion, 4 portions, none (Greece)
"
316,450.0,180.0,180.0,100.0,350.0," Breakfast tacos - 450 calories per portion, 2 portions, contains gluten, origin", Vegan Flapjacks, Pita Bread with Hummus, Israeli salad," Spaghetti with Marinara Sauce - 350 calories/portion, 4 portions, contains gluten (Italy)
"
317,350.0,250.0,80.0,100.0,300.0," Baked beans on toast (350kcals per portion, 2 portions, origin", Spinach and Mushroom Frittata, Vegetable Soup, Israeli salad," Lentil Mushroom Meatballs - 300 calories per portion, 4 portions, None, Various
"
318,300.0,150.0,150.0,100.0,200.0, Omelette with Spinach and Feta, Rainbow Veggie Skewers, Tomato and Mozzarella Bruschetta, Israeli salad, Lemon and Herb Couscous Salad
319,250.0,120.0,150.0,100.0,300.0, Raspberry Chia Jam Toast, Baked Cheese Twists, Black Bean and Corn Salsa with Tortilla Chips, Israeli salad," Mexican Street Corn - 300 calories per portion, 4 portions, contains dairy (cheese), Origin"
320,220.0,220.0,180.0,20.0,350.0," Vegetable frittata - 220 calories per portion, 4 portions, no allergic warnings, origin", Blueberry almond smoothie, Strawberry and banana smoothie, Moroccan Mint Tea, Sweet Potato and Black Bean Enchiladas
321,350.0,300.0,200.0,100.0,340.0," Moroccan msemen (thin layered pastry) with honey - 350 calories per portion, 2 portions, contains gluten, origin", Healthy Veggie Nachos, Caprese stuffed avocados, Israeli salad," Spinach and Artichoke Stuffed Portobello Mushrooms - 340kcals per portion, 2 portions, contains dairy
"
322,350.0,200.0,90.0,100.0,350.0, Lemon Poppy Seed Pancakes, Avocado Toast, Ants on a log (celery with cream cheese and raisins), Israeli salad," Vegetable curry with coconut milk and basmati rice - 350 kcals per portion, 4 portions, vegetarian, contains gluten
"
323,400.0,250.0,180.0,100.0,320.0," Turkish breakfast (tomato, cucumber, olives, cheese, bread) - 400 calories per portion, 2 portions, contains gluten and dairy, origin", Vegan Peanut Butter and Jelly Overnight Oats, Cheesy Garlic Breadsticks, Israeli salad," Eggplant Curry - 320kcals per portion, 4 portions, contains spices (India)
"
324,400.0,250.0,280.0,100.0,300.0," Mushroom and Swiss breakfast wrap (400 calories per portion, 2 portions, contains dairy, Swiss origin)
", Pear and Almond Tart, Greek Spinach and Cheese Rolls, Israeli salad," Vegetable stir-fry with tofu (300 calories per portion, 3 portions, contains soy, origin"
325,300.0,300.0,210.0,100.0,250.0," Vegetable omelette with whole wheat toast (300 calories per portion, 2 portions, nut-free, American origin)
", Banana and peanut butter smoothie, Greek Feta and Olive Tapenade Crostini, Israeli salad, Roasted Vegetable Salad
326,150.0,250.0,180.0,100.0,400.0, Chia Pudding - 150 calories per portion | 1 portion | None | Origin, Vegetable Quesadilla with Salsa, Stuffed Bell Peppers, Israeli salad," Chicken stir-fry with broccoli and brown rice – 400 calories per portion, 2 portions (origin"
327,400.0,60.0,250.0,20.0,390.0, Vegan Spinach and Mushroom Breakfast Wrap - 400 calories per portion | 1 portion | None | Origin, Cucumber and tomato salad, Mini chicken pot pies, Moroccan Mint Tea, Vegan Tikka Masala
328,450.0,280.0,300.0,100.0,400.0, Sausage and Egg Breakfast Sandwich, Yogurt with kiwi and granola, Veggie Quesadilla, Israeli salad, Vegetarian Lasagna
329,600.0,250.0,80.0,100.0,300.0, Vegan Breakfast Biscotti, Veggie Sushi Rolls," Baked Zucchini Chips - 80 kcals per portion, 3 portions, contains dairy (Italy)", Israeli salad, Vegan Quesadillas
330,200.0,180.0,180.0,20.0,380.0, Mexican Black Bean Breakfast Wrap, Falafel, Cheesy Garlic Breadsticks, Moroccan Mint Tea," Shrimp and vegetable stir-fry with brown rice - 380 kcals per portion, 2 portions, contains shellfish, soy
"
331,250.0,150.0,200.0,100.0,250.0, Sweet Potato Toast - 250 calories per portion | 1 portion | None | Origin," Mediterranean Style Olive Tapenade and Crostini - 150kcals per portion, 2 portions
    Origin", Bruschetta with Mozzarella and Basil, Israeli salad, Vegan Zucchini Bread
332,300.0,250.0,200.0,100.0,318.0, Quinoa Porridge, Veggie Burger Sliders," Vegan Mango Smoothie Bowl - 200 kcals per portion, 4 portions, no allergic warnings, origin", Israeli salad, Lentil and Mushroom Burgers
333,300.0,250.0,150.0,100.0,350.0, Vegan Pumpkin Spice Pancakes - 300 calories per portion | 1 portion | Contains gluten | Origin, Pineapple and coconut smoothie, Guacamole with tortilla chips, Israeli salad," Stuffed bell peppers with quinoa and black beans - 350 kcals per portion, 4 portions, vegetarian, gluten-free
"
334,250.0,180.0,250.0,20.0,300.0, Smoothie Bowl, Strawberry and banana smoothie, Chicken Caesar Lettuce Wraps, Moroccan Mint Tea, Ratatouille-Stuffed Peppers
335,450.0,300.0,220.0,100.0,350.0, Vegan Blueberry Muffins, Quinoa Stuffed Bell Peppers," Falafel with Tahini Sauce - 220 kcals per portion, 3 portions, contains sesame (Middle East)", Israeli salad," Greek Spinach Pie - 350 calories/portion, 4 portions, contains gluten and dairy (Greece)
"
336,400.0,400.0,200.0,20.0,350.0, Vegan Breakfast Spanakopita," Smoked Salmon and Cream Cheese Bagels - 400kcals per portion, 1 portion
    Origin", Vegan Chocolate Covered Strawberries, Moroccan Mint Tea," Cheese and vegetable-stuffed bell peppers - 350 kcals per portion, 4 portions, vegetarian, contains lactose
"
337,200.0,200.0,180.0,20.0,400.0, Vegan Blueberry Pancakes, Zucchini Fritters, Guacamole with vegetable sticks, Moroccan Mint Tea," Shrimp Scampi Linguine - 400 calories per portion, 4 portions, contains gluten (pasta), Origin"
338,200.0,150.0,120.0,20.0,300.0, Quinoa Breakfast Skillet," Chickpea Salad - 150kcals per portion, 2 portions
    Origin"," Caprese skewers (cherry tomatoes, mozzarella, basil)", Moroccan Mint Tea, Vegan Sloppy Joes
339,400.0,220.0,70.0,20.0,80.0, Veggie Breakfast Pizza, Oatmeal with raisins and cinnamon, Fruit Salad, Moroccan Mint Tea," Spinach and feta stuffed mushrooms - 80 calories per portion, 6 portions, contains dairy (Greece)
"
340,250.0,250.0,150.0,20.0,300.0, Vegan Protein Pancakes," Peanut Butter Banana Roll-Ups - 250kcals per portion, 1 portion
    Origin", Deviled eggs, Moroccan Mint Tea, Vegan Moroccan Tagine
341,300.0,150.0,150.0,20.0,300.0," Berry chia seed smoothie (300 calories per portion, 2 portions, nut-free, American origin)
", Vegan Gingerbread Cookies, Mini spinach and feta quiches, Moroccan Mint Tea," Lentil Sloppy Joes - 300 calories per portion, 4 portions, Gluten, United States
"
342,320.0,250.0,120.0,20.0,200.0," Spinach and mushroom breakfast wrap (320 calories per portion, 2 portions, nut-free, American origin)
", Vegan Chocolate Banana Bread, Caprese Salad Skewers, Moroccan Mint Tea," Vegan Creamy Cauliflower Soup - 200 calories per portion, 4 portions, None, Various
"
343,350.0,70.0,120.0,100.0,286.0, Breakfast Bruschetta, Fresh Fruit Salad, Roasted Garlic and White Bean Dip with Pita Chips, Israeli salad, Quinoa and Black Bean Stuffed Peppers
344,350.0,250.0,300.0,100.0,400.0," Russian syrniki (cottage cheese pancakes) - 350 calories per portion, 2 portions, contains gluten and dairy, origin", Baked Cinnamon Apple Chips, Veggie Sushi Bowls, Israeli salad," Butternut squash and lentil curry with basmati rice - 400 kcals per portion, 4 portions, vegetarian, contains gluten
"
345,350.0,150.0,200.0,100.0,350.0, Vegan Sweet Potato Hash Browns - 350 calories per portion | 1 portion | None | Origin, Greek Yogurt with Berries, Tomato and Avocado Bruschetta, Israeli salad," Spinach and Mushroom Risotto - 350kcals per portion, 4 portions
"
346,300.0,220.0,150.0,100.0,400.0, Fruit Smoothie Bowl - 300 calories per portion | 1 portion | None | Origin, Oatmeal with Blueberries, Roasted Red Pepper Hummus with Pita Bread, Israeli salad," Herb-crusted baked fish with roasted vegetables – 400 calories per portion, 2 portions, contains fish
"
347,400.0,200.0,120.0,100.0,350.0, Tomato Basil Quiche, Vegetable and Lentil Soup - Approx, Cucumber Avocado Rolls, Israeli salad," Vegan Thai Coconut Soup - 350 calories per portion, 2 portions, may contain soy"
348,500.0,180.0,160.0,20.0,300.0, Breakfast Sausage and Egg Casserole, Carrot Cake Muffins, Greek Yogurt with Honey and Nuts, Moroccan Mint Tea, Vegan Chickpea Curry
349,300.0,150.0,110.0,100.0,320.0, Shakarkandi ki Chaat (Sweet Potato Chaat)," Cucumber Cups with Tuna Salad - 150kcals per portion, 2 portions
    Origin"," Edamame - 110 kcals per portion, 2 portions, contains soy (Japan)", Israeli salad, Thai Red Curry with Vegetables
350,350.0,200.0,150.0,20.0,350.0, Maple Pecan Granola with Yogurt, Carrot and Zucchini Muffins, Roasted Chickpeas, Moroccan Mint Tea, Chicken Caesar Salad
351,500.0,150.0,150.0,20.0,280.0, Vegan Breakfast Cookies," Watermelon and Feta Skewers - 150kcals per portion, 2 portions
    Origin", Caprese Salad Skewers, Moroccan Mint Tea," Chickpea Salad - 280kcals per portion, 4 portions, gluten-free (Middle East)
"
352,500.0,220.0,180.0,20.0,350.0, Waffles with Strawberries and Whipped Cream, Almond butter and banana wrap," Berry Parfait - 180 kcals per portion, 2 portions, contains dairy (Various)", Moroccan Mint Tea, Vegetable Paella
353,250.0,120.0,100.0,20.0,350.0, Tofu Scramble - 250 calories per portion | 2 portions | None | Origin, Cinnamon Sugar Pretzels, Cinnamon Sugar Popcorn, Moroccan Mint Tea, Roasted Vegetable Quinoa Bowls
354,150.0,300.0,480.0,100.0,300.0, Vegan Peanut Butter Banana Smoothie, Chocolate Chia Seed Pudding, Spinach and Mushroom Quesadillas, Israeli salad," Spinach and Feta Stuffed Phyllo Triangles - 300 calories/portion, 4 portions, contains gluten and dairy (Greece)
"
355,200.0,400.0,160.0,20.0,350.0, Mediterranean Vegetable Omelette," Smoked Salmon and Cream Cheese Bagels - 400kcals per portion, 1 portion
    Origin"," Vegan Samosas - 160 kcals per portion, 4 portions, no allergic warnings, origin", Moroccan Mint Tea," Pasta Primavera - 350 calories/portion, 4 portions, Origin"
356,100.0,200.0,200.0,100.0,400.0, Vegan Breakfast Bagel, Apple Cider Doughnuts, Tofu Vegetable Skewers, Israeli salad," Caprese Quinoa Bowl - 400 calories/portion, 4 portions, contains dairy (Italy)
"
357,300.0,150.0,180.0,100.0,400.0," Indian poha cutlet - 300 calories per portion, 2 portions, contains gluten, origin"," Mini Spinach and Feta Quiches - 150kcals per portion, 2 portions
    Origin", Baba Ganoush with Pita Chips, Israeli salad," Vegan Paella - 400 calories per portion, 4 portions, None, Spain
"
358,300.0,200.0,200.0,20.0,300.0," Yogurt and fruit smoothie with almond milk (300kcals per portion, 1 portion, nut allergies)
", Greek Salad," Poppy Seed Muffins - 200 kcals per portion, 3 portions, contains gluten (Various)", Moroccan Mint Tea," Baked Ziti - 300 calories/portion, 4 portions, Origin"
359,350.0,200.0,250.0,20.0,340.0, Shakshuka, Energy-Boosting Smoothie - Approx, Mini Spinach and Ricotta Calzones, Moroccan Mint Tea," Quinoa and Black Bean Burger - 340kcals per portion, 4 portions, contains legumes
"
360,200.0,200.0,80.0,20.0,350.0, Vegan Oatmeal Raisin Cookies - 200 calories per portion | 2 portions | Contains gluten | Origin, Tomato and Mozzarella Skewers, Mini stuffed bell peppers with cream cheese, Moroccan Mint Tea, Lemon Garlic Butter Shrimp
361,450.0,150.0,220.0,100.0,400.0," French croissant with ham and cheese (450kcals per portion, 1 portion, pork allergies, origin", Baked Cinnamon Sugar Donut Holes - Approx, Chicken Yakitori Skewers, Israeli salad," Mushroom and truffle risotto - 400 calories per portion, 4 portions, contains gluten and dairy (Italy)
"
362,400.0,150.0,180.0,100.0,400.0, Chorizo Breakfast Burrito, Vietnamese Fresh Spring Rolls - Approx, Chocolate Peanut Butter Protein Balls, Israeli salad," Avocado and black bean tacos with cilantro lime rice (400 calories per portion, 4 portions, vegan-friendly, origin"
363,450.0,100.0,320.0,100.0,250.0," Baguette with brie and prosciutto (450kcals per portion, 1 portion, pork allergies, origin", Fruit salad, Quinoa Salad, Israeli salad," Roasted Cauliflower Tacos - 250 calories per portion, 4 portions, None, Mexico
"
364,250.0,200.0,90.0,20.0,356.0, Cheesy Spinach Pita Pocket, Greek Salad Skewers," Cauliflower Buffalo Wings - 90 kcals per portion, 4 portions, contains gluten (USA)", Moroccan Mint Tea, Vegan Miso Ramen
365,150.0,220.0,250.0,20.0,400.0," Vegemite on toast - 150 calories per portion, 1 portion, contains gluten, origin", Apple cinnamon overnight oats, Baked Samosas, Moroccan Mint Tea," Mushroom and truffle risotto - 400 calories per portion, 4 portions, contains gluten and dairy (Italy)
"
