,breakfast_calories,morning snacks_calories,afternoon snacks_calories,lunch_calories,dinner_calories,breakfast,morning snacks,afternoon snacks,lunch,dinner
103,200.0,100.0,660.0,300.0,200.0, Vegan Breakfast Enchiladas, Overnight Chia Pudding, Vegan Pesto Pasta, Vegan Pad Thai, Vegan Ratatouille Stuffed Portobello Mushroom
104,500.0,100.0,200.0,400.0,250.0, Vegan Breakfast Risotto, Baked Apple Chips, Vegan Chocolate Covered Strawberries," Vegan Cuban Sandwich
Total calories per portion"," Vegan Teriyaki Tofu - 250 calories per portion, 4 portions, Soy, Japan
"
105,400.0,100.0,130.0,450.0,250.0, Vegan Breakfast Fried Rice, Roasted Pumpkin Seeds," Vegan Thai Spring Rolls - 130 kcals per portion, 4 portions, no allergic warnings, origin"," Vegan Mac and Cheese
Total calories per portion", Lentil Tacos
106,150.0,100.0,180.0,250.0,200.0, Vegan Pancakes, Fresh Fruit Salad," Sticky Coconut Rice Balls - 180 kcals per portion, 4 portions, no allergic warnings, origin", Vegan Lentil Salad," Quinoa Salad - 200 calories per portion, 2 portions, may contain nuts"
107,350.0,90.0,80.0,400.0,200.0, Vegan Breakfast Quinoa Bowl - 350 calories per portion | 1 portion | Contains nuts | Origin, Quinoa Energy Bites, Energy Balls," Vegan Hungarian Goulash
Total calories per portion"," Vegan Thai Yellow Curry - 200 calories per portion, 2 portions, may contain tofu"
108,400.0,100.0,520.0,250.0,250.0, Vegan Breakfast Nachos - 400 calories per portion | 1 portion | Contains soy | Origin, Baked Apple Chips, Vegan Mac and Cheese," Vegan Pumpkin Soup
Total calories per portion"," Indian Vegan Baingan Bharta (250 calories/portion, 4 portions) - India
"
109,400.0,100.0,180.0,400.0,320.0, Vegan Breakfast Skillet, Roasted Edamame," Vegan Strawberry Shortcake - 180 kcals per portion, 4 portions, no allergic warnings, origin"," Thai Green Curry with Mixed Vegetables
Total calories per portion", Vegan Lentil Meatballs
110,300.0,100.0,100.0,250.0,350.0, Vegan Sweet Potato Pancakes - 300 calories per portion | 1 portion | Contains gluten | Origin, Baked Apple Chips," Roasted Garlic Hummus with Veggie Sticks - 100 kcals per portion, 4 portions, no allergic warnings, origin", Vegan Lentil Salad," Vegan Meatballs with Marinara Sauce - 350 calories per portion, 4 portions, Gluten, Italy
"
111,200.0,100.0,160.0,400.0,350.0, Vegan Matcha Chia Pudding - 200 calories per portion | 1 portion | None | Origin, Overnight Chia Pudding, Roasted Chickpeas, Vegan Teriyaki Tofu Stir-Fry," Spinach and Mushroom Risotto - 350 calories per portion, 4 portions, None, Italy
"
112,350.0,100.0,360.0,200.0,150.0, Vegan Blueberry Acai Smoothie Bowl - 350 calories per portion | 1 portion | None | Origin, Roasted Edamame, Vegan Zucchini Noodles with Pesto, Vegan Lentil Soup, Ratatouille
113,350.0,90.0,100.0,350.0,300.0, Vegan Breakfast Banana Bread, Quinoa Energy Bites," Vegan Spinach and Artichoke Dip - 100 kcals per portion, 4 portions, no allergic warnings, origin", Falafel Wrap, Jackfruit Tacos
114,350.0,100.0,150.0,400.0,300.0, Vegan Pear and Walnut Oatmeal - 350 calories per portion | 1 portion | Contains nuts | Origin, Roasted Edamame," Cucumber and Avocado Sushi Rolls - 150 kcals per portion, 4 portions, allergic warning (avocado), origin", Vegan Shepherd's Pie," Chinese Vegan Tomato and Tofu Soup (300 calories/portion, 4 portions) - China
"
115,50.0,90.0,140.0,350.0,250.0, Vegan Breakfast Energy Balls, Stuffed Dates," Maple Roasted Nuts - 140 kcals per portion, 4 portions, no allergic warnings, origin", Vegan Stuffed Zucchini, Vegetable Curry
116,50.0,100.0,90.0,400.0,120.0, Vegan Breakfast Sushi Burrito, Energy Balls," Vegan Sweet Potato Toast - 90 kcals per portion, 4 portions, no allergic warnings, origin"," Vegan Ratatouille Pasta
Total calories per portion", Cucumber and Tomato Salad
117,300.0,100.0,200.0,350.0,250.0, Vegan Buckwheat Banana Pancakes - 300 calories per portion | 1 portion | Contains gluten | Origin, Energy Balls, Stuffed Grape Leaves," Cuban Black Beans and Rice
Total calories per portion"," Jackfruit Tacos - 250 calories per portion, 4 portions, None, Mexico

"
118,250.0,100.0,70.0,550.0,182.0, Vegan Coconut Yogurt with Fruit - 250 calories per portion | 1 portion | None | Origin, Roasted Pumpkin Seeds," Watermelon and Mint Salad - 70 kcals per portion, 4 portions, no allergic warnings, origin"," Vegan Pad Thai
Total calories per portion", Carrot and Ginger Soup
119,300.0,100.0,180.0,350.0,150.0, Vegan Apple Cinnamon Quinoa - 300 calories per portion | 1 portion | None | Origin, Fresh Fruit Salad," Sticky Coconut Rice Balls - 180 kcals per portion, 4 portions, no allergic warnings, origin", Moroccan Chickpea Stew, Chickpea Salad
120,250.0,100.0,480.0,300.0,300.0, Vegan Oatmeal Raisin Overnight Oats - 250 calories per portion | 2 portions | Contains gluten | Origin, Fresh Fruit Salad, Vegan Cucumber Sushi Rolls, Vegan Baked Ziti," Peanut Noodle Salad - 300 calories per portion, 4 portions, Peanuts, Various
"
121,450.0,100.0,150.0,400.0,318.0, Vegan Breakfast Muffuletta, Overnight Chia Pudding," Zucchini Fritters - 150 kcals per portion, 4 portions, no allergic warnings, origin", Quinoa and Black Bean Burrito Bowl, Lentil and Mushroom Burgers
122,300.0,100.0,300.0,150.0,250.0, Vegan Breakfast Parfait, Baked Apple Chips, Veggie Spring Rolls, Tomato Basil Soup, Vegan Sushi Bowl
123,350.0,100.0,680.0,350.0,350.0, Quinoa Porridge - 350 calories per portion | 1 portion | Contains nuts | Origin, Energy Balls, Sweet and Sour Tofu, Moroccan Chickpea Stew, Soba Noodle Stir-Fry
124,350.0,80.0,400.0,250.0,300.0, Vegan Savory Breakfast Muffins - 350 calories per portion | 1 portion | Contains gluten | Origin, Fruit Salad, Vegan Tzatziki and Pita Bread, Caprese Salad," British Vegan Ploughman's Lunch (300 calories/portion, 3 portions) - United Kingdom
"
125,300.0,100.0,80.0,300.0,300.0, Vegan Breakfast Parfait, Fresh Fruit Salad, Vegan Carrot Cake Energy Balls, Lentil and Vegetable Stir-Fry, Quinoa Stuffed Bell Peppers
126,150.0,100.0,140.0,250.0,350.0, Vegan Peanut Butter Banana Smoothie, Roasted Pumpkin Seeds," Cauliflower Buffalo Wings - 140 kcals per portion, 4 portions, no allergic warnings, origin", Vegan Mushroom and Spinach Lasagna, Quinoa Chili
127,300.0,100.0,520.0,200.0,300.0, Vegan Pumpkin Muffins - 300 calories per portion | 2 portions | Contains gluten | Origin, Chilled Gazpacho, Vegan Mac and Cheese, Greek Salad with Tofu, Vegan General Tso's Tofu
128,300.0,100.0,600.0,300.0,300.0, Vegan Buckwheat Banana Pancakes - 300 calories per portion | 1 portion | Contains gluten | Origin, Roasted Pumpkin Seeds, Vegan Indonesian Gado Gado," Indian Aloo Gobi
Total calories per portion"," Vegetable Stir-Fry with Peanut Sauce - 300 calories per portion, 4 portions, Peanuts, Various

"
129,200.0,100.0,180.0,400.0,220.0, Vegan Breakfast Quinoa Salad, Chilled Gazpacho," Vegan Pumpkin Muffins - 180 kcals per portion, 4 portions, no allergic warnings, origin", Vegan Shepherd's Pie, Quinoa and Vegetable Stir Fry
130,300.0,100.0,90.0,300.0,350.0, Vegan Breakfast Tostadas, Overnight Chia Pudding," Rice Cakes with Almond Butter - 90 kcals per portion, 4 portions, allergic warning (almonds), origin"," Vegan Caesar Wrap
Total calories per portion"," Vegan Stir-Fried Noodles - 350 calories per portion, 4 portions, None, Various
"
131,450.0,100.0,120.0,300.0,150.0, Vegan Blueberry Muffins, Roasted Edamame," Vegan Almond Butter Energy Balls - 120 kcals per portion, 4 portions, allergic warning (almonds), origin", Lentil Sloppy Joes, Ratatouille
132,600.0,100.0,100.0,150.0,150.0, Vegan Breakfast Tofu Bowl, Chilled Gazpacho," Vegan Energy Balls - 100 kcals per portion, 4 portions, no allergic warnings, origin", Tomato Basil Soup, Chickpea Salad
133,200.0,100.0,280.0,400.0,300.0, Vegan Breakfast Phyllo Cups, Fresh Fruit Salad, Vegan Chocolate Mousse, Vegan Vegetable Biryani, Chickpea Curry
134,600.0,100.0,130.0,300.0,300.0, Vegan Breakfast Tofu Bowl, Roasted Edamame," Sweet and Spicy Roasted Cashews - 130 kcals per portion, 4 portions, allergic warning (cashews), origin", Lentil and Quinoa Salad, Roasted Vegetable Quinoa Bowl
135,500.0,100.0,200.0,450.0,305.0, Vegan Breakfast Croque Madame, Chilled Gazpacho," Vegan Strawberry Banana Smoothie - 200 kcals per portion, 4 portions, no allergic warnings, origin"," Italian Vegan Pizza
Total calories per portion", Vegan Baked Ziti
136,300.0,100.0,130.0,350.0,350.0, Vegan Breakfast Stromboli, Roasted Edamame," Oven-Baked Sweet Potato Fries - 130 kcals per portion, 4 portions, no allergic warnings, origin", Vegan Butternut Squash Risotto," Vegan Spinach and Mushroom Quesadilla - 350 calories per portion, 2 portions, may contain gluten"
137,250.0,100.0,130.0,250.0,250.0, Vegan Berry Chia Smoothie - 250 calories per portion | 2 portions | None | Origin, Fresh Fruit Salad," Vegan Thai Spring Rolls - 130 kcals per portion, 4 portions, no allergic warnings, origin", Vegan Mushroom and Spinach Lasagna," Chickpea Stew - 250 calories per portion, 6 portions, Allergic to legumes, Middle East
"
138,250.0,100.0,90.0,200.0,300.0, Vegan Pancakes - 250 calories per portion | 2 portions | Contains gluten | Origin, Chilled Gazpacho," Roasted Brussels Sprouts with Balsamic Glaze - 90 kcals per portion, 4 portions, no allergic warnings, origin", Vegan Spinach and Artichoke Dip," Chinese Vegan Eggplant with Garlic Sauce (300 calories/portion, 3 portions) - China
"
139,350.0,100.0,180.0,400.0,350.0, Vegan Breakfast Banana Bread, Roasted Almonds," Spinach and Mushroom Quesadillas - 180 kcals per portion, 4 portions, no allergic warnings, origin", Vegan Teriyaki Tofu Stir-Fry," Chinese Vegan Kung Pao Tofu (350 calories/portion, 2 portions) - China
"
140,400.0,100.0,520.0,350.0,300.0, Vegan Breakfast Empanadas - 400 calories per portion | 1 portion | Contains gluten | Origin, Chilled Gazpacho, Vegan Spinach and Artichoke Crostini," Vegan Sweet and Sour Tofu
Total calories per portion", Couscous Salad
141,450.0,80.0,80.0,350.0,250.0, Vegan Breakfast Pho, Fruit Salad," Veggie Spring Rolls with Peanut Sauce - 80 kcals per portion, 4 portions, allergic warning (peanuts), origin", Vegan Beetroot and Chickpea Burger, Mushroom Risotto
142,300.0,100.0,200.0,300.0,300.0, Vegan Cinnamon Rolls - 300 calories per portion | 1 portion | Contains gluten | Origin, Fresh Fruit Salad," Vegan Baked Raspberry Oatmeal - 200 kcals per portion, 4 portions, no allergic warnings, origin", Lentil Loaf," Greek Vegan Tzatziki with Pita Bread (300 calories/portion, 2 portions) - Greece
"
143,350.0,80.0,200.0,250.0,300.0, Tofu Scramble, Stuffed Dates," Vegan Mango Smoothie Bowl - 200 kcals per portion, 4 portions, no allergic warnings, origin", Vegan Cuban Black Bean Soup," Tahini Chickpea Salad - 300 calories per portion, 4 portions, None, Various
"
144,250.0,80.0,70.0,350.0,350.0, Vegan Blueberry Muffin Overnight Oats - 250 calories per portion | 2 portions | Contains gluten | Origin, Fruit Salad," Watermelon and Mint Salad - 70 kcals per portion, 4 portions, no allergic warnings, origin", Vegan Fajitas," Italian Vegan Pesto Pasta (350 calories/portion, 3 portions) - Italy
"
145,350.0,100.0,360.0,350.0,350.0, Vegan Mushroom and Spinach Omelette - 350 calories per portion | 1 portion | None | Origin, Roasted Almonds, Vegan Turkish Delight, Vegan BBQ Jackfruit Sandwich," Vegan Fajitas - 350 calories per portion, 4 portions, None, Mexico
"
146,250.0,100.0,120.0,550.0,320.0, Vegan Breakfast Bruschetta, Energy Balls, Vegan Caprese Skewers," Vegan Thai Basil Fried Rice
Total calories per portion", Chickpea Salad Sandwich
147,250.0,80.0,120.0,300.0,250.0, Vegan Raspberry Almond Scones - 250 calories per portion | 2 portions | Contains gluten and nuts | Origin, Fruit Salad," Roasted Chickpeas - 120 kcals per portion, 4 portions, no allergic warnings, origin"," Vegan Caesar Wrap
Total calories per portion", Moroccan Chickpea Stew
148,300.0,100.0,130.0,400.0,350.0, Vegan Breakfast Tacos - 300 calories per portion | 2 portions | None | Origin, Roasted Pumpkin Seeds," Oven-Baked Sweet Potato Fries - 130 kcals per portion, 4 portions, no allergic warnings, origin", Thai Red Curry with Vegetables, Falafel Wrap
149,250.0,80.0,240.0,200.0,246.0, Vegan Banana Bread - 250 calories per portion | 2 portions | Contains gluten | Origin, Fruit Salad, Vegan Stuffed Portobello Mushrooms," Spanish Gazpacho
Total calories per portion", Black Bean and Corn Salad
150,350.0,100.0,90.0,200.0,350.0, Vegan Spinach and Mushroom Quiche - 350 calories per portion | 1 portion | Contains gluten | Origin, Roasted Pumpkin Seeds," Guacamole with Tortilla Chips - 90 kcals per portion, 4 portions, allergic warning (avocado), origin"," Vegan Tofu Scramble
Total calories per portion", Mushroom Tacos
151,50.0,90.0,160.0,250.0,200.0, Vegan Breakfast Sushi Burrito, Quinoa Energy Bites," Vegan Taco Lettuce Wraps - 160 kcals per portion, 4 portions, no allergic warnings, origin", Cauliflower Buffalo Wings," Vegan BBQ Tofu - 200 calories per portion, 4 portions, Soy, United States
"
152,250.0,100.0,100.0,250.0,350.0, Sweet Potato Toast - 250 calories per portion | 1 portion | None | Origin, Overnight Chia Pudding," Homemade Hummus with Carrot Sticks - 100 kcals per portion, 4 portions, no allergic warnings, origin", Vegan Cuban Black Bean Soup, Vegan BBQ Pulled Jackfruit Sandwich
153,400.0,100.0,280.0,300.0,250.0, Vegan French Toast, Chilled Gazpacho, Baked Tofu Nuggets, Chickpea and Vegetable Couscous," Moroccan Lentil Salad - 250 calories per portion, 4 portions, None, Morocco
"
154,400.0,100.0,100.0,200.0,220.0, Vegan Breakfast Skillet, Fresh Fruit Salad," Baked Tofu Nuggets - 100 kcals per portion, 4 portions, no allergic warnings, origin", Veggie Stir-Fry, Lentil and Vegetable Stir Fry
155,350.0,100.0,280.0,350.0,200.0, Vegan Sweet Potato Hash Browns - 350 calories per portion | 1 portion | None | Origin, Chilled Gazpacho, Baked Tofu Nuggets, Chickpea Salad Sandwich, Lentil Curry
156,350.0,100.0,110.0,350.0,300.0, Vegan Savory Breakfast Muffins - 350 calories per portion | 1 portion | Contains gluten | Origin, Roasted Almonds," Oatmeal Raisin Energy Balls - 110 kcals per portion, 4 portions, no allergic warnings, origin", Vegan Nachos, Ratatouille-Stuffed Peppers
157,200.0,100.0,100.0,400.0,280.0, Vegan Breakfast Enchiladas, Roasted Almonds," Stuffed Mini Peppers with Vegan Cream Cheese - 100 kcals per portion, 4 portions, no allergic warnings, origin"," Vegan Bolognese with Spaghetti
Total calories per portion", Vegan Stuffed Shells
158,300.0,90.0,160.0,350.0,200.0, Vegan Oatmeal Raisin Cookies, Quinoa Energy Bites," Vegan Bruschetta Pasta Salad - 160 kcals per portion, 4 portions, no allergic warnings, origin", Buddha Bowl with Tahini Dressing," Lentil Spinach Soup - 200 calories per portion, 4 portions, None, Various
"
159,400.0,90.0,280.0,450.0,300.0, Vegan Breakfast Nachos - 400 calories per portion | 1 portion | Contains soy | Origin, Stuffed Dates, Vegan Lemon Poppy Seed Muffins," Falafel Wrap with Tahini Sauce
Total calories per portion", Couscous Salad
160,250.0,100.0,480.0,400.0,350.0, Sweet Potato Toast - 250 calories per portion | 1 portion | None | Origin, Toasted Coconut Chips, Vegan Lentil Burgers," Veggie Tacos with Homemade Tortillas
Total calories per portion", Vegan Shakshuka
161,400.0,100.0,200.0,350.0,300.0, Veggie Sausage and Hash Browns - 400 calories per portion | 1 portion | Contains soy | Origin, Fresh Fruit Salad," Quinoa Salad with Roasted Vegetables - 200 kcals per portion, 4 portions, no allergic warnings, origin"," Italian Vegan Caprese Sandwich
Total calories per portion"," Vegan Spinach and Mushroom Stuffed Shells - 300 calories per portion, 2 portions, may contain gluten"
162,250.0,100.0,120.0,250.0,350.0, Vegan Berry Parfait - 250 calories per portion | 2 portions | Contains nuts | Origin, Baked Apple Chips," Vegan Chocolate Chip Cookies - 120 kcals per portion, 4 portions, no allergic warnings, origin"," Greek Salad with Tofu Feta
Total calories per portion", Vegan Nachos
163,400.0,100.0,200.0,400.0,280.0, Vegan Breakfast Nachos - 400 calories per portion | 1 portion | Contains soy | Origin, Roasted Almonds," Vegan Broccoli Pesto Pasta - 200 kcals per portion, 4 portions, no allergic warnings, origin"," Vegan Gnocchi with Pesto Sauce
Total calories per portion", Lentil and Spinach Curry
164,400.0,100.0,620.0,400.0,250.0, Vegan Breakfast Spanakopita, Toasted Coconut Chips, Bean Burritos, Vegan Teriyaki Tofu Stir-Fry, Black Bean Quinoa Salad
165,350.0,100.0,200.0,300.0,350.0, Vegan Spinach and Mushroom Quiche - 350 calories per portion | 1 portion | Contains gluten | Origin, Fresh Fruit Salad," Vegan Broccoli Pesto Pasta - 200 kcals per portion, 4 portions, no allergic warnings, origin", Mexican Rice Bowl," Tofu Stir-Fry - 350 calories per portion, 2 portions, may contain soy"
166,350.0,80.0,460.0,300.0,188.0, Vegan Breakfast Polenta - 350 calories per portion | 1 portion | None | Origin, Stuffed Dates, Veggie Tacos," Vegan Sushi Rolls
Total calories per portion", Lentil and Vegetable Stir Fry
167,250.0,100.0,200.0,350.0,280.0, Vegan Coconut Yogurt with Fruit - 250 calories per portion | 1 portion | None | Origin, Energy Balls," Vegan Pancakes with Maple Syrup - 200 kcals per portion, 4 portions, no allergic warnings, origin", Vegan Sweet Potato Curry, Vegan Quiche
168,400.0,80.0,340.0,400.0,300.0, Vegan Quinoa Breakfast Skillet - 400 calories per portion | 1 portion | None | Origin, Stuffed Dates, Vegan Nachos, Vegan Thai Pineapple Fried Rice with Tofu," Lentil Curry - 300 calories per portion, 4 portions, Gluten (optional), India
"
169,50.0,100.0,660.0,200.0,180.0, Vegan Breakfast Smoothie, Roasted Pumpkin Seeds, Vegan Pesto Pasta," Spanish Gazpacho
Total calories per portion", Mediterranean Salad
170,350.0,100.0,100.0,300.0,245.0, Vegan Breakfast Croissant, Roasted Almonds," Homemade Hummus with Carrot Sticks - 100 kcals per portion, 4 portions, no allergic warnings, origin", Ratatouille, Tofu Stir Fry
171,300.0,100.0,200.0,250.0,250.0, Vegan Chocolate Banana Smoothie Bowl - 300 calories per portion | 1 portion | None | Origin, Roasted Pumpkin Seeds, Hummus and Pita Bread, Veggie Stir-Fry," Mediterranean Quinoa Salad (250 calories/portion, 2 portions) - Greece
"
172,400.0,100.0,150.0,450.0,200.0, Vegan Breakfast Quesadilla - 400 calories per portion | 1 portion | Contains gluten | Origin, Overnight Chia Pudding," Zucchini Fritters - 150 kcals per portion, 4 portions, no allergic warnings, origin"," Vegan Sweet Potato and Black Bean Enchiladas
Total calories per portion"," Vegan Creamy Cauliflower Soup - 200 calories per portion, 4 portions, None, Various
"
173,250.0,80.0,120.0,400.0,250.0, Vegan Oatmeal Raisin Overnight Oats - 250 calories per portion | 2 portions | Contains gluten | Origin, Stuffed Dates," Vegan Cucumber Sushi Rolls - 120 kcals per portion, 4 portions, no allergic warnings, origin", Vegan Vegetable Biryani," Thai Vegan Green Papaya Salad (250 calories/portion, 4 portions) - Thailand
"
174,450.0,100.0,90.0,450.0,355.0, Vegan Breakfast Pho, Toasted Coconut Chips," Roasted Brussels Sprouts with Balsamic Glaze - 90 kcals per portion, 4 portions, no allergic warnings, origin"," Falafel Wrap with Tahini Sauce
Total calories per portion", Chickpea Salad
175,150.0,100.0,160.0,300.0,250.0, Vegan Breakfast Pita Pockets, Roasted Edamame," Vegan Bruschetta Pasta Salad - 160 kcals per portion, 4 portions, no allergic warnings, origin", Vegan Chinese Hot and Sour Soup," Vegan Tofu and Vegetable Skewers - 250 calories per portion, 2 portions, may contain soy"
176,300.0,90.0,300.0,300.0,350.0, Vegan Pumpkin Muffins - 300 calories per portion | 2 portions | Contains gluten | Origin, Stuffed Dates, Veggie Spring Rolls," Vegan Eggplant Rollatini
Total calories per portion", Vegan Goulash
177,400.0,100.0,160.0,200.0,220.0, Vegan Breakfast Quesadilla - 400 calories per portion | 1 portion | Contains gluten | Origin, Roasted Edamame," Chickpea Salad Lettuce Wraps - 160 kcals per portion, 4 portions, no allergic warnings, origin", Tom Yum Soup, Lentil and Vegetable Stir Fry
178,300.0,100.0,680.0,300.0,170.0, Vegan Breakfast Potato Hash - 300 calories per portion | 1 portion | None | Origin, Fresh Fruit Salad, Vegan Protein Bars, Vegan Chili, Vegan Caprese Salad
179,50.0,100.0,160.0,400.0,220.0, Vegan Breakfast Smoothie, Toasted Coconut Chips," Vegan Raspberry Bars - 160 kcals per portion, 4 portions, no allergic warnings, origin"," Quinoa Salad with Roasted Vegetables
Total calories per portion", Quinoa and Vegetable Stir Fry
180,250.0,100.0,680.0,250.0,350.0, Vegan Green Breakfast Bowl - 250 calories per portion | 2 portions | None | Origin, Fresh Fruit Salad, Vegan Protein Bars, Vegan Thai Mango Salad, Vegan Butter Chicken
181,550.0,100.0,640.0,350.0,350.0, Granola with Soy Milk, Roasted Pumpkin Seeds, Vegan Tofu Scramble," Lebanese Fattoush Salad
Total calories per portion"," Greek Vegan Gemista (350 calories/portion, 2 portions) - Greece
"
182,400.0,80.0,150.0,500.0,300.0, Veggie Sausage and Hash Browns - 400 calories per portion | 1 portion | Contains soy | Origin, Fruit Salad," Cucumber and Avocado Sushi Rolls - 150 kcals per portion, 4 portions, allergic warning (avocado), origin"," Vegan Korean Bibimbap Bowl
Total calories per portion", Roasted Veggie Wrap
183,350.0,90.0,660.0,250.0,250.0, Vegan Breakfast Polenta - 350 calories per portion | 1 portion | None | Origin, Stuffed Dates, Vegan Pesto Pasta, Cauliflower Buffalo Wings, Vegan Soba Noodle Salad
184,200.0,90.0,140.0,200.0,200.0, Vegan Breakfast Enchiladas, Stuffed Dates," Mexican Street Corn Salad - 140 kcals per portion, 4 portions, no allergic warnings, origin"," Vegan Greek Avgolemono Soup
Total calories per portion", Lentil and Vegetable Soup
185,550.0,90.0,140.0,350.0,300.0, Granola with Soy Milk, Stuffed Dates," Vegan Lemon Bars - 140 kcals per portion, 4 portions, no allergic warnings, origin", Quinoa Stuffed Peppers, Beetroot Burger
186,350.0,80.0,140.0,250.0,350.0, Vegan Breakfast Pizza - 350 calories per portion | 1 portion | Contains gluten | Origin, Fruit Salad," Vegan Cinnamon Sugar Donuts - 140 kcals per portion, 4 portions, no allergic warnings, origin", Vegan Tofu Scramble, Vegan Pad See Ew
187,200.0,100.0,80.0,300.0,200.0, Overnight Chia Pudding, Baked Apple Chips," Veggie Spring Rolls with Peanut Sauce - 80 kcals per portion, 4 portions, allergic warning (peanuts), origin", Black Bean and Vegetable Quesadillas," Lentil Curry (200 calories/portion, 4 portions) - India
"
188,450.0,100.0,640.0,350.0,250.0, Vegan Biscuits and Gravy - 450 calories per portion | 1 portion | Contains gluten | Origin, Energy Balls, Vegan Tofu Scramble, Vegan Beetroot and Chickpea Burger, Vegan Caesar Salad
189,450.0,100.0,440.0,300.0,250.0, Vegan Breakfast Enchiladas - 450 calories per portion | 1 portion | Contains gluten | Origin, Energy Balls, Vegan Gyoza, Lebanese Tabbouleh Salad," Moroccan Lentil Salad - 250 calories per portion, 4 portions, None, Morocco
"
190,500.0,100.0,90.0,400.0,350.0, Vegan Breakfast Croque Madame, Baked Apple Chips," Guacamole with Tortilla Chips - 90 kcals per portion, 4 portions, allergic warning (avocado), origin"," Thai Red Curry with Tofu
Total calories per portion"," Chinese Vegan Dan Dan Noodles (350 calories/portion, 2 portions) - China
"
191,350.0,100.0,540.0,300.0,250.0, Vegan Apricot and Almond Granola Bars - 350 calories per portion | 1 portion | Contains nuts | Origin, Roasted Edamame, Stuffed Bell Peppers, Lentil Shepherd's Pie, Vegan Sushi Bowl
192,250.0,100.0,120.0,300.0,280.0, Vegan Cacao Banana Smoothie - 250 calories per portion | 2 portions | None | Origin, Toasted Coconut Chips, Vegan Mediterranean Hummus Bowl, Lentil Burgers, Vegan Quiche
193,550.0,100.0,360.0,150.0,350.0, Vegan Breakfast Cobbler, Roasted Pumpkin Seeds, Vegan Turkish Delight, Cabbage Stir-Fry, Tofu Tikka Masala
194,250.0,100.0,180.0,350.0,250.0, Vegan Blueberry Muffin Overnight Oats - 250 calories per portion | 2 portions | Contains gluten | Origin, Chilled Gazpacho," Vegan Apple Cinnamon Granola Bars - 180 kcals per portion, 4 portions, no allergic warnings, origin", Vegan Lentil Sloppy Joes," Vegan Lentil and Vegetable Casserole - 250 calories per portion, 4 portions, may contain gluten"
195,300.0,100.0,160.0,400.0,200.0, Vegan Pumpkin Spice Pancakes - 300 calories per portion | 1 portion | Contains gluten | Origin, Baked Apple Chips, Vegan Mexican Street Corn, Vegan Moroccan Vegetable Tagine, Butternut Squash Soup
196,400.0,100.0,120.0,300.0,300.0, Vegan Breakfast Hand Pies, Toasted Coconut Chips," Roasted Cauliflower Bites - 120 kcals per portion, 4 portions, no allergic warnings, origin", Lentil Bolognese," Vegan Bulgogi - 300 calories per portion, 4 portions, None, Korea
"
197,400.0,100.0,200.0,400.0,188.0, Vegan Breakfast Quesadilla - 400 calories per portion | 1 portion | Contains gluten | Origin, Chilled Gazpacho," Vegan Mango Smoothie Bowl - 200 kcals per portion, 4 portions, no allergic warnings, origin", Vegan Ramen, Lentil and Vegetable Stir Fry
198,50.0,80.0,60.0,250.0,150.0, Vegan Breakfast Sushi Burrito, Fruit Salad," Sliced Apples with Cinnamon - 60 kcals per portion, 4 portions, no allergic warnings, origin", Vegan Sushi Rolls, Chickpea Salad
199,400.0,90.0,200.0,550.0,300.0, Vegan Breakfast Casserole - 400 calories per portion | 1 portion | None | Origin, Quinoa Energy Bites," Vegan Peanut Butter Banana Smoothie - 200 kcals per portion, 4 portions, allergic warning (peanuts), origin"," Korean Bibimbap
Total calories per portion"," Vegan Baked Falafel - 300 calories per portion, 3 portions, may contain gluten"
200,250.0,100.0,140.0,250.0,350.0, Vegan Berry Chia Smoothie - 250 calories per portion | 2 portions | None | Origin, Roasted Almonds," Maple Roasted Nuts - 140 kcals per portion, 4 portions, no allergic warnings, origin", Vegan Cuban Black Bean Soup," Chinese Vegan General Tso's Cauliflower (350 calories/portion, 3 portions) - China
"
