,breakfast_calories,morning snacks_calories,afternoon snacks_calories,lunch_calories,dinner_calories,breakfast,morning snacks,afternoon snacks,lunch,dinner
112,300.0,100.0,200.0,20.0,200.0," Indian poha cutlet - 300 calories per portion, 2 portions, contains gluten, origin", Rice Paper Spring Rolls, Bruschetta with Mozzarella and Basil, Moroccan Mint Tea, Vegan Bibimbap
113,250.0,80.0,140.0,20.0,200.0, Vegan Breakfast Oats and Berries, Fresh Squeezed Orange Juice," Vegan Greek Salad - 140 kcals per portion, 4 portions, no allergic warnings, origin", Moroccan Mint Tea," Roasted Vegetable Frittata - 200 calories/portion, 4 portions, Origin"
114,100.0,100.0,100.0,20.0,200.0, Vegan Breakfast Falafel, Cucumber Rolls with Hummus - Approx, Tzatziki with Pita Bread, Moroccan Mint Tea, Ratatouille
115,250.0,100.0,130.0,20.0,150.0, Vegan Sausage and Biscuits, Cucumber and Tomato Salad, Mini Vegetable Quesadillas, Moroccan Mint Tea, Cauliflower Fried Rice
116,250.0,100.0,300.0,20.0,200.0, Vegan Pancakes - 250 calories per portion | 2 portions | Contains gluten | Origin, Rice Paper Spring Rolls, Mini Bagel Pizzas, Moroccan Mint Tea, Greek Salad
117,300.0,50.0,200.0,20.0,200.0, Vegan Protein Smoothie," Homemade Fruit Popsicles - 50kcals per portion, 2 portions
    Origin", Guacamole with Tortilla Chips, Moroccan Mint Tea," Caprese Stuffed Portobello Mushrooms - 200 calories/portion, 4 portions, contains dairy (Italy)
"
118,200.0,80.0,180.0,20.0,200.0, Avocado Toast, Fresh Watermelon Slices - Approx, Chicken Lettuce Wraps, Moroccan Mint Tea," Spinach and Goat Cheese Stuffed Tomatoes - 200 calories/portion, 4 portions, Origin"
119,320.0,90.0,250.0,20.0,220.0," Apple cinnamon quinoa pancakes (320 calories per portion, 2 portions, nut-free, American origin)
", Fruit Salad, Chicken Lettuce Cups, Moroccan Mint Tea, Lentil and Vegetable Stir Fry
120,250.0,80.0,250.0,20.0,150.0, Vegan Pancakes - 250 calories per portion | 2 portions | Contains gluten | Origin, Cheesy Popcorn, Sweet potato and black bean sliders, Moroccan Mint Tea, Swiss Chard and Lentil Soup
121,250.0,100.0,280.0,20.0,200.0, Vegan Maple Pecan Overnight Oats - 250 calories per portion | 2 portions | Contains nuts | Origin, Greek Salad Skewers, Vegan Chocolate Mousse, Moroccan Mint Tea, Spaghetti Aglio e Olio
122,150.0,90.0,200.0,20.0,180.0, Vegan Pancakes, Vegetarian Spring Rolls, Fruit and Yogurt Parfait, Moroccan Mint Tea," Greek salad - 180 calories per portion, 4 portions, contains dairy (Greece)
"
123,300.0,50.0,120.0,20.0,160.0, Vegan Peanut Butter Banana Smoothie - 300 calories per portion | 1 portion | Contains nuts | Origin," Fruit Salad - 50kcals per portion, 2 portions
   Origin", Baked Pita Chips with Hummus, Moroccan Mint Tea," Vegan Tofu Scramble - 160 calories per portion, 1 portion, may contain soy"
124,300.0,100.0,250.0,20.0,200.0, Quinoa Breakfast Cookies, Watermelon and feta skewers, Mini chicken and vegetable skewers, Moroccan Mint Tea," Lentil curry - 200 calories per portion, 6 portions, contains gluten (India)
"
125,300.0,80.0,90.0,20.0,200.0, Shakshuka with Spinach, Fruit Salad," Baked Zucchini Chips - 90 kcals per portion, 4 portions, no allergic warnings, origin", Moroccan Mint Tea," Caprese Stuffed Portobello Mushrooms - 200 calories/portion, 4 portions, contains dairy (Italy)
"
126,250.0,100.0,240.0,20.0,200.0, Banana Bread, Cucumber Sandwich, Peanut butter and banana sushi rolls, Moroccan Mint Tea," Lentil soup with vegetables – 200 calories per portion, 6 portions, vegan-friendly (origin"
127,200.0,100.0,350.0,20.0,200.0, Overnight Chia Pudding, Energy Balls, Eggplant rollatini, Moroccan Mint Tea, Stuffed Zucchini Boats
128,150.0,100.0,150.0,20.0,200.0, Greek Yogurt with Berries, Rice Cake with Hummus and Cucumber," Stuffed Mini Bell Peppers - 150 kcals per portion, 4 portions, gluten-free (Various)", Moroccan Mint Tea," Spinach and feta stuffed mushrooms - 200 kcals per portion, 4 portions, vegetarian, gluten-free
"
129,200.0,80.0,150.0,20.0,200.0, Peanut Butter and Banana Smoothie, Fruit Salad, Stuffed Bell Peppers, Moroccan Mint Tea," Italian Caprese Salad (200 calories/portion, 2 portions) - Italy
"
130,200.0,100.0,90.0,20.0,182.0, Overnight Oats - 200 calories per portion | 2 portions | Contains gluten | Origin, Energy Balls - Approx, Gazpacho, Moroccan Mint Tea, Carrot and Ginger Soup
131,250.0,100.0,240.0,20.0,220.0, Cucumber Sandwich, Greek yogurt with berries, Veggie Sushi Rolls, Moroccan Mint Tea, Grilled Vegetable Skewers
132,200.0,90.0,180.0,20.0,200.0, Mini Vegetable Quiche, Fruit Salad," Vegan Apple Cinnamon Granola Bars - 180 kcals per portion, 4 portions, no allergic warnings, origin", Moroccan Mint Tea," Lentil Spinach Soup - 200 calories per portion, 4 portions, None, Various
"
133,320.0,90.0,240.0,20.0,200.0," Vegetable and cheese strata (320 calories per portion, 2 portions, contains dairy, American origin)
", Fruit Salad, Chickpea and Vegetable Curry, Moroccan Mint Tea," Caprese Stuffed Avocado - 200 calories/portion, 4 portions, contains dairy (Italy)
"
134,300.0,100.0,250.0,20.0,200.0, Feta and Spinach Muffins, Zesty Lime Popcorn - Approx, Mini chicken quesadilla, Moroccan Mint Tea, Vegan Goulash
135,300.0,100.0,120.0,20.0,160.0," Rice porridge with cinnamon and sugar - 300 calories per portion, 2 portions, no allergic warnings, origin", Roasted Chickpeas," Vegan Chocolate Chip Cookies - 120 kcals per portion, 4 portions, no allergic warnings, origin", Moroccan Mint Tea," Vegan Lentil and Vegetable Shepherd's Pie - 160 calories per portion, 4 portions, may contain gluten"
136,320.0,100.0,200.0,20.0,150.0," Spinach and mushroom breakfast wrap (320 calories per portion, 2 portions, nut-free, American origin)
", Corn on the Cob, Cheese and Tomato Toasties, Moroccan Mint Tea," Steamed Fish with Lemon Butter Sauce - 150 calories per portion, 4 portions, no allergic warnings, Origin"
137,300.0,100.0,160.0,20.0,80.0, Shakshuka, Kiwi and Strawberry Smoothie, Spinach and Feta Stuffed Mushrooms, Moroccan Mint Tea," Spinach and feta stuffed mushrooms - 80 calories per portion, 6 portions, contains dairy (Greece)
"
138,300.0,100.0,200.0,20.0,220.0, Omelette with Spinach and Feta, Zesty Lime Popcorn - Approx, Mini Ricotta and Spinach Pastries, Moroccan Mint Tea, Lentil Soup with Quinoa
139,200.0,100.0,150.0,20.0,150.0, Roasted Vegetable Breakfast Tacos, Fruit Smoothie Popsicles - Approx, Baked Mozzarella Sticks, Moroccan Mint Tea, Greek Salad
140,250.0,70.0,100.0,20.0,200.0, Vegan Cinnamon Apple Oatmeal - 250 calories per portion | 2 portions | None | Origin, Kale chips, Zucchini Tomato Bites, Moroccan Mint Tea," Ratatouille Stuffed Zucchini - 200 calories/portion, 4 portions, Origin"
141,250.0,100.0,150.0,20.0,150.0," Shakarkandi ki chaat (Indian sweet potato salad) - 250 calories per portion, 2 portions, no allergic warnings, origin", Chilled Gazpacho Soup - Approx, Roasted Red Pepper and Feta Dip, Moroccan Mint Tea," Ratatouille - 150 calories/portion, 4 portions, contains garlic (France)
"
142,200.0,100.0,80.0,20.0,200.0, Mini Vegetable Quiche, Roasted Beetroot Chips, Caprese Skewers with Balsamic Glaze, Moroccan Mint Tea," Spinach and feta stuffed mushrooms - 200 kcals per portion, 4 portions, vegetarian, gluten-free
"
143,250.0,80.0,80.0,20.0,180.0, Vegan Tofu Benedict, Mango with Chili Powder, Stuffed Mini Peppers, Moroccan Mint Tea, Ratatouille
144,200.0,100.0,180.0,20.0,200.0, Vegan Scones - 200 calories per portion | 2 portions | Contains gluten | Origin," Dates Stuffed with Almond Butter - 100kcals per portion, 2 portions
    Origin", Smashed avocado and tomato toast, Moroccan Mint Tea, Quinoa Salad
145,150.0,80.0,50.0,20.0,200.0," Vegemite on toast - 150 calories per portion, 1 portion, contains gluten, origin", Fruit Salad, Fruit Salad, Moroccan Mint Tea," Greek-style stuffed zucchini - 200 calories per portion, 4 portions, none (Greece)
"
146,50.0,100.0,150.0,20.0,200.0, Vegan Breakfast Sushi Burrito, Caprese Skewers, Paprika and Cumin Spiced Roasted Chickpeas, Moroccan Mint Tea, Zucchini Noodles with Pesto
147,200.0,90.0,150.0,20.0,220.0," Yogurt and fruit smoothie (200 calories per portion, 2 portions, contains dairy, American origin)
", Quinoa Energy Bites," Energy Balls (Dates, Nuts, and Coconut)", Moroccan Mint Tea, Lentil and Vegetable Stir Fry
148,250.0,100.0,160.0,20.0,182.0, Vegan Breakfast Quesadilla, Rice Paper Spring Rolls, Sliced Apples with Peanut Butter, Moroccan Mint Tea, Carrot and Ginger Soup
149,200.0,100.0,170.0,20.0,220.0," Yogurt and fruit smoothie (200 calories per portion, 2 portions, contains dairy, American origin)
", Fruit Salad, Mushroom Bruschetta, Moroccan Mint Tea," Greek Salad - 220kcals per portion, 4 portions, contains dairy
"
150,200.0,100.0,100.0,20.0,200.0, Quinoa Breakfast Skillet, Fruit Salad, Chocolate-dipped strawberries, Moroccan Mint Tea," Ratatouille Stuffed Zucchini - 200 calories/portion, 4 portions, Origin"
151,300.0,70.0,80.0,20.0,200.0, Vegan Mango Coconut Chia Pudding - 300 calories per portion | 1 portion | None | Origin, Fresh Fruit Salad, Chocolate-dipped strawberries, Moroccan Mint Tea," Greek-style stuffed zucchini - 200 calories per portion, 4 portions, none (Greece)
"
152,300.0,100.0,90.0,20.0,200.0," Yogurt and fruit smoothie with almond milk (300kcals per portion, 1 portion, nut allergies)
", Chilled Gazpacho Soup - Approx, Chicken satay skewers, Moroccan Mint Tea, Spanish Gazpacho
153,300.0,80.0,120.0,20.0,180.0, Quinoa Breakfast Bowl, Fruit Salad, Tabbouleh Salad, Moroccan Mint Tea, Vegan Ratatouille
154,300.0,100.0,200.0,20.0,240.0, Saffron Yogurt with Fruit, Carrot Sticks with Ranch Dip, Sweet Potato Fries, Moroccan Mint Tea," Citrus Quinoa Salad - 240kcals per portion, 4 portions
"
155,200.0,100.0,150.0,20.0,240.0, Veggie Breakfast Couscous, Guacamole Stuffed Cherry Tomatoes, Zucchini Fritters, Moroccan Mint Tea, Vegan Margherita Pizza
156,300.0,100.0,120.0,20.0,150.0, Chocolate Chia Protein Pudding, Cucumber and Hummus Rolls," Vegan Avocado Toast - 120 kcals per portion, 4 portions, allergic warning (avocado), origin", Moroccan Mint Tea, Swiss Chard and Lentil Soup
157,320.0,100.0,120.0,20.0,200.0," Egg and cheese breakfast roll-ups (320 calories per portion, 2 portions, contains dairy, American origin)
", Chilled Gazpacho Soup - Approx," Brown Butter Almond Madeleines - 120 kcals per portion, 5 portions, contains gluten, tree nuts (France)", Moroccan Mint Tea," Eggplant and Tomato Gratin - 200 calories/portion, 2 portions, Origin"
158,200.0,100.0,90.0,20.0,150.0, Avocado Toast, Overnight Chia Pudding, Vegetable Spring Rolls, Moroccan Mint Tea, Lentil Soup
159,300.0,80.0,280.0,20.0,150.0, Apple Cinnamon Porridge, Fruit Salad, Cucumber and Avocado Sushi, Moroccan Mint Tea, Ratatouille
160,250.0,100.0,320.0,20.0,180.0, Overnight Chia Oats, Energy Balls, Vegan Mediterranean Flatbread Pizza, Moroccan Mint Tea, Tofu Stir-Fry
161,300.0,70.0,230.0,20.0,225.0, Tomato Basil Avocado Toast, Fresh Fruit Salad, Nachos with Salsa and Guacamole, Moroccan Mint Tea, Vegan Stuffed Mushrooms
162,300.0,70.0,120.0,20.0,240.0, Vegan Smoothie Bowl, Kale chips, Greek Yogurt Berry Parfait, Moroccan Mint Tea, Spaghetti Aglio e Olio
163,200.0,80.0,150.0,20.0,150.0, Apple Cinnamon Porridge, Fruit Salad, Mini quinoa sliders, Moroccan Mint Tea, Lentil Soup
164,300.0,80.0,120.0,20.0,200.0," Avocado toast - 300 calories per portion, 2 portions, may contain gluten, origin", Baked Apple Chips, Spinach Balls, Moroccan Mint Tea, Greek Salad
165,250.0,70.0,100.0,20.0,210.0," Syrian ka'ak (sesame bread rings) - 250 calories per portion, 1 portion, contains gluten, origin", Kale chips," Vegan Mushroom Soup - 100 kcals per portion, 4 portions, no allergic warnings, origin", Moroccan Mint Tea, Lentil and Vegetable Stir Fry
166,250.0,100.0,100.0,20.0,200.0," Chia seed pudding with mixed berries (250kcals per portion, 2 portions)
", Corn on the Cob," Mini caprese salad skewers (cherry tomatoes, mozzarella, basil)", Moroccan Mint Tea," Baked Falafel - 200 calories/portion, 4 portions, Origin"
167,300.0,80.0,80.0,20.0,100.0, Quinoa Porridge, Cheesy Popcorn, Veggie Noodle Salad, Moroccan Mint Tea," Japanese Miso Soup with Tofu (100 calories/portion, 4 portions) - Japan
"
168,250.0,100.0,100.0,20.0,200.0," Tofu scramble with vegetables (250kcals per portion, 2 portions, soy allergies, origin", Greek yogurt with berries, Cucumber and Watermelon Salad, Moroccan Mint Tea, Lentil and Vegetable Bolognese
169,300.0,100.0,360.0,20.0,180.0, Greek Yogurt with Honey and Pistachios, Energy Balls - Approx, Vegan Zucchini Noodles with Pesto, Moroccan Mint Tea," Greek Roasted Vegetables - 180kcals per portion, 4 portions
"
170,300.0,100.0,100.0,20.0,200.0, Fruit Smoothie Bowl - 300 calories per portion | 1 portion | None | Origin, Quinoa Energy Bites," Homemade Hummus with Carrot Sticks - 100 kcals per portion, 4 portions, no allergic warnings, origin", Moroccan Mint Tea, Greek Stuffed Peppers
171,300.0,80.0,240.0,20.0,150.0, Savory Oatmeal with Vegetables, Fresh Squeezed Orange Juice, Thai Vegetable Spring Rolls, Moroccan Mint Tea, Veggie Stir-Fry
172,300.0,70.0,140.0,20.0,200.0," Scrambled eggs with spinach and feta cheese (300kcals per portion, 2 portions, dairy allergies, origin", Kale chips," Mexican Street Corn Salad - 140 kcals per portion, 4 portions, no allergic warnings, origin", Moroccan Mint Tea, Vegan Caprese Salad
173,200.0,80.0,200.0,20.0,210.0, Vegan Oatmeal Raisin Cookies - 200 calories per portion | 2 portions | Contains gluten | Origin, Cheesy Popcorn, Bruschetta with tomato and basil, Moroccan Mint Tea," Greek Briam - 210kcals per portion, 4 portions
"
174,250.0,100.0,100.0,20.0,200.0, Vegan Breakfast Sausage, Chilled Gazpacho Soup - Approx, Tomato Basil Bruschetta with Feta, Moroccan Mint Tea, Lentil Soup
175,250.0,100.0,150.0,20.0,200.0, Overnight Oats, Edamame, Veggie Kabobs, Moroccan Mint Tea, Quinoa Salad
176,250.0,100.0,150.0,20.0,200.0, Vegan Banana Bread, Rice Paper Spring Rolls, Apple slices with peanut butter, Moroccan Mint Tea," Roasted Vegetable Frittata - 200 calories/portion, 4 portions, Origin"
177,320.0,100.0,150.0,20.0,200.0," Artichoke and feta tart (320 calories per portion, 2 portions, contains dairy, Greek origin)
"," Apple Slices with Caramel Dip - 100kcals per portion, 2 portions
    Origin", Bruschetta with Mozzarella, Moroccan Mint Tea, Mexican Street Corn Salad
178,250.0,100.0,120.0,20.0,200.0, Vegan Oatmeal Raisin Overnight Oats - 250 calories per portion | 2 portions | Contains gluten | Origin, Watermelon Fruit Pizza, Vegetable sushi rolls, Moroccan Mint Tea," Butternut Squash Soup - 200 calories per portion, 4 portions, None, Various
"
179,200.0,80.0,110.0,20.0,160.0, Overnight Chia Pudding, Stuffed Dates," Edamame - 110 kcals per portion, 2 portions, contains soy (Japan)", Moroccan Mint Tea," Bruschetta - 160kcals per portion, 4 portions, contains gluten (Italy)
"
180,250.0,80.0,300.0,20.0,200.0, Overnight Chia Pudding, Avocado Deviled Eggs, Mini Spinach and Feta Pizzas, Moroccan Mint Tea," Vegan Miso Soup - 200 calories per portion, 4 portions, Soy, Japan
"
181,250.0,100.0,200.0,20.0,200.0, Vegan Matcha Overnight Oats - 250 calories per portion | 2 portions | None | Origin, Baked Apple Chips, Greek salad, Moroccan Mint Tea," Caprese Salad - 200 calories per portion, 4 portions, contains dairy (cheese), Origin"
182,250.0,80.0,180.0,20.0,200.0, Greek Yogurt Parfait Bowl, Hard-Boiled Eggs," Sticky Coconut Rice Balls - 180 kcals per portion, 4 portions, no allergic warnings, origin", Moroccan Mint Tea," Vegan Creamy Cauliflower Soup - 200 calories per portion, 4 portions, None, Various
"
183,300.0,100.0,180.0,20.0,150.0," Baked beans on toast - 300 calories per portion, 2 portions, contains gluten, origin", Fresh Fruit Salad, Pomegranate Avocado Salad, Moroccan Mint Tea, Cauliflower Fried Rice
184,300.0,100.0,160.0,20.0,200.0," Breakfast bruschetta - 300 calories per portion, 2 portions, contains gluten, origin", Fruit salad, Pita Bread and Hummus, Moroccan Mint Tea, Greek Salad
185,200.0,100.0,120.0,20.0,180.0, Zucchini Bread, Overnight Chia Pudding, Spinach and Feta Pinwheels, Moroccan Mint Tea, Ratatouille
186,300.0,100.0,130.0,20.0,200.0, Chia Seed Pudding Parfait, Frozen Grapes, Veggie Taco Cups, Moroccan Mint Tea," Greek stuffed bell peppers - 200 calories per portion, 4 portions, none (Greece)
"
187,250.0,100.0,200.0,20.0,200.0, Vegan Banana Muffins, Cucumber Rolls with Cream Cheese, Bruschetta with Mozzarella and Basil, Moroccan Mint Tea, Lentil and Vegetable Bolognese
188,300.0,80.0,120.0,20.0,150.0," Singaporean kaya toast - 300 calories per portion, 2 portions, contains gluten and dairy, origin", Fresh Squeezed Orange Juice," Stuffed Mushrooms with Quinoa - 120 kcals per portion, 3 portions, gluten-free (Various)", Moroccan Mint Tea," Steamed Fish with Lemon Butter Sauce - 150 calories per portion, 4 portions, no allergic warnings, Origin"
189,300.0,50.0,80.0,20.0,200.0, Vegan Breakfast Burrito, Baked Apple Chips - Approx, Stuffed Dates with Almond Butter, Moroccan Mint Tea," Falafel with tahini sauce - 200 calories per portion, 4 portions, contains gluten (Middle East)
"
190,300.0,100.0,120.0,20.0,180.0, Apple Cinnamon French Toast Casserole, Toasted Coconut Chips, Watermelon and Feta Skewers, Moroccan Mint Tea," Lentil and vegetable soup - 180 calories per portion, 6 portions, none
"
191,250.0,80.0,180.0,20.0,200.0, Quinoa Porridge, Avocado Deviled Eggs, Broccoli and cheese bites, Moroccan Mint Tea, Quinoa Stuffed Mushrooms
192,320.0,100.0,210.0,20.0,220.0," Sweet corn pancakes with tomato and avocado salsa (320 calories per portion, 2 portions, nut-free, American origin)
", Cucumber Sandwich," Savory Cheese Bites - 210 kcals per portion, 4 portions, contains gluten, dairy (Various)", Moroccan Mint Tea," Greek Lemon Potatoes - 220kcals per portion, 4 portions
"
193,250.0,100.0,130.0,20.0,200.0, Raspberry Chia Jam Toast, Toasted Coconut Chips," Veggie Sushi Rolls with Spicy Tofu - 130 kcals per portion, 4 portions, no allergic warnings, origin", Moroccan Mint Tea," Avocado and Tomato Salad - 200 calories/portion, 2 portions, Origin"
194,250.0,100.0,150.0,20.0,200.0," Overnight oats with berries and almond milk (250 calories per portion, 2 portions, nut-free, American origin)
", Vegetable Crudité with Hummus, Greek Olive Tapenade with Pita Bread, Moroccan Mint Tea," Vegetable Stir-Fry with Tofu - 200 calories per portion, 4 portions, no allergic warnings, Origin"
195,300.0,100.0,160.0,20.0,200.0, Vegan Almond Butter Toast - 300 calories per portion | 1 portion | Contains nuts | Origin, Cucumber Rolls with Cream Cheese, Sliced Apples with Peanut Butter, Moroccan Mint Tea," Butternut Squash Soup - 200 calories per portion, 4 portions, None, Various
"
196,300.0,100.0,150.0,20.0,220.0, Fruit Smoothie Bowl, Overnight Chia Pudding, Roasted Vegetable Bruschetta, Moroccan Mint Tea, Quinoa and Vegetable Stir Fry
197,300.0,100.0,120.0,20.0,150.0, Vegan Chocolate Banana Smoothie Bowl - 300 calories per portion | 1 portion | None | Origin, Stuffed Dates - Approx, Veggie Egg Muffins, Moroccan Mint Tea, Butternut Squash Soup
198,300.0,100.0,220.0,20.0,200.0," Greek yogurt parfait with mixed berries and honey (300kcals per portion, 1 portion, origin", Cucumber Slices with Tzatziki - Approx," Poppy Seed Cake - 220 kcals per portion, 3 portions, contains gluten (Various)", Moroccan Mint Tea, Vegan Chili
199,50.0,80.0,300.0,20.0,180.0, Vegan Breakfast Sushi Burrito, Fruit Salad, Cheese and Crackers, Moroccan Mint Tea," Veggie Sushi Rolls - 180 calories per portion, 6 portions, Soy, Japan
"
200,320.0,100.0,130.0,20.0,230.0," Baked eggs with asparagus and Parmesan (320 calories per portion, 2 portions, contains dairy, Italian origin)
", Kiwi and Strawberry Smoothie, Mini Vegetable Quesadillas, Moroccan Mint Tea," Quinoa-Stuffed Bell Peppers - 230kcals per portion, 4 portions, gluten-free
"
201,250.0,90.0,180.0,20.0,180.0, Vegan Oatmeal Chocolate Chip Cookies - 250 calories per portion | 2 portions | Contains gluten | Origin, Fruit Salad, Quinoa Salad with Chickpeas, Moroccan Mint Tea," Ratatouille - 180kcals per portion, 4 portions, vegan (France)
"
202,300.0,80.0,180.0,20.0,200.0, Baked Egg in Avocado, Apple with Cinnamon, Zucchini Pizza Bites, Moroccan Mint Tea," Mediterranean Stuffed Tomatoes - 200 calories/portion, 4 portions, Origin"
203,200.0,60.0,100.0,20.0,200.0," Oatmeal with banana and almond (200kcals per portion, 2 portions, nut allergies, origin", Cucumber and tomato salad," Mini caprese salad skewers (cherry tomatoes, mozzarella, basil)", Moroccan Mint Tea," Vegan Buffalo Cauliflower Wings - 200 calories per portion, 4 portions, None, United States
"
204,300.0,80.0,100.0,20.0,150.0, Tomato Basil Avocado Toast," Carrot Sticks with Hummus - 80kcals per portion, 2 portions
   Origin", Baked Kale Chips, Moroccan Mint Tea," Grilled Vegetable Skewers - 150 calories/portion, 4 portions, contains garlic (Various)
"
205,200.0,50.0,140.0,20.0,160.0, Vegan Scones - 200 calories per portion | 2 portions | Contains gluten | Origin, Baked Apple Chips - Approx, Crispy Baked Potato Skins, Moroccan Mint Tea," Vegan Quinoa and Kale Salad - 160 calories per portion, 2 portions, may contain gluten"
206,300.0,100.0,120.0,20.0,200.0, Quinoa Breakfast Bowl, Caprese Skewers, Greek Yogurt with Berries, Moroccan Mint Tea," Lentil Spinach Salad - 200 calories per portion, 4 portions, None, Various
"
207,320.0,100.0,150.0,20.0,200.0," Ricotta and berry-stuffed crepes (320 calories per portion, 2 portions, contains dairy, French origin)
", Tomato Basil Bruschetta," Tabbouleh Salad - 150 kcals per portion, 4 portions, contains gluten (Lebanon)", Moroccan Mint Tea," Caprese Salad - 200 calories per portion, 4 portions, contains dairy (cheese), Origin"
208,200.0,80.0,180.0,20.0,234.0, Vegan Pumpkin Pancakes, Fruit Salad, Greek Stuffed Grape Leaves (Dolmas), Moroccan Mint Tea, Vegan Stuffed Cabbage Rolls
209,250.0,50.0,120.0,20.0,200.0, Cheesy Spinach Pita Pocket," Fruit Salad - 50kcals per portion, 2 portions
   Origin", Greek tomato and cucumber salad, Moroccan Mint Tea, Lentil and Vegetable Soup
210,300.0,100.0,260.0,20.0,200.0, Hash Brown Casserole, Zesty Lime Popcorn - Approx, Greek Stuffed Mushrooms, Moroccan Mint Tea," Lentil Spinach Soup - 200 calories per portion, 4 portions, None, Various
"
211,300.0,100.0,150.0,20.0,180.0, Veggie Tofu Scramble Wrap - 300 calories per portion | 1 portion | None | Origin, Fruit salad, Greek Yogurt with Fresh Berries, Moroccan Mint Tea," Caprese stuffed portobello mushrooms - 180 calories per portion, 4 portions, contains dairy (Italy)
"
212,250.0,80.0,160.0,20.0,220.0, Raw Vegan Breakfast Bars - 250 calories per portion | 2 portions | Contains nuts | Origin, Mango with Chili Powder," Mini Bagel Pizzas - 160 kcals per portion, 4 portions, contains gluten, dairy (USA)", Moroccan Mint Tea, Chickpea and Vegetable Stir Fry
213,250.0,90.0,200.0,20.0,200.0, Vegan Chocolate Banana Chia Pudding - 250 calories per portion | 2 portions | None | Origin, Turkish-style boiled eggs, Baked Sweet Potato Fries, Moroccan Mint Tea, Quinoa Stuffed Mushrooms
214,200.0,100.0,200.0,20.0,180.0, Vegan Green Smoothie - 200 calories per portion | 2 portions | None | Origin, Som Tam (Papaya Salad), Chickpea Salad, Moroccan Mint Tea," Veggie Sushi Rolls - 180 calories per portion, 6 portions, Soy, Japan
"
215,250.0,100.0,150.0,20.0,150.0," Overnight oats with berries and almond milk (250 calories per portion, 2 portions, nut-free, American origin)
", Frozen Grapes, Stuffed Mini Bell Peppers, Moroccan Mint Tea, Chickpea Salad
216,200.0,80.0,180.0,20.0,180.0, Apple Cinnamon Porridge, Fruit Salad, Greek Tzatziki with Pita Bread, Moroccan Mint Tea, Ratatouille
217,250.0,60.0,150.0,20.0,225.0, Yogurt Parfait, Cucumber and tomato salad," Strawberry Spinach Salad - 150 kcals per portion, 3 portions, contains dairy (USA)", Moroccan Mint Tea, Vegan Stuffed Mushrooms
218,200.0,100.0,150.0,20.0,150.0, Veggie Breakfast Couscous, Cucumber Rolls with Hummus - Approx, Roasted chickpeas, Moroccan Mint Tea," Lentil Soup - 150 calories per portion, 6 portions, None, Various
"
219,150.0,80.0,180.0,20.0,200.0, Vegan Breakfast Pita Pockets, Avocado Deviled Eggs, Greek Olive Breadsticks, Moroccan Mint Tea," Cauliflower Fried Rice - 200 calories/portion, 4 portions, contains soy (China)
"
220,300.0,100.0,150.0,20.0,200.0, Vegan Coconut Chia Pancakes - 300 calories per portion | 1 portion | Contains gluten | Origin, Cucumber Rolls with Hummus - Approx, Roasted Vegetable Bruschetta, Moroccan Mint Tea," Mexican Stuffed Portobello Mushrooms - 200 calories/portion, 4 portions, contains gluten (Mexico)
"
221,250.0,100.0,150.0,20.0,200.0, Vegan Matcha Overnight Oats - 250 calories per portion | 2 portions | None | Origin," Cinnamon Apple Chips - 100kcals per portion, 2 portions
    Origin", Stuffed mushrooms, Moroccan Mint Tea," Lentil soup with vegetables – 200 calories per portion, 6 portions, vegan-friendly (origin"
222,250.0,100.0,80.0,20.0,234.0, Vegan Breakfast Sausage, Overnight Chia Pudding, Shrimp ceviche, Moroccan Mint Tea, Vegan Stuffed Cabbage Rolls
223,300.0,100.0,150.0,20.0,150.0, Veggie Breakfast Quesadilla, Boiled chickpeas, Mini Meatballs, Moroccan Mint Tea, Cauliflower Fried Rice
224,300.0,70.0,340.0,20.0,200.0, Greek Yogurt Parfait, Kale chips, Vegan Nachos, Moroccan Mint Tea, Mediterranean Stuffed Eggplant
225,250.0,90.0,280.0,20.0,200.0, Vegan Breakfast Bruschetta, Fruit Salad, Cucumber and Avocado Sushi, Moroccan Mint Tea," Italian Vegan Bruschetta (200 calories/portion, 4 portions) - Italy
"
226,300.0,80.0,200.0,20.0,220.0," Thai coconut rice pudding with mango (300kcals per portion, 2 portions, origin", Baked Apple Chips, Baked Mini Samosas, Moroccan Mint Tea, Lentil and Vegetable Stir Fry
227,200.0,100.0,100.0,20.0,220.0, Peanut Butter and Banana Smoothie, Watermelon Fruit Pizza, Baked Zucchini Fries, Moroccan Mint Tea, Quinoa and Vegetable Stir Fry
