,breakfast_calories,morning snacks_calories,afternoon snacks_calories,lunch_calories,dinner_calories,breakfast,morning snacks,afternoon snacks,lunch,dinner
1,300.0,100.0,240.0,20.0,350.0," Shakshuka - 300 calories per portion, 2 portions, no allergic warnings, origin", Fruit Salad, Thai Vegetable Spring Rolls, Moroccan Mint Tea, Vegan Soba Noodle Salad
2,300.0,100.0,90.0,20.0,350.0, Vegan Pumpkin Spice Pancakes - 300 calories per portion | 1 portion | Contains gluten | Origin, Roasted Almonds, Baked sweet potato chips, Moroccan Mint Tea," Mexican Rice Casserole - 350 calories/portion, 4 portions, contains gluten (Mexico)
"
3,300.0,70.0,250.0,20.0,380.0, Shakshuka, Kale chips, Rice Paper Rolls with Peanut Sauce, Moroccan Mint Tea," Spinach and Cheese Stuffed Shells - 380kcals per portion, 4 portions, contains dairy
"
4,350.0,100.0,200.0,20.0,250.0, Vegan Chocolate Peanut Butter Smoothie - 350 calories per portion | 1 portion | Contains nuts | Origin," Cinnamon Apple Chips - 100kcals per portion, 2 portions
    Origin", Greek Yogurt with Mango and Pistachios, Moroccan Mint Tea, Vegan Pizza
5,400.0,50.0,280.0,20.0,350.0, Mediterranean Breakfast Wraps, Baked Apple Chips - Approx, Apple and Cinnamon Muffins, Moroccan Mint Tea," Thai Red Curry - 350 calories/portion, 4 portions, Origin"
6,450.0,100.0,80.0,20.0,350.0," Persian barbari bread with feta and cucumber (450kcals per portion, 2 portions, origin", Energy Balls, Vegetable Soup, Moroccan Mint Tea," Veggie Pad See Ew - 350 calories/portion, 4 portions, Origin"
7,400.0,100.0,150.0,20.0,300.0, Avocado and Egg Breakfast Salad, Cucumber and Tomato Salad, Mango salsa with tortilla chips, Moroccan Mint Tea," Lentil Tacos - 300 calories per portion, 4 portions, None, Mexico
"
8,350.0,90.0,220.0,20.0,380.0, Banana Chia Pancakes, Quinoa Energy Bites, Chicken Satay Lettuce Wraps, Moroccan Mint Tea," Eggplant Parmesan - 380kcals per portion, 4 portions, contains dairy (Italy)
"
9,350.0,100.0,190.0,20.0,200.0," Muesli with yogurt and mixed fruits (350kcals per portion, 1 portion)
", Edamame, Greek Spinach and Feta Pinwheels, Moroccan Mint Tea," Ratatouille - 200 calories per portion, 6 portions, no allergic warnings, Origin"
10,350.0,100.0,150.0,20.0,250.0," Apple cinnamon overnight French toast (350 calories per portion, 2 portions, nut-free, American origin)
", Cucumber Sandwich, Roasted Red Pepper and Feta Dip, Moroccan Mint Tea, Mushroom Risotto
11,300.0,100.0,250.0,20.0,350.0," Greek yogurt parfait with mixed berries and honey (300kcals per portion, 1 portion, origin", Cucumber and Tomato Salad, Cheese and Spinach Triangles, Moroccan Mint Tea, Mexican Quinoa Stuffed Zucchini
12,200.0,80.0,300.0,20.0,300.0, Vegan Scones - 200 calories per portion | 2 portions | Contains gluten | Origin, Kale Chips, Baked Chicken Nuggets, Moroccan Mint Tea, Ratatouille-Stuffed Peppers
13,380.0,100.0,280.0,20.0,200.0," Israeli-style salad with scrambled eggs (380 calories per portion, 2 portions, nut-free, Israeli origin)
"," Raspberry Yogurt Popsicles - 100kcals per portion, 2 portions
    Origin", Greek Spinach and Cheese Rolls, Moroccan Mint Tea, Vegan Caprese Salad
14,200.0,100.0,300.0,20.0,350.0, Vegan French Toast - 200 calories per portion | 2 portions | Contains gluten | Origin, Quinoa Energy Bites, Roasted Vegetable Pizza, Moroccan Mint Tea, Quinoa Salad with Roasted Vegetables
15,300.0,100.0,250.0,20.0,200.0, Mushroom and Tomato Omelette, Fruit salad, Vegetable Samosas, Moroccan Mint Tea, Lebanese Fattoush Salad
16,380.0,100.0,180.0,20.0,300.0," Sweet potato and black bean breakfast skillet (380 calories per portion, 2 portions, nut-free, Mexican origin)
"," Apple Slices with Caramel Dip - 100kcals per portion, 2 portions
    Origin", Mini vegetable quinoa bites, Moroccan Mint Tea," Greek Pita Sandwiches - 300 calories/portion, 4 portions, contains gluten (Greece)
"
17,400.0,100.0,200.0,20.0,200.0, Strawberry Banana Pancakes, Overnight Chia Pudding, Mini Chicken and Vegetable Pies, Moroccan Mint Tea," Tofu Stir-Fry - 200 calories per portion, 4 portions, Soy, China
"
18,350.0,80.0,150.0,20.0,300.0, Vegan Breakfast Baked Potato - 350 calories per portion | 1 portion | None | Origin," Carrot Sticks with Hummus - 80kcals per portion, 2 portions
   Origin", Cucumber and Tomato Salsa with Tortilla Chips, Moroccan Mint Tea," Chinese Sesame Noodles (300 calories/portion, 4 portions) - China
"
19,150.0,100.0,250.0,20.0,300.0, Vegan Breakfast Fajitas, Carrot Sticks with Ranch Dip, Chicken and vegetable lettuce wraps, Moroccan Mint Tea," Vegetarian chili - 300 calories per portion, 4 portions, none (Mexico)
"
20,400.0,100.0,180.0,20.0,350.0," Veggie breakfast quesadilla (400 calories per portion, 2 portions, nut-free, Mexican origin)
", Caprese Skewers, Mini vegetable quinoa bites, Moroccan Mint Tea," Veggie Paella - 350 calories/portion, 4 portions, Origin"
21,350.0,100.0,220.0,20.0,300.0, Banana Chia Pancakes, Fresh Fruit Salad, Indian Samosa Chaat, Moroccan Mint Tea," Lentil and vegetable shepherd's pie - 300 calories per portion, 4 portions, none
"
22,450.0,100.0,220.0,20.0,250.0," Jamaican ackee and saltfish with Johnny cakes - 450 calories per portion, 2 portions, contains gluten, origin", Edamame," Falafel with Tahini Sauce - 220 kcals per portion, 3 portions, contains sesame (Middle East)", Moroccan Mint Tea," Vegan Lentil and Vegetable Casserole - 250 calories per portion, 4 portions, may contain gluten"
23,300.0,100.0,100.0,20.0,350.0," Almond butter and banana toast (300 calories per portion, 2 portions, contains nuts, American origin)
", Rice Paper Spring Rolls, Veggie Pinwheels, Moroccan Mint Tea, Mexican Quinoa Stuffed Bell Peppers
24,350.0,80.0,140.0,20.0,180.0," Veggie-packed breakfast casserole (350 calories per portion, 2 portions, nut-free, American origin)
", Mango with Chili Powder," Mini Vegetable Quinoa Cups - 140 kcals per portion, 4 portions, gluten-free (Various)", Moroccan Mint Tea, Ratatouille
25,250.0,100.0,90.0,20.0,180.0, Vegan Matcha Overnight Oats - 250 calories per portion | 2 portions | None | Origin, Cucumber and Tomato Salad," Miso Soup - 90 kcals per portion, 4 portions, contains soy (Japan)", Moroccan Mint Tea, Spinach and Mushroom Frittata
26,300.0,100.0,120.0,20.0,350.0, Mushroom and Tomato Omelette, Cucumber and Tomato Salad," Cold Cucumber Soup - 120 kcals per portion, 4 portions, gluten-free (World)", Moroccan Mint Tea," Greek Pasta Salad - 350 calories/portion, 4 portions, Origin"
27,400.0,90.0,150.0,20.0,250.0," Polish scrambled eggs with kielbasa and sauerkraut (400kcals per portion, 2 portions, pork allergies, origin", Rice Paper Rolls, Mini Meatballs, Moroccan Mint Tea, Cucumber Avocado Sushi Rolls
28,300.0,100.0,180.0,20.0,350.0," Egyptian foul medames (fava bean stew) - 300 calories per portion, 2 portions, no allergic warnings, origin", Caprese Skewers," Greek Yogurt Bark - 180 kcals per portion, 4 portions, contains dairy (Greece)", Moroccan Mint Tea, Vegan Tikka Wrap
29,600.0,100.0,170.0,20.0,350.0, English Breakfast, Watermelon Fruit Pizza, Roasted Beetroot and Goat Cheese Crostini, Moroccan Mint Tea, Mushroom Risotto Stuffed Peppers
30,400.0,100.0,300.0,20.0,300.0," Venezuelan arepas with cheese and avocado - 400 calories per portion, 1 portion, contains gluten and dairy, origin", Carrot Sticks with Ranch Dip, Mini Pita Pizzas, Moroccan Mint Tea, Quinoa Stuffed Mushrooms
31,320.0,100.0,320.0,20.0,350.0," Artichoke and feta tart (320 calories per portion, 2 portions, contains dairy, Greek origin)
", Edamame," Nachos with Guacamole - 320 kcals per portion, 2 portions, contains dairy (Mexico)", Moroccan Mint Tea," Honey Garlic Glazed Salmon - 350 calories per portion, 4 portions, no allergic warnings, Origin"
32,500.0,100.0,140.0,20.0,300.0," Eggs Benedict with ham and hollandaise sauce (500kcals per portion, 2 portions)
"," Apple Slices with Caramel Dip - 100kcals per portion, 2 portions
    Origin"," Vegan Mediterranean Pasta Salad - 140 kcals per portion, 4 portions, no allergic warnings, origin", Moroccan Mint Tea," Roasted Vegetable Pasta - 300 calories per portion, 4 portions, Gluten, Italy
"
33,400.0,100.0,220.0,20.0,390.0, Shakshuka with Feta Cheese, Energy Balls, Banana bread muffins, Moroccan Mint Tea," Quinoa-Stuffed Acorn Squash - 390kcals per portion, 4 portions
"
34,300.0,80.0,140.0,20.0,350.0," Strawberry banana overnight oats (300 calories per portion, 2 portions, nut-free, American origin)
", Fruit Salad, Baked Sweet Potato Chips, Moroccan Mint Tea," Vegan Sushi Bowl - 350 calories per portion, 4 portions, Soy, Japan
"
35,500.0,80.0,200.0,20.0,300.0, Breakfast Burrito, Stuffed Dates, Guacamole with Tortilla Chips, Moroccan Mint Tea, Veggie Fajitas
36,400.0,100.0,120.0,20.0,292.0," Warm quinoa breakfast bowl with caramelized bananas and almonds (400 calories per portion, 2 portions, contains nuts, American origin)
Please note that the above recipes are suggestions and the nutritional information provided is approximate", Fresh Juice - Approx, Caprese stuffed mushrooms, Moroccan Mint Tea, Lentil Loaf
37,400.0,100.0,150.0,20.0,250.0, Breakfast Bibimbap, Carrot Sticks with Ranch Dip, Caprese Salad, Moroccan Mint Tea," Moroccan Chickpea Pancakes (250 calories/portion, 4 portions) - Morocco
"
38,350.0,100.0,150.0,20.0,350.0," Veggie omelette with zucchini and goat cheese (350 calories per portion, 2 portions, contains dairy, French origin)
", Fresh Fruit Salad, Vegetable Frittata, Moroccan Mint Tea," Mexican Quinoa Stuffed Peppers - 350 calories/portion, 4 portions, contains gluten (Mexico)
"
39,250.0,100.0,160.0,20.0,200.0, Blueberry Oatmeal Breakfast Bars, Rice Cake with Hummus and Cucumber, Sliced Apples with Peanut Butter, Moroccan Mint Tea, Quinoa Stuffed Mushrooms
40,300.0,80.0,200.0,20.0,356.0," Almond butter and banana toast (300 calories per portion, 2 portions, contains nuts, American origin)
", Baked Apple Chips, Stuffed Eggplant, Moroccan Mint Tea, Vegan Miso Ramen
41,200.0,100.0,250.0,20.0,300.0," Oatmeal with banana and almond (200kcals per portion, 2 portions, nut allergies, origin", Zesty Lime Popcorn - Approx, Spinach and artichoke dip with pita chips, Moroccan Mint Tea, Jackfruit Tacos
42,300.0,100.0,100.0,20.0,350.0," Filipino champorado (chocolate rice porridge) - 300 calories per portion, 2 portions, contains gluten, origin", Fruit salad, Baked zucchini fries, Moroccan Mint Tea," Vegetarian bibimbap - 350 calories per portion, 4 portions, contains gluten and soy (Korea)
"
43,450.0,80.0,800.0,20.0,220.0," Breakfast quesadilla with eggs, cheese, and vegetables (450kcals per portion, 2 portions)
", Baked Apple Chips, Vegan Spinach Artichoke Dip, Moroccan Mint Tea, Lentil and Vegetable Stir Fry
44,300.0,90.0,150.0,20.0,330.0," Greek yogurt parfait with mixed berries and honey (300kcals per portion, 1 portion, origin", Vegetarian Spring Rolls, Cucumber and Cream Cheese Sandwiches, Moroccan Mint Tea," Lentil and Vegetable Curry - 330kcals per portion, 4 portions, contains legumes
"
45,320.0,100.0,150.0,20.0,200.0," Sweet corn pancakes with tomato and avocado salsa (320 calories per portion, 2 portions, nut-free, American origin)
", Vegetable Crudité with Hummus, Stuffed mushrooms, Moroccan Mint Tea, Mediterranean Stuffed Eggplant
46,400.0,80.0,200.0,20.0,350.0, Vegan Breakfast Spanakopita, Stuffed Dates, Cheese and Tomato Toasties, Moroccan Mint Tea," Thai Red Curry - 350 calories/portion, 4 portions, Origin"
47,250.0,100.0,190.0,20.0,350.0, Vegan Berry Parfait - 250 calories per portion | 2 portions | Contains nuts | Origin, Rice Cake with Hummus and Cucumber, Mini Falafel Bites, Moroccan Mint Tea," Eggplant and tomato pasta – 350 calories per portion, 3 portions, vegetarian-friendly (origin"
48,500.0,60.0,140.0,20.0,300.0," Belgian waffles with fresh fruit and whipped cream (500kcals per portion, 2 portions, origin", Cucumber and tomato salad, Tomato Bruschetta, Moroccan Mint Tea, Sweet Potato and Black Bean Enchiladas
49,250.0,80.0,100.0,20.0,350.0, Vegan Green Breakfast Bowl - 250 calories per portion | 2 portions | None | Origin, Fruit Salad, Baked Zucchini Fries, Moroccan Mint Tea," Mushroom and spinach risotto - 350 kcals per portion, 4 portions, vegetarian, contains lactose
"
50,400.0,100.0,180.0,20.0,320.0," Sausage and egg muffin - 400 calories per portion, 2 portions, contains gluten, origin"," Mediterranean Style Feta Stuffed Dates - 100kcals per portion, 2 portions
    Origin"," Vegan Blueberry Muffins - 180 kcals per portion, 4 portions, no allergic warnings, origin", Moroccan Mint Tea," Cauliflower curry – 320 calories per portion, 4 portions, vegan-friendly
"
51,350.0,100.0,150.0,20.0,200.0," Banana pecan pancakes (350 calories per portion, 2 portions, contains nuts, American origin)
", Tomato Basil Bruschetta, Baked Mozzarella Sticks, Moroccan Mint Tea," Greek-style stuffed zucchini - 200 calories per portion, 4 portions, none (Greece)
"
52,300.0,100.0,250.0,20.0,350.0," Zucchini and carrot muffins (300kcals per portion, 2 portions)
", Energy Balls, Sweet Potato Fries, Moroccan Mint Tea, Vegan Goulash
53,350.0,80.0,100.0,20.0,350.0," Finnish Karelian pasties with egg butter - 350 calories per portion, 2 portions, contains gluten and dairy, origin", Cheesy Popcorn," Stuffed Mini Peppers with Vegan Cream Cheese - 100 kcals per portion, 4 portions, no allergic warnings, origin", Moroccan Mint Tea," Quinoa Stuffed Bell Peppers - 350 calories per portion, 4 portions, None, Various
"
54,250.0,80.0,180.0,20.0,350.0, Vegan Cacao Banana Smoothie - 250 calories per portion | 2 portions | None | Origin," Carrot Sticks with Hummus - 80kcals per portion, 2 portions
   Origin"," Vegan Blueberry Muffins - 180 kcals per portion, 4 portions, no allergic warnings, origin", Moroccan Mint Tea, Vegan Gyros
55,250.0,100.0,250.0,20.0,350.0," Banana walnut muffins (250 calories per portion, 2 portions, contains nuts, American origin)
", Cucumber Slices with Tzatziki - Approx, Vegetarian Chili, Moroccan Mint Tea, Tofu Pad Kra Pao
56,200.0,80.0,220.0,20.0,346.0, Overnight Oats - 200 calories per portion | 2 portions | Contains gluten | Origin, Hard-Boiled Eggs, Stuffed Bell Peppers, Moroccan Mint Tea, Sweet Potato and Lentil Curry
57,300.0,80.0,180.0,20.0,350.0, Fruit Smoothie Bowl, Stuffed Dates, Apple Slices with Cinnamon Yogurt Dip, Moroccan Mint Tea," Mexican Vegan Chiles Rellenos (350 calories/portion, 2 portions) - Mexico
"
58,400.0,100.0,220.0,20.0,250.0," Apple cinnamon baked oatmeal (400kcals per portion, 2 portions)
"," Cinnamon Apple Chips - 100kcals per portion, 2 portions
    Origin", Banana bread muffins, Moroccan Mint Tea, Portobello Mushroom Steaks
59,250.0,100.0,250.0,20.0,300.0," Overnight oats with berries and almond milk (250 calories per portion, 2 portions, nut-free, American origin)
", Kiwi and Strawberry Smoothie, Cheese and Spinach Triangles, Moroccan Mint Tea," Greek Spanakopita - 300 calories/portion, 4 portions, contains gluten and dairy (Greece)
"
60,400.0,90.0,200.0,20.0,320.0," Quinoa porridge with coconut milk - 400 calories per portion, 2 portions, no allergic warnings, origin", Vegetarian Spring Rolls, Cheese and Tomato Toasties, Moroccan Mint Tea," Beef stir-fry with broccoli and bell peppers - 320 kcals per portion, 4 portions, contains soy
"
61,450.0,100.0,280.0,20.0,300.0," Quiche Lorraine - 450 calories per portion, 4 portions, contains gluten and dairy, origin", Baked Apple Chips, Greek Spinach Pie, Moroccan Mint Tea," Chana masala - 300 calories per portion, 4 portions, contains nuts (India)
"
62,350.0,80.0,120.0,20.0,210.0," Yogurt and fruit smoothie bowl (350 calories per portion, 2 portions, contains dairy, American origin)
", Apple with Cinnamon, Vegan Mediterranean Hummus Bowl, Moroccan Mint Tea," Greek Stuffed Tomatoes - 210kcals per portion, 4 portions
"
63,300.0,100.0,220.0,20.0,240.0, Quinoa Breakfast Bowl, Rice Paper Spring Rolls, Guacamole with Tortilla Chips, Moroccan Mint Tea," Citrus Quinoa Salad - 240kcals per portion, 4 portions
"
64,350.0,100.0,120.0,20.0,300.0, Sweet Potato and Spinach Breakfast Hash, Cucumber Rolls with Hummus - Approx, Greek Yogurt Dip with Veggies, Moroccan Mint Tea, Grilled Tofu with Teriyaki Sauce
65,400.0,100.0,150.0,20.0,350.0," Huevos divorciados (Mexican-style eggs with red and green salsa) (400 calories per portion, 2 portions, nut-free, Mexican origin)
", Quinoa Energy Bites," Cucumber and Avocado Sushi Rolls - 150 kcals per portion, 4 portions, allergic warning (avocado), origin", Moroccan Mint Tea, Vegan Butternut Squash Ravioli
66,400.0,70.0,150.0,20.0,300.0, English Muffin Breakfast Pizza, Kale chips, Greek Feta Dip with Veggies, Moroccan Mint Tea, Vegan Gyros
67,150.0,100.0,250.0,20.0,350.0, Vegan Pancakes, Chilled Gazpacho Soup - Approx, Cheese and Spinach Triangles, Moroccan Mint Tea, Vegan Burritos
68,350.0,100.0,120.0,20.0,350.0," Moroccan msemen (folded pancakes) with honey (350kcals per portion, 2 portions, origin", Fruit Smoothie Popsicles - Approx, Pumpkin Hummus with Carrot Sticks, Moroccan Mint Tea," Greek Salad with Grilled Chicken - 350 calories per portion, 4 portions, contains dairy (cheese), Origin"
69,300.0,80.0,520.0,20.0,350.0," Almond butter and banana toast (300 calories per portion, 2 portions, contains nuts, American origin)
"," Carrot Sticks with Hummus - 80kcals per portion, 2 portions
   Origin", Vegan Mac and Cheese, Moroccan Mint Tea," Vegetable curry with basmati rice - 350 calories per portion, 4 portions, contains nuts (India)
"
70,650.0,80.0,250.0,20.0,350.0, Vegan Breakfast Zucchini Bread, Fruit Salad, Mango Coconut Chia Pudding, Moroccan Mint Tea, Mexican Quinoa Stuffed Zucchini
71,250.0,100.0,200.0,20.0,350.0, Vegan Berry Parfait - 250 calories per portion | 2 portions | Contains nuts | Origin, Roasted Almonds," Vegan Broccoli Pesto Pasta - 200 kcals per portion, 4 portions, no allergic warnings, origin", Moroccan Mint Tea," Vegetable Korma - 350kcals per portion, 4 portions, contains nuts (India)
"
72,400.0,100.0,150.0,20.0,350.0," Bangladeshi panta bhat (fermented rice) with fried hilsa fish - 400 calories per portion, 2 portions, contains gluten, origin"," Apple Slices with Caramel Dip - 100kcals per portion, 2 portions
    Origin", Spinach and ricotta stuffed shells, Moroccan Mint Tea," Veggie stir-fry with tofu and brown rice - 350 kcals per portion, 4 portions, vegetarian, contains gluten, soy
"
73,200.0,100.0,200.0,20.0,200.0, Vegan Breakfast Enchiladas, Toasted Coconut Chips, Black Bean Quesadillas, Moroccan Mint Tea," Caprese Stuffed Portobello Mushrooms - 200 calories/portion, 4 portions, contains dairy (Italy)
"
74,350.0,100.0,200.0,20.0,250.0, Vegan Breakfast Banana Bread, Chilled Gazpacho, Quinoa Salad, Moroccan Mint Tea," Spinach and feta stuffed phyllo rolls - 250 calories per portion, 4 portions, contains gluten and dairy (Greece)
"
75,400.0,100.0,150.0,20.0,350.0," Nigerian plantain porridge - 400 calories per portion, 2 portions, no allergic warnings, origin", Baked Apple Chips, Pineapple and Coconut Energy Balls, Moroccan Mint Tea," Chickpea Salad Sandwich - 350 calories per portion, 2 portions, may contain gluten"
76,380.0,90.0,250.0,20.0,350.0," Greek-style stuffed peppers with eggs (380 calories per portion, 2 portions, contains eggs, Greek origin)
", Stuffed Dates, Mini Beef Sliders, Moroccan Mint Tea," Vegetable Tikka Masala - 350 calories/portion, 4 portions, contains dairy (India)
"
77,350.0,100.0,120.0,20.0,250.0," English crumpets with butter and jam (350kcals per portion, 2 portions, dairy allergies, origin", Edamame," Roasted Cauliflower Bites - 120 kcals per portion, 4 portions, no allergic warnings, origin", Moroccan Mint Tea, Quinoa Salad
78,600.0,100.0,160.0,20.0,350.0, English Breakfast, Cucumber Rolls with Cream Cheese, Baked apples with cinnamon and honey, Moroccan Mint Tea," Mexican Quinoa Salad - 350 calories/portion, 4 portions, contains cilantro (Mexico)
"
79,500.0,100.0,170.0,20.0,300.0," Mexican churros with hot chocolate dipping sauce - 500 calories per portion, 2 portions, contains gluten, origin", Mini Frittatas - Approx," Roasted Red Pepper Hummus with Pita Bread - 170 kcals per portion, 4 portions, no allergic warnings, origin", Moroccan Mint Tea, Black Bean and Corn Salad
80,300.0,80.0,120.0,20.0,225.0, Vegan Breakfast Potato Hash - 300 calories per portion | 1 portion | None | Origin, Fruit Salad," Cold Cucumber Soup - 120 kcals per portion, 4 portions, gluten-free (World)", Moroccan Mint Tea, Vegan Stuffed Mushrooms
81,350.0,80.0,250.0,20.0,250.0, Banana Chia Pancakes, Fresh Squeezed Orange Juice, Guacamole with Tortilla Chips, Moroccan Mint Tea, Vegan Swedish Meatballs
82,200.0,100.0,70.0,20.0,350.0, Mediterranean Vegetable Omelette, Stuffed Dates - Approx, Baked kale chips, Moroccan Mint Tea," Chinese Vegan General Tso's Cauliflower (350 calories/portion, 3 portions) - China
"
83,350.0,100.0,150.0,20.0,350.0, Quinoa Breakfast Bake, Fruit salad, Stuffed mushrooms with cream cheese and bacon, Moroccan Mint Tea, Quinoa Salad with Roasted Vegetables
84,400.0,100.0,80.0,20.0,300.0, Vegan Breakfast Hand Pies, Cucumber Rolls with Hummus - Approx, Veggie sticks with hummus, Moroccan Mint Tea," Zucchini Noodles with Pesto - 300 calories/portion, 4 portions, Origin"
85,350.0,100.0,160.0,20.0,350.0," Jamaican cornmeal porridge with cinnamon and nutmeg (350kcals per portion, 2 portions, origin"," Mint Yogurt Dip with Vegetable Sticks - 100kcals per portion, 2 portions
    Origin", Zucchini Fritters, Moroccan Mint Tea," Vegan Thai Coconut Soup - 350 calories per portion, 2 portions, may contain soy"
86,350.0,100.0,80.0,20.0,119.0," Mexican sopes with refried beans and salsa (350kcals per portion, 2 portions, origin", Roasted Almonds, Greek Salad Skewers, Moroccan Mint Tea, Vegan Gazpacho
87,300.0,90.0,200.0,20.0,220.0, Vegetable Frittata, Vegetarian Spring Rolls, Veggie Sushi Burrito, Moroccan Mint Tea, Chickpea and Vegetable Stir Fry
88,400.0,100.0,230.0,20.0,300.0, Vegan Spinach and Mushroom Breakfast Wrap - 400 calories per portion | 1 portion | None | Origin, Caprese Skewers," Matzah Ball Soup - 230 kcals per portion, 3 portions, contains gluten (Jewish)", Moroccan Mint Tea," Vegan Spaghetti with Marinara Sauce - 300 calories per portion, 2 portions, may contain gluten"
89,350.0,100.0,640.0,20.0,350.0, Vegan Breakfast Burrito, Baked Apple Chips, Vegan Ratatouille, Moroccan Mint Tea," Ratatouille with couscous - 350 kcals per portion, 4 portions, vegetarian, contains gluten
"
90,350.0,80.0,200.0,20.0,250.0," Egg and cheese breakfast sandwich - 350 calories per portion, 2 portions, contains gluten and dairy, origin", Hard-Boiled Eggs, Banana Bread, Moroccan Mint Tea," Mexican Zucchini Boats - 250 calories/portion, 4 portions, contains cheese (Mexico)
"
91,400.0,100.0,160.0,20.0,200.0, Veggie English Breakfast, Cucumber Sandwiches, Mini Vegetable Frittatas, Moroccan Mint Tea," Greek stuffed bell peppers - 200 calories per portion, 4 portions, none (Greece)
"
92,400.0,70.0,180.0,20.0,390.0," Thai mango sticky rice - 400 calories per portion, 2 portions, no allergic warnings, origin", Kale chips, Pesto and Tomato Tart, Moroccan Mint Tea, Vegan Tikka Masala
93,250.0,80.0,220.0,20.0,250.0, Vegan Cinnamon Rolls, Mango with Chili Powder, Roasted Red Pepper and Feta Crostini, Moroccan Mint Tea," Ratatouille - 250 calories per portion, 3 portions, may contain onions and garlic"
94,350.0,100.0,150.0,20.0,350.0," Grilled halloumi with tomatoes and cucumber (350kcals per portion, 2 portions, origin", Corn on the Cob," Hummus with Veggies - 150 kcals per portion, 3 portions, may contain sesame (Middle East)", Moroccan Mint Tea," Chickpea Salad Sandwich - 350 calories per portion, 2 portions, may contain gluten"
95,400.0,100.0,150.0,20.0,350.0, Vegan Chocolate Waffles, Edamame, Greek Tzatziki Dip with Pita Bread, Moroccan Mint Tea," Stuffed mushrooms with cream cheese and spinach - 350 kcals per portion, 4 portions, vegetarian, contains lactose
"
96,300.0,80.0,180.0,20.0,280.0, Chia Seed Pancakes, Mango with Chili Powder, Chocolate Peanut Butter Protein Balls, Moroccan Mint Tea," Greek Tomato Fritters - 280kcals per portion, 4 portions
"
97,300.0,100.0,180.0,20.0,300.0, Shakshuka, Som Tam (Papaya Salad), Mango Salsa with Tortilla Chips, Moroccan Mint Tea," Mexican Rice and Beans - 300 calories/portion, 4 portions, contains cilantro (Mexico)
"
98,500.0,100.0,200.0,20.0,300.0, Vegan Breakfast Croque Madame, Greek yogurt with berries, Mini Salmon Cakes, Moroccan Mint Tea," Vegetable stir-fry with tofu (300 calories per portion, 3 portions, contains soy, origin"
99,300.0,100.0,140.0,20.0,250.0, Breakfast Couscous with Fresh Fruit, Watermelon Fruit Pizza," Vegan Sweet Potato Wedges - 140 kcals per portion, 4 portions, no allergic warnings, origin", Moroccan Mint Tea, Mediterranean Couscous Salad
100,250.0,100.0,200.0,20.0,300.0, Middle Eastern Shakshuka, Stuffed Dates - Approx, Quinoa-Stuffed Bell Peppers, Moroccan Mint Tea, Quinoa Stuffed Bell Peppers
101,250.0,100.0,560.0,20.0,300.0, Overnight Chia Oats, Stuffed Dates - Approx, Vegan Chickpea Salad Sandwich, Moroccan Mint Tea," Indian Chana Masala (300 calories/portion, 3 portions) - India

"
102,400.0,80.0,220.0,20.0,300.0," Turkish sesame bagel with cream cheese and olives (400kcals per portion, 1 portion, dairy allergies, origin", Fresh Watermelon Slices - Approx, Banana bread muffins, Moroccan Mint Tea," Vegan Italian Wedding Soup - 300 calories per portion, 4 portions, Gluten, Italy
"
103,250.0,100.0,120.0,20.0,180.0, Buckwheat Porridge, Carrot Sticks with Ranch Dip, Stuffed Dates with Almonds, Moroccan Mint Tea, Ratatouille
104,300.0,100.0,80.0,20.0,200.0, Vegan Chocolate Protein Shake - 300 calories per portion | 1 portion | None | Origin, Berry Chia Detox Water, Caprese Skewers with Balsamic Glaze, Moroccan Mint Tea, Stuffed Zucchini Boats
