,breakfast_calories,morning snacks_calories,afternoon snacks_calories,lunch_calories,dinner_calories,breakfast,morning snacks,afternoon snacks,lunch,dinner
302,150.0,100.0,120.0,400.0,300.0, Vegan Breakfast Fruit Pizza, Roasted Edamame," Vegan Pumpkin Spice Energy Balls - 120 kcals per portion, 4 portions, no allergic warnings, origin", Vegan Korean Bimbimbap Rice Bowl, Vegan Bao Buns
303,550.0,90.0,180.0,550.0,350.0, Vegan Breakfast Cobbler, Stuffed Dates," Spinach and Mushroom Quesadillas - 180 kcals per portion, 4 portions, no allergic warnings, origin"," Vegan Pad Thai
Total calories per portion", Vegan Ravioli
304,350.0,100.0,100.0,300.0,300.0, Vegan Breakfast Stuffed Peppers, Energy Balls," Baked Tofu Nuggets - 100 kcals per portion, 4 portions, no allergic warnings, origin", Black Bean Tacos," Cauliflower Tikka Masala - 300 calories per portion, 4 portions, None, India

"
305,200.0,100.0,80.0,400.0,250.0, Vegan Breakfast Cookies - 200 calories per portion | 2 portions | Contains gluten | Origin, Roasted Pumpkin Seeds," Baked Kale Chips - 80 kcals per portion, 4 portions, no allergic warnings, origin", Chickpea Curry," Greek Vegan Revithokeftedes (250 calories/portion, 4 portions) - Greece

Please note that the calorie counts are approximate and may vary based on specific ingredient choices and preparation methods"
306,300.0,100.0,180.0,250.0,250.0, Vegan Pumpkin Muffins - 300 calories per portion | 2 portions | Contains gluten | Origin, Roasted Almonds," Spinach and Mushroom Quesadillas - 180 kcals per portion, 4 portions, no allergic warnings, origin"," Italian Minestrone Soup
Total calories per portion", Vegan Swedish Meatballs
307,350.0,100.0,440.0,400.0,320.0, Vegan Chocolate Peanut Butter Smoothie - 350 calories per portion | 1 portion | Contains nuts | Origin, Chilled Gazpacho, Vegan Chili," Moroccan Vegetable Tagine
Total calories per portion", Vegan Kung Pao Tofu
308,150.0,100.0,280.0,300.0,350.0, Vegan Egg Muffins - 150 calories per portion | 2 portions | None | Origin, Fresh Fruit Salad, Vegan Lemon Poppy Seed Muffins," Thai Mango Salad
Total calories per portion", Veggie Pot Pie
309,300.0,90.0,280.0,400.0,250.0, Vegan Breakfast Spring Rolls - 300 calories per portion | 1 portion | Contains soy | Origin, Stuffed Dates, Vegan Greek Salad, Vegan Shepherd's Pie," Vegan Lentil and Vegetable Casserole - 250 calories per portion, 4 portions, may contain gluten"
310,250.0,100.0,120.0,350.0,200.0, Vegan Raspberry Almond Scones - 250 calories per portion | 2 portions | Contains gluten and nuts | Origin, Roasted Pumpkin Seeds," Vegan Coconut Lime Energy Balls - 120 kcals per portion, 4 portions, no allergic warnings, origin", Chickpea and Vegetable Stew, Spicy Black Bean Soup
311,400.0,100.0,80.0,350.0,346.0, Vegan Cinnamon Rolls, Baked Apple Chips," Baked Apple Chips - 80 kcals per portion, 4 portions, no allergic warnings, origin", Vegan Eggplant Parmesan, Lentil Curry
312,350.0,100.0,160.0,300.0,208.0, Vegan Breakfast Quinoa Bowl - 350 calories per portion | 1 portion | Contains nuts | Origin, Energy Balls," Vegan Samosas - 160 kcals per portion, 4 portions, no allergic warnings, origin", Lentil and Quinoa Salad, Spinach and Mushroom Quesadillas
313,350.0,100.0,440.0,400.0,250.0, Vegan Breakfast Quinoa Bowl - 350 calories per portion | 1 portion | Contains nuts | Origin, Roasted Almonds, Vegan Chili, Vegan Shepherd's Pie, Vegan Cabbage Rolls
314,300.0,90.0,120.0,400.0,250.0, Veggie Tofu Scramble Wrap - 300 calories per portion | 1 portion | None | Origin, Stuffed Dates," Black Bean Salsa with Tortilla Chips - 120 kcals per portion, 4 portions, no allergic warnings, origin", Vegan Vegetable Biryani, Portobello Mushroom Steaks
315,550.0,100.0,160.0,250.0,300.0, Granola with Soy Milk, Roasted Almonds," Vegan Spinach and Mushroom Tartlets - 160 kcals per portion, 4 portions, no allergic warnings, origin"," Vegan Cauliflower ""Steak""", Quinoa and Lentil Salad
316,350.0,100.0,280.0,300.0,350.0, Vegan Bagel with Tofu Cream Cheese - 350 calories per portion | 1 portion | Contains gluten | Origin, Roasted Edamame, Baked Tofu Nuggets, Lentil and Sweet Potato Stew, Vegan Chili
317,400.0,100.0,90.0,300.0,300.0, Vegan Tofu Benedict - 400 calories per portion | 1 portion | Contains soy | Origin, Chilled Gazpacho," Vegan Caprese Salad Skewers - 90 kcals per portion, 4 portions, no allergic warnings, origin", Vegan Sweet and Sour Tofu, Quinoa-Stuffed Bell Peppers
318,350.0,80.0,90.0,400.0,290.0, Vegan Mushroom and Spinach Omelette - 350 calories per portion | 1 portion | None | Origin, Stuffed Dates," Caprese Skewers with Vegan Mozzarella - 90 kcals per portion, 4 portions, no allergic warnings, origin", Roasted Veggie Pasta, Moroccan Lentil Salad
319,200.0,80.0,580.0,300.0,350.0, Vegan French Toast - 200 calories per portion | 2 portions | Contains gluten | Origin, Fruit Salad, Falafel with Tahini Sauce, Chickpea and Vegetable Couscous, Soba Noodle Stir-Fry
320,300.0,100.0,200.0,350.0,300.0, Berry Quinoa Breakfast Bowl - 300 calories per portion | 1 portion | Contains nuts | Origin, Roasted Almonds, Stuffed Grape Leaves, Spinach and Mushroom Quesadillas, Vegan General Tso's Tofu
321,450.0,90.0,140.0,400.0,250.0, Vegan Breakfast Lassi, Stuffed Dates," Vegan Cinnamon Sugar Donuts - 140 kcals per portion, 4 portions, no allergic warnings, origin"," Vegan Shepherd's Pie
Total calories per portion", Tofu and Vegetable Kebabs
322,250.0,100.0,160.0,400.0,288.0, Raw Vegan Breakfast Bars - 250 calories per portion | 2 portions | Contains nuts | Origin, Baked Apple Chips," Vegan Raspberry Bars - 160 kcals per portion, 4 portions, no allergic warnings, origin", Vegan Bibimbap, Chickpea and Vegetable Curry
323,550.0,80.0,130.0,500.0,213.0, Granola with Soy Milk, Fruit Salad," Veggie Sushi Rolls with Quinoa - 130 kcals per portion, 4 portions, no allergic warnings, origin"," Vegan Korean Bibimbap Bowl
Total calories per portion", Lentil Soup
324,400.0,80.0,380.0,150.0,350.0, Vegan Breakfast Casserole - 400 calories per portion | 1 portion | None | Origin, Stuffed Dates, Vegan Chocolate Chip Cookies, Cabbage Stir-Fry," Vegan Sushi Bowl - 350 calories per portion, 4 portions, Soy, Japan
"
325,600.0,100.0,120.0,300.0,350.0, Vegan Breakfast BLT, Roasted Edamame," Vegan Avocado Toast - 120 kcals per portion, 4 portions, allergic warning (avocado), origin", Mexican Rice Bowl, Vegan Ramen
326,400.0,100.0,460.0,400.0,250.0, Vegan Spinach and Mushroom Breakfast Wrap - 400 calories per portion | 1 portion | None | Origin, Energy Balls, Veggie Tacos," Veggie Tacos with Homemade Tortillas
Total calories per portion"," Roasted Cauliflower Tacos - 250 calories per portion, 4 portions, None, Mexico
"
327,50.0,100.0,400.0,350.0,280.0, Vegan Breakfast Sushi Burrito, Chilled Gazpacho, Vegan Caesar Salad, Vegan Mushroom Stroganoff, Vegan Tikka Masala
328,300.0,80.0,320.0,400.0,350.0, Vegan Coconut Chia Pancakes - 300 calories per portion | 1 portion | Contains gluten | Origin, Stuffed Dates, Vegan Breaded Zucchini Sticks, Vegan Korean Bimbimbap Rice Bowl," Vegan Meatballs with Marinara Sauce - 350 calories per portion, 4 portions, Gluten, Italy
"
329,300.0,100.0,180.0,300.0,250.0, Vegan Coconut Chia Pancakes - 300 calories per portion | 1 portion | Contains gluten | Origin, Energy Balls," Vegan Blueberry Muffins - 180 kcals per portion, 4 portions, no allergic warnings, origin", Zucchini Noodles with Pesto, Vegan Swedish Meatballs
330,350.0,100.0,280.0,300.0,200.0, Vegan Breakfast Bars, Roasted Edamame, Baked Tofu Nuggets, Sweet Potato and Black Bean Chili," Quinoa Salad - 200 calories per portion, 2 portions, may contain nuts"
331,400.0,100.0,180.0,250.0,150.0, Vegan Breakfast Sushi - 400 calories per portion | 1 portion | Contains soy | Origin, Toasted Coconut Chips, Lentil Soup, Stuffed Bell Peppers," Lentil Soup - 150 calories per portion, 4 portions, may contain soy and gluten"
332,500.0,90.0,160.0,200.0,355.0, Vegan Breakfast Cookies, Quinoa Energy Bites," Vegan Spinach and Artichoke Stuffed Mushrooms - 160 kcals per portion, 4 portions, no allergic warnings, origin", Greek Salad with Tofu, Chickpea Salad
333,150.0,100.0,300.0,200.0,350.0, Vegan Pancakes, Chilled Gazpacho, Veggie Spring Rolls," Vegan Moroccan Lentil Soup
Total calories per portion", Vegan BBQ Pulled Jackfruit Sandwich
334,350.0,100.0,600.0,400.0,200.0, Vegan Blueberry Acai Smoothie Bowl - 350 calories per portion | 1 portion | None | Origin, Fresh Fruit Salad, Vegan Shepherd's Pie, Vegan Shepherd's Pie, Vegan Bibimbap
335,400.0,100.0,180.0,300.0,350.0, Vegan Breakfast Hand Pies, Overnight Chia Pudding," Vegan Blueberry Muffins - 180 kcals per portion, 4 portions, no allergic warnings, origin", Ratatouille," Vegan Stir-Fried Noodles - 350 calories per portion, 4 portions, None, Various
"
336,250.0,100.0,600.0,200.0,350.0, Vegan Beetroot and Apple Smoothie - 250 calories per portion | 2 portions | None | Origin, Fresh Fruit Salad, Vegan Shepherd's Pie," Vegan Mushroom and Lentil Soup
Total calories per portion"," Vegan Burger - 350 calories per portion, 4 portions, Gluten, United States
"
337,400.0,100.0,100.0,450.0,200.0, Vegan Breakfast Empanadas - 400 calories per portion | 1 portion | Contains gluten | Origin, Chilled Gazpacho," Crispy Baked Tofu Bites - 100 kcals per portion, 4 portions, no allergic warnings, origin"," Vegan Stuffed Cabbage Rolls
Total calories per portion", Stuffed Mushrooms
338,300.0,100.0,130.0,300.0,280.0, Vegan Cinnamon Rolls - 300 calories per portion | 1 portion | Contains gluten | Origin, Roasted Edamame," Veggie Sushi Rolls with Quinoa - 130 kcals per portion, 4 portions, no allergic warnings, origin"," Mediterranean Quinoa Salad
Total calories per portion", Sweet Potato Curry
339,250.0,100.0,520.0,200.0,250.0, Vegan Blueberry Muffin Overnight Oats - 250 calories per portion | 2 portions | Contains gluten | Origin, Energy Balls, Vegan Mac and Cheese, Avocado and Cucumber Sushi Rolls," Stuffed Portobello Mushrooms - 250 calories per portion, 4 portions, None, Various
"
340,300.0,100.0,140.0,400.0,350.0, Vegan Breakfast Tostadas, Roasted Almonds," Vegan Greek Salad - 140 kcals per portion, 4 portions, no allergic warnings, origin", Vegan Pasta Primavera, Vegan BBQ Sandwich
341,300.0,100.0,80.0,200.0,260.0, Vegan Breakfast Stromboli, Fresh Fruit Salad, Energy Balls, Vegan Spaghetti Aglio e Olio, Mexican Stuffed Zucchini
342,300.0,100.0,240.0,300.0,350.0, Vegan Breakfast Spring Rolls - 300 calories per portion | 1 portion | Contains soy | Origin, Roasted Almonds, Vegan Roasted Cauliflower Bites," Middle Eastern Falafel Salad
Total calories per portion"," Vegan Cauliflower Fried Rice - 350 calories per portion, 4 portions, None, China
"
343,350.0,80.0,380.0,300.0,250.0, Vegan Breakfast Stuffed Peppers, Stuffed Dates, Vegan Chocolate Chip Cookies, Spicy Eggplant Stir-Fry, Vegan Kung Pao Tofu
344,300.0,100.0,80.0,300.0,300.0, Vegan Coconut Chia Pancakes - 300 calories per portion | 1 portion | Contains gluten | Origin, Chilled Gazpacho, Vegan Carrot Cake Energy Balls, Vegan Pita Pizza," Vegan Baked Falafel - 300 calories per portion, 3 portions, may contain gluten"
345,450.0,100.0,90.0,400.0,150.0, Vegan Breakfast Pho, Fresh Fruit Salad," Bruschetta with Fresh Tomatoes and Basil - 90 kcals per portion, 4 portions, no allergic warnings, origin"," Vegan Cuban Sandwich
Total calories per portion"," Lentil Soup - 150 calories per portion, 6 portions, None, Various
"
346,250.0,100.0,90.0,250.0,250.0, Vegan Breakfast Bruschetta - 250 calories per portion | 2 portions | Contains gluten | Origin, Overnight Chia Pudding," Vegan Sweet Potato Toast - 90 kcals per portion, 4 portions, no allergic warnings, origin", Vegan Lentil Loaf," Vegan Soba Noodle Salad - 250 calories per portion, 4 portions, None, Japan
"
347,70.0,100.0,120.0,550.0,300.0, Fruit Salad, Roasted Almonds," Vegan Spinach and Mushroom Frittata - 120 kcals per portion, 4 portions, no allergic warnings, origin"," Vegan Mushroom Risotto
Total calories per portion", Lentil and Vegetable Stir-Fry
348,250.0,90.0,520.0,400.0,280.0, Avocado Toast, Quinoa Energy Bites, Vegan Thai Coconut Curry Soup, Roasted Veggie Pasta, Vegan Tikka Masala
349,350.0,100.0,150.0,350.0,250.0, Vegan Spinach and Mushroom Quiche - 350 calories per portion | 1 portion | Contains gluten | Origin, Fresh Fruit Salad," Vegan Zucchini Fritters with Vegan Sour Cream - 150 kcals per portion, 4 portions, no allergic warnings, origin", Vegan Cajun Jambalaya, Vegan Caesar Salad
350,400.0,100.0,340.0,300.0,180.0, Vegan Breakfast Stuffed Peppers - 400 calories per portion | 1 portion | None | Origin, Baked Apple Chips, Vegan Nachos, Vegan Chinese Hot and Sour Soup, Mediterranean Salad
351,350.0,100.0,120.0,250.0,300.0, Vegan Breakfast Grits - 350 calories per portion | 1 portion | None | Origin, Chilled Gazpacho, Guacamole and Veggie Sticks, Vegan Moroccan Couscous, Roasted Veggie Wrap
352,350.0,100.0,320.0,300.0,250.0, Quinoa Porridge - 350 calories per portion | 1 portion | Contains nuts | Origin, Overnight Chia Pudding, Vegan Breaded Zucchini Sticks, Vegan Chinese Hot and Sour Soup," Vegan Tomato and Vegetable Paella - 250 calories per portion, 3 portions, may contain gluten"
353,250.0,100.0,240.0,300.0,250.0, Raw Vegan Breakfast Bars - 250 calories per portion | 2 portions | Contains nuts | Origin, Chilled Gazpacho, Vegan Spinach Dip with Pita Chips, Vegan Acorn Squash Soup," Zucchini Noodles with Marinara - 250 calories per portion, 4 portions, None, Italy
"
354,300.0,100.0,280.0,450.0,350.0, Vegan Pumpkin Muffins - 300 calories per portion | 2 portions | Contains gluten | Origin, Overnight Chia Pudding, Vegan Lemon Poppy Seed Muffins," Italian Vegan Pizza
Total calories per portion"," Vegan Thai Coconut Soup - 350 calories per portion, 2 portions, may contain soy"
355,450.0,100.0,150.0,250.0,250.0, Quinoa Breakfast Bowl, Toasted Coconut Chips, Vegan Banana Bread," Vegan Pumpkin Soup
Total calories per portion", Ratatouille-Stuffed Zucchini
356,100.0,100.0,120.0,200.0,200.0, Vegan Breakfast Bagel, Toasted Coconut Chips," Vegan Coconut Lime Energy Balls - 120 kcals per portion, 4 portions, no allergic warnings, origin", Veggie Stir-Fry," Vegan Thai Yellow Curry - 200 calories per portion, 2 portions, may contain tofu"
357,350.0,100.0,130.0,300.0,350.0, Vegan Chocolate Peanut Butter Smoothie - 350 calories per portion | 1 portion | Contains nuts | Origin, Energy Balls," Veggie Sushi Rolls with Spicy Tofu - 130 kcals per portion, 4 portions, no allergic warnings, origin", Chinese Vegetable Stir-Fry, Soba Noodle Stir-Fry
358,300.0,100.0,120.0,300.0,300.0, Vegan Breakfast Tiramisu, Roasted Almonds," Vegan Chocolate Chip Cookies - 120 kcals per portion, 4 portions, no allergic warnings, origin", Lentil and Vegetable Stir-Fry," Vegan Baked Falafel - 300 calories per portion, 3 portions, may contain gluten"
359,350.0,80.0,620.0,500.0,300.0, Vegan Breakfast Baked Potato - 350 calories per portion | 1 portion | None | Origin, Fruit Salad, Bean Burritos," Black Bean Quesadillas with Guacamole
Total calories per portion", Vegetable Biryani
360,250.0,80.0,480.0,200.0,150.0, Vegan Coconut Yogurt with Fruit - 250 calories per portion | 1 portion | None | Origin, Fruit Salad, Vegan Cucumber Sushi Rolls, Tom Yum Soup," Ratatouille - 150 calories per portion, 6 portions, None, France
"
361,250.0,100.0,160.0,300.0,350.0, Vegan Breakfast Crepes, Roasted Almonds," Grilled Portobello Mushroom Burger - 160 kcals per portion, 4 portions, no allergic warnings, origin", Lentil Burgers, Vegan Eggplant Parmesan
362,150.0,80.0,150.0,300.0,380.0, Vegan Breakfast Fruit Pizza, Stuffed Dates," Cucumber and Avocado Sushi Rolls - 150 kcals per portion, 4 portions, allergic warning (avocado), origin", Vegan Mushroom and Chestnut Wellington, Vegan Bibimbap
363,450.0,100.0,100.0,400.0,300.0, Vegan Biscuits and Gravy - 450 calories per portion | 1 portion | Contains gluten | Origin, Overnight Chia Pudding," Baked Tofu Nuggets - 100 kcals per portion, 4 portions, no allergic warnings, origin"," Moroccan Vegetable Tagine
Total calories per portion", Vegan Chili
364,300.0,100.0,90.0,300.0,350.0, Vegan Breakfast Tacos - 300 calories per portion | 2 portions | None | Origin, Roasted Pumpkin Seeds," Caprese Skewers with Vegan Mozzarella - 90 kcals per portion, 4 portions, no allergic warnings, origin", Vegan Chili," Vegan Kimchi Fried Rice - 350 calories per portion, 4 portions, None, Korea
"
365,400.0,100.0,180.0,300.0,246.0, Vegan Breakfast Quiche - 400 calories per portion | 1 portion | Contains gluten | Origin, Baked Apple Chips," Quinoa Stuffed Bell Peppers - 180 kcals per portion, 4 portions, no allergic warnings, origin", Vegan Singapore Noodles, Black Bean and Corn Salad
