,breakfast_calories,morning snacks_calories,afternoon snacks_calories,lunch_calories,dinner_calories,breakfast,morning snacks,afternoon snacks,lunch,dinner
321,200.0,100.0,200.0,20.0,200.0, Mexican Black Bean Breakfast Wrap, Mini Frittatas - Approx, Roasted beet and goat cheese salad, Moroccan Mint Tea," Caprese Stuffed Portobello Mushrooms - 200 calories/portion, 4 portions, contains dairy (Italy)
"
322,300.0,80.0,220.0,20.0,320.0, Quinoa Breakfast Cookies, Energy Balls, Baked Mini Samosas with Mint Chutney, Moroccan Mint Tea, Moroccan Vegetable Tagine
323,550.0,80.0,140.0,20.0,340.0, Quiche Lorraine, Apple with Cinnamon, Bacon-Wrapped Asparagus, Moroccan Mint Tea," Spinach and Artichoke Stuffed Portobello Mushrooms - 340kcals per portion, 2 portions, contains dairy
"
324,250.0,60.0,150.0,20.0,350.0, Vegan Coconut Yogurt with Fruit - 250 calories per portion | 1 portion | None | Origin, Cucumber and tomato salad," Vegan Zucchini Bread - 150 kcals per portion, 4 portions, no allergic warnings, origin", Moroccan Mint Tea," Chinese Vegan Dan Dan Noodles (350 calories/portion, 2 portions) - China
"
325,250.0,100.0,280.0,20.0,280.0," Coconut chia pudding with mango (250kcals per portion, 2 portions)
", Fresh Fruit Salad, Veggie Bruschetta Pizza, Moroccan Mint Tea, Lentil and Spinach Curry
326,250.0,80.0,80.0,20.0,300.0," Vegan overnight oats with almond milk and berries (250kcals per portion, 2 portions, nut allergies)
", Fruit Salad, Gazpacho, Moroccan Mint Tea, Tofu and Vegetable Curry
327,450.0,80.0,200.0,20.0,250.0," Smoked turkey and cheese sandwich (450kcals per portion, 1 portion, turkey allergies, origin", Baked Apple Chips, Spinach Dip, Moroccan Mint Tea, Cauliflower Fried Rice
328,400.0,100.0,80.0,20.0,350.0," Cheese and beef sausage omelet (400kcals per portion, 2 portions, dairy allergies, origin", Cucumber Sandwiches, Greek Salad Skewers, Moroccan Mint Tea," Mexican Rice and Beans - 350 calories per portion, 4 portions, None, Mexico
"
329,250.0,100.0,80.0,20.0,350.0, Spinach and Mushroom Oatmeal, Mini Frittatas - Approx, Mini stuffed bell peppers with cream cheese, Moroccan Mint Tea," Thai Red Curry - 350 calories/portion, 4 portions, Origin"
330,320.0,100.0,240.0,20.0,350.0," Tomato and mozzarella bruschetta (320 calories per portion, 2 portions, contains dairy, Italian origin)
", Vegetable Crudité with Hummus, Vegan Spinach Dip with Pita Chips, Moroccan Mint Tea, Tofu Tikka Masala
331,350.0,100.0,200.0,20.0,300.0, Vegan Sweet Potato Hash Browns - 350 calories per portion | 1 portion | None | Origin, Fruit Salad, Vegan Chocolate Covered Strawberries, Moroccan Mint Tea, Sweet Potato and Lentil Curry
332,400.0,100.0,150.0,20.0,300.0," Egyptian feteer meshaltet (layered pastry) with honey - 400 calories per portion, 2 portions, contains gluten, origin", Quinoa Energy Bites, Zucchini chips, Moroccan Mint Tea," Spinach and feta phyllo triangles - 300 calories per portion, 4 portions, contains gluten and dairy (Greece)
"
333,350.0,100.0,180.0,20.0,300.0," French toast with cinnamon and maple syrup (350kcals per portion, 2 portions, origin", Caprese Skewers, Mini Crab Cakes, Moroccan Mint Tea," Lentil Samosas - 300 calories per portion, 4 portions, None, India
"
334,250.0,80.0,200.0,20.0,250.0, Tropical Green Smoothie," Carrot Sticks with Hummus - 80kcals per portion, 2 portions
   Origin", Chicken Satay Skewers, Moroccan Mint Tea," Mexican Zucchini Boats - 250 calories/portion, 4 portions, contains cheese (Mexico)
"
335,250.0,100.0,180.0,20.0,350.0, Vegetable Scramble, Stuffed Dates - Approx, Quinoa Stuffed Mushrooms, Moroccan Mint Tea," Quinoa and Black Bean Burritos - 350 calories/portion, 4 portions, Origin"
336,250.0,80.0,70.0,20.0,220.0, Vegan Coconut Yogurt with Fruit - 250 calories per portion | 1 portion | None | Origin, Fresh Squeezed Orange Juice, Stuffed Cherry Tomatoes, Moroccan Mint Tea, Quinoa and Vegetable Stir Fry
337,380.0,100.0,200.0,20.0,250.0," Cinnamon apple quinoa bake (380 calories per portion, 2 portions, nut-free, American origin)
", Mini Frittatas - Approx, Cheese and Crackers, Moroccan Mint Tea," Spinach and Feta Stuffed Mushrooms - 250 calories/portion, 4 portions, contains dairy (Greece)
"
338,350.0,100.0,90.0,20.0,350.0, Vegan Tofu Scramble Breakfast Sandwich - 350 calories per portion | 1 portion | Contains soy | Origin, Roasted Chickpeas, Homemade Popcorn, Moroccan Mint Tea," Thai Red Curry - 350 calories/portion, 4 portions, Origin"
339,700.0,100.0,200.0,20.0,350.0, Vegan Breakfast Crepe Cake," Rice Cake with Almond Butter - 100kcals per portion, 2 portions
    Origin", Spinach and artichoke dip with tortilla chips, Moroccan Mint Tea," Mexican Rice and Bean Stuffed Peppers - 350kcals per portion, 4 portions, contains legumes (Mexico)
"
340,400.0,100.0,220.0,20.0,250.0, Vegan Breakfast Stuffed Sweet Potatoes - 400 calories per portion | 1 portion | None | Origin, Cucumber Rolls with Cream Cheese, Baked Sweet Potato Fries, Moroccan Mint Tea," Greek Spinach Pie (Spanakopita) - 250 calories/portion, 6 portions, Origin"
341,400.0,110.0,180.0,20.0,250.0, Veggie Bagel Sandwich, Moroccan-style boiled eggs, Lentil Salad, Moroccan Mint Tea," Spinach and Ricotta Stuffed Mushrooms - 250 calories/portion, 4 portions, Origin"
342,250.0,80.0,120.0,20.0,290.0, Vegan Beetroot and Apple Smoothie - 250 calories per portion | 2 portions | None | Origin, Mango with Chili Powder, Pumpkin Hummus with Carrot Sticks, Moroccan Mint Tea," Spinach and Feta Stuffed Mushrooms - 290kcals per portion, 4 portions, contains dairy
"
343,250.0,100.0,250.0,20.0,380.0, Vegetable Scramble, Cucumber Rolls with Cream Cheese, Rice Paper Rolls with Peanut Sauce, Moroccan Mint Tea," Vegetable Curry with Coconut Milk - 380kcals per portion, 4 portions, contains nuts
"
344,300.0,100.0,70.0,20.0,200.0, Vegan Breakfast Burrito, Boiled chickpeas, Greek Cucumber Cups, Moroccan Mint Tea," Quinoa Salad - 200 calories per portion, 2 portions, may contain nuts"
345,400.0,80.0,280.0,20.0,350.0," Banana pancakes - 400 calories per portion, 2 portions, contains gluten and dairy, origin", Mango with Chili Powder," Greek Spanakopita - 280 kcals per portion, 3 portions, contains gluten, dairy (Greece)", Moroccan Mint Tea, Shrimp and Avocado Salad
346,350.0,80.0,80.0,20.0,350.0," French toast with maple syrup - 350 calories per portion, 2 portions, contains gluten and dairy, origin", Avocado Deviled Eggs," Popcorn - 80 kcals per portion, 4 portions, gluten-free (World)", Moroccan Mint Tea, Baked Cod with Lemon and Herbs
347,450.0,100.0,200.0,20.0,300.0, Vegan Biscuits and Gravy - 450 calories per portion | 1 portion | Contains gluten | Origin, Corn on the Cob, Chickpea Salad, Moroccan Mint Tea," Greek Gigantes Plaki - 300 calories/portion, 4 portions, contains garlic (Greece)
"
348,400.0,100.0,180.0,20.0,350.0, Vegetarian Breakfast Casserole, Carrot Sticks with Ranch Dip, Chocolate Peanut Butter Protein Balls, Moroccan Mint Tea, Veggie Spring Rolls
349,400.0,100.0,250.0,20.0,300.0, Smashed Avocado and Egg Toast, Cucumber Sandwich, Stuffed Bell Peppers with Quinoa, Moroccan Mint Tea, Indian-Style Spinach and Chickpeas
350,250.0,90.0,150.0,20.0,340.0," Banana walnut muffins (250 calories per portion, 2 portions, contains nuts, American origin)
", Vegetarian Spring Rolls, Avocado Toast, Moroccan Mint Tea," Quinoa and Black Bean Burger - 340kcals per portion, 4 portions, contains legumes
"
351,400.0,80.0,220.0,20.0,350.0, Shakshuka with Merguez Sausage, Baked Apple Chips, Chicken Satay Lettuce Wraps, Moroccan Mint Tea," Sweet potato and black bean enchiladas – 350 calories per portion, 4 portions, vegetarian-friendly (origin"
352,250.0,90.0,300.0,20.0,350.0, Tropical Green Smoothie, Rice Paper Rolls, Chicken Gyro Wraps, Moroccan Mint Tea," Tofu and vegetable stir-fry with noodles – 350 calories per portion, 2 portions, vegan-friendly
"
353,300.0,50.0,40.0,20.0,300.0, Mushroom and Tomato Omelette, Baked Apple Chips - Approx, Cucumber Roll-Ups, Moroccan Mint Tea," Mediterranean Orzo Salad - 300 calories per portion, 4 portions, contains gluten (pasta), Origin"
354,350.0,90.0,100.0,20.0,350.0, Chocolate Chip Muffins, Fruit Salad, Greek Cucumber Dip with Pita Bread, Moroccan Mint Tea," Greek Stuffed Peppers with Rice and Feta - 350kcals per portion, 4 portions, contains dairy
"
355,400.0,100.0,90.0,20.0,380.0," Açai bowl topped with fruits and coconut flakes (400kcals per portion, 1 portion, origin", Kiwi and Strawberry Smoothie, Cucumber Sandwiches, Moroccan Mint Tea," Ratatouille Pasta - 380kcals per portion, 4 portions
"
356,250.0,80.0,250.0,20.0,350.0, Tropical Smoothie, Stuffed Dates, Sweet Potato and Black Bean Wraps, Moroccan Mint Tea," Vegetable paella – 350 calories per portion, 4 portions, vegan-friendly (origin"
357,400.0,100.0,200.0,20.0,250.0, Vegan Breakfast Quesadilla - 400 calories per portion | 1 portion | Contains gluten | Origin, Cucumber Slices with Tzatziki - Approx, Mango Salsa with Chips, Moroccan Mint Tea," Greek Vegan Gigantes (250 calories/portion, 4 portions) - Greece
"
358,600.0,100.0,180.0,20.0,200.0, Vegan Breakfast Danish, Energy Balls - Approx, Dates stuffed with almond butter, Moroccan Mint Tea," Stuffed Portobello Mushrooms - 200 calories/portion, 2 portions, Origin"
359,300.0,100.0,120.0,20.0,340.0, Veggie Breakfast Quesadilla," Dates Stuffed with Almond Butter - 100kcals per portion, 2 portions
    Origin", Watermelon and feta skewers, Moroccan Mint Tea," Caprese Stuffed Portobello Mushrooms - 340kcals per portion, 2 portions, contains dairy
"
360,250.0,100.0,220.0,20.0,300.0, Vegan Breakfast Shakshuka, Edamame, Nutella Stuffed French Toast, Moroccan Mint Tea," Grilled vegetable skewers with couscous - 300 kcals per portion, 4 portions, vegetarian, contains gluten
"
361,250.0,100.0,300.0,20.0,250.0, Vegan Cinnamon Rolls, Caprese Skewers, Mini black bean and cheese quesadillas, Moroccan Mint Tea, Stuffed Portobello Mushrooms
362,350.0,100.0,620.0,20.0,250.0, Ricotta Pancakes, Watermelon and feta skewers, Bean Burritos, Moroccan Mint Tea," Panzanella salad - 250 calories per portion, 4 portions, contains gluten (Italy)
"
363,300.0,100.0,180.0,20.0,200.0, Vegan Smoothie Bowl, Greek yogurt with berries, Homemade Veggie Pizza Rolls, Moroccan Mint Tea, Vegetable Stir-Fry
364,400.0,80.0,150.0,20.0,380.0, Veggie English Breakfast, Cheesy Popcorn, Bruschetta with Tomato and Basil, Moroccan Mint Tea," Shrimp and vegetable stir-fry with brown rice - 380 kcals per portion, 2 portions, contains shellfish, soy
"
365,400.0,100.0,220.0,20.0,350.0, Breakfast Stuffed Peppers, Caprese Skewers, Guacamole with Tortilla Chips, Moroccan Mint Tea," Sweet Potato Curry - 350 calories/portion, 4 portions, Origin"
