,breakfast_calories,morning snacks_calories,afternoon snacks_calories,lunch_calories,dinner_calories,breakfast,morning snacks,afternoon snacks,lunch,dinner
228,200.0,70.0,120.0,20.0,200.0, Oatmeal with Berries, Fresh Fruit Salad, Basil pesto pasta salad, Moroccan Mint Tea," Quinoa Salad - 200 calories per portion, 2 portions, may contain nuts"
229,300.0,100.0,90.0,20.0,210.0, Veggie Bagel Sandwich, Baked Apple Chips, Bruschetta, Moroccan Mint Tea, Lentil and Vegetable Stir Fry
230,300.0,80.0,140.0,20.0,200.0," Spinach and feta pastry turnovers (300kcals per portion, 2 portions, dairy allergies)
", Fruit Salad," Vegan Lemon Bars - 140 kcals per portion, 4 portions, no allergic warnings, origin", Moroccan Mint Tea, Lentil Curry
231,250.0,60.0,180.0,20.0,150.0, Middle Eastern Shakshuka, Fruit Salad - Approx, Baked Buffalo Chicken Wings, Moroccan Mint Tea," Lentil Soup - 150 calories per portion, 6 portions, None, Various
"
232,200.0,100.0,100.0,20.0,200.0, Mini Vegetable Quiche, Frozen Grapes, Miso Soup, Moroccan Mint Tea," Black Bean and Corn Salad - 200 calories per portion, 4 portions, None, Various
"
233,250.0,90.0,90.0,20.0,200.0, Vegan Raspberry Almond Scones - 250 calories per portion | 2 portions | Contains gluten and nuts | Origin, Turkish-style boiled eggs, Vegan Energy Balls, Moroccan Mint Tea," Mexican Stuffed Portobello Mushrooms - 200 calories/portion, 4 portions, contains gluten (Mexico)
"
234,250.0,100.0,150.0,20.0,200.0, Vegan Breakfast Strata," Apple Slices with Caramel Dip - 100kcals per portion, 2 portions
    Origin", Mini cheese and vegetable calzones, Moroccan Mint Tea," Vegan Buffalo Cauliflower Wings - 200 calories per portion, 4 portions, None, United States
"
235,300.0,100.0,80.0,20.0,200.0, Vegan Apple Cinnamon Quinoa - 300 calories per portion | 1 portion | None | Origin, Cucumber Slices with Tzatziki - Approx, Cucumber cream cheese roll-ups, Moroccan Mint Tea," Vegan Lentil and Vegetable Stir-Fry - 200 calories per portion, 3 portions, may contain soy"
236,200.0,100.0,250.0,20.0,180.0, Vegan Banana Bread, Stuffed Dates - Approx, Guacamole with Tortilla Chips, Moroccan Mint Tea, Tofu Stir-Fry
237,250.0,100.0,90.0,20.0,150.0," Chia seed pudding with coconut milk (250 calories per portion, 2 portions, nut-free, American origin)
", Mini Frittatas - Approx," Vegan Caprese Salad Skewers - 90 kcals per portion, 4 portions, no allergic warnings, origin", Moroccan Mint Tea," Ratatouille - 150 calories per portion, 6 portions, None, France
"
238,300.0,80.0,100.0,20.0,220.0, Chia Seed Pudding Parfait, Fruit Salad, Asian cucumber salad, Moroccan Mint Tea, Quinoa and Vegetable Stir Fry
239,200.0,80.0,180.0,20.0,100.0, Vegan Blueberry Pancakes, Fruit Salad, Coconut Almond Energy Balls, Moroccan Mint Tea," Ratatouille - 100 calories per portion, 4 portions, none (France)
"
240,50.0,100.0,160.0,20.0,213.0, Vegan Breakfast Smoothie, Cucumber Rolls with Hummus - Approx," Vegan Spinach and Mushroom Tartlets - 160 kcals per portion, 4 portions, no allergic warnings, origin", Moroccan Mint Tea, Lentil Soup
241,150.0,100.0,200.0,20.0,220.0," Vegemite on toast - 150 calories per portion, 1 portion, contains gluten, origin", Cucumber and Tomato Salad, Spinach and Cheese Puffs, Moroccan Mint Tea," Greek Salad - 220kcals per portion, 4 portions, contains dairy
"
242,200.0,100.0,80.0,20.0,200.0, Veggie Breakfast Pizza Rolls, Cucumber and Tomato Salad, Cucumber cream cheese roll-ups, Moroccan Mint Tea, Lentil Soup
243,250.0,90.0,80.0,20.0,200.0, Raspberry Chia Pudding, Rice Paper Rolls, Cucumber cream cheese roll-ups, Moroccan Mint Tea," Vegan Buffalo Cauliflower Wings - 200 calories per portion, 4 portions, None, United States
"
244,200.0,100.0,150.0,20.0,220.0, Spinach and Mushroom Breakfast Tacos, Energy Balls, Mini spinach and feta quiches, Moroccan Mint Tea," Quinoa Salad - 220 calories per portion, 4 portions, None, Peru
"
245,300.0,80.0,220.0,20.0,200.0, Vegan Chocolate Chip Pancakes," Carrot Sticks with Hummus - 80kcals per portion, 2 portions
   Origin", Veggie Mediterranean Flatbread, Moroccan Mint Tea," Tofu Stir-Fry - 200 calories per portion, 4 portions, Soy, China
"
246,300.0,100.0,180.0,20.0,200.0, Mediterranean Chickpea Scramble, Rice Cake with Hummus and Cucumber," Baked Falafel Salad - 180 kcals per portion, 4 portions, allergic warning (sesame), origin", Moroccan Mint Tea," Italian Caprese Salad (200 calories/portion, 2 portions) - Italy
"
247,200.0,100.0,200.0,20.0,180.0, Vegan Scones - 200 calories per portion | 2 portions | Contains gluten | Origin, Toasted Coconut Chips, Almond butter energy bites, Moroccan Mint Tea," Greek Roasted Vegetables - 180kcals per portion, 4 portions
"
248,250.0,100.0,150.0,20.0,200.0," Smoothie bowl - 250 calories per portion, 1 portion, may contain nuts, origin", Energy Balls - Approx," Vegan Zucchini Bread - 150 kcals per portion, 4 portions, no allergic warnings, origin", Moroccan Mint Tea, Lentil Spinach Soup
249,200.0,100.0,200.0,20.0,210.0, Vegan Blueberry Pancakes," Mediterranean Style Feta Stuffed Dates - 100kcals per portion, 2 portions
    Origin", Vegetable Dumplings, Moroccan Mint Tea, Quinoa Stuffed Portobello Mushrooms
250,220.0,100.0,160.0,20.0,200.0," Vegetable frittata - 220 calories per portion, 4 portions, no allergic warnings, origin", Fruit Salad," Cucumber Bites with Herbed Cream Cheese - 160 kcals per portion, 4 portions, contains dairy (Various)", Moroccan Mint Tea, Lentil Soup
251,300.0,100.0,170.0,20.0,200.0, Shakarkandi ki Chaat (Sweet Potato Chaat)," Mint Yogurt Dip with Vegetable Sticks - 100kcals per portion, 2 portions
    Origin", Sweet Corn Fritters, Moroccan Mint Tea," Vegan Tomato Soup - 200 calories per portion, 4 portions, None, Various
"
252,200.0,100.0,180.0,20.0,150.0," Miso soup with tofu and seaweed (200kcals per portion, 2 portions, soy allergies, Japan)
", Roasted Almonds," Baked Falafel Salad - 180 kcals per portion, 4 portions, allergic warning (sesame), origin", Moroccan Mint Tea, Caprese Salad
253,200.0,80.0,160.0,20.0,200.0, Veggie Breakfast Wrap with Tofu Scramble, Baked Apple Chips," Cinnamon Sugar Pretzels - 160 kcals per portion, 3 portions, contains gluten (USA)", Moroccan Mint Tea," Mexican Stuffed Portobello Mushrooms - 200 calories/portion, 4 portions, contains gluten (Mexico)
"
254,300.0,100.0,280.0,20.0,220.0, Banana Nut Smoothie Bowl, Som Tam (Papaya Salad), Vegan Lemon Poppy Seed Muffins, Moroccan Mint Tea, Chickpea Salad
255,150.0,100.0,120.0,20.0,150.0, Chia Pudding - 150 calories per portion | 1 portion | None | Origin, Kiwi and Strawberry Smoothie, Greek Yogurt Parfait, Moroccan Mint Tea," Greek Salad with Tofu - 150 calories/portion, 4 portions, contains soy (Greece)
"
256,300.0,90.0,100.0,20.0,240.0," Singaporean kaya toast - 300 calories per portion, 2 portions, contains gluten and dairy, origin", Stuffed Dates, Chocolate Covered Strawberries, Moroccan Mint Tea," Citrus Quinoa Salad - 240kcals per portion, 4 portions
"
257,300.0,100.0,120.0,20.0,200.0, Berry Quinoa Breakfast Bowl - 300 calories per portion | 1 portion | Contains nuts | Origin, Frozen Grapes, Tzatziki and pita chips, Moroccan Mint Tea," Minestrone soup - 200 calories per portion, 6 portions, contains gluten (Italy)
"
258,200.0,100.0,280.0,20.0,150.0, Vegan Breakfast Enchiladas, Rice Paper Spring Rolls, Veggie Pita Pockets, Moroccan Mint Tea," Feta and spinach stuffed tomatoes - 150 calories per portion, 6 portions, contains dairy (Greece)
"
259,250.0,100.0,130.0,20.0,220.0, Vegan Blueberry Chia Pancakes, Caprese Skewers," Stuffed Mini Portobello Mushrooms - 130 kcals per portion, 4 portions, no allergic warnings, origin", Moroccan Mint Tea, Quinoa and Vegetable Stir Fry
260,200.0,100.0,220.0,20.0,170.0, Vegan Breakfast Enchiladas," Mint Yogurt Dip with Vegetable Sticks - 100kcals per portion, 2 portions
    Origin"," Poppy Seed Cake - 220 kcals per portion, 3 portions, contains gluten (Various)", Moroccan Mint Tea, Vegan Caprese Salad
261,250.0,100.0,120.0,20.0,150.0," Tofu scramble with vegetables (250kcals per portion, 2 portions, soy allergies, origin", Roasted Chickpeas, Peanut Butter Energy Balls, Moroccan Mint Tea," Steamed Fish with Lemon Butter Sauce - 150 calories per portion, 4 portions, no allergic warnings, Origin"
262,250.0,100.0,120.0,20.0,150.0, Greek Yogurt with Honey and Nuts, Mini Frittatas - Approx, Miso Soup with Tofu, Moroccan Mint Tea," Caprese salad - 150 calories per portion, 4 portions, contains dairy (Italy)
"
263,300.0,100.0,200.0,20.0,200.0, Berry Quinoa Breakfast Bowl - 300 calories per portion | 1 portion | Contains nuts | Origin, Rice Cake with Hummus and Cucumber, Tomato and Avocado Bruschetta, Moroccan Mint Tea, Veggie Miso Soup
264,250.0,100.0,200.0,20.0,170.0, Spinach and Mushroom Oatmeal, Quinoa Energy Bites, Vegetable Couscous Salad, Moroccan Mint Tea, Vegan Caprese Salad
265,250.0,100.0,150.0,20.0,200.0, Vegan Breakfast Bruschetta - 250 calories per portion | 2 portions | Contains gluten | Origin, Cucumber and Tomato Salad, Caprese skewers, Moroccan Mint Tea," Caprese Salad - 200 calories/portion, 4 portions, contains dairy (Italy)
"
266,300.0,100.0,200.0,20.0,200.0," Egyptian ful medames (fava bean dish) with olive oil and lemon (300kcals per portion, 2 portions, origin", Corn on the Cob, Cucumber Cups with Tuna Salad, Moroccan Mint Tea," Caprese Stuffed Avocado - 200 calories/portion, 4 portions, contains dairy (Italy)
"
267,150.0,100.0,150.0,20.0,200.0, Vegan Pancakes, Caprese Skewers, Avocado Toast, Moroccan Mint Tea, Mediterranean Stuffed Eggplant
268,220.0,80.0,80.0,20.0,200.0," Scrambled eggs with toast - 220 calories per portion, 2 portions, no allergic warnings, origin", Hard-Boiled Eggs, Veggie Spring Rolls, Moroccan Mint Tea," Mediterranean Stuffed Tomatoes - 200 calories/portion, 4 portions, Origin"
269,300.0,100.0,100.0,20.0,150.0, Classic Peanut Butter and Jelly, Baked Apple Chips, Greek Cucumber Dip with Pita Bread, Moroccan Mint Tea," Lentil Soup - 150 calories per portion, 6 portions, None, Various
"
270,200.0,80.0,150.0,20.0,200.0, Vegetable Frittata, Baked Apple Chips," Hummus with Veggies - 150 kcals per portion, 3 portions, may contain sesame (Middle East)", Moroccan Mint Tea, Vegan Caprese Salad
271,100.0,100.0,100.0,20.0,200.0, Healthy Fruit Salad," Raspberry Yogurt Popsicles - 100kcals per portion, 2 portions
    Origin", Baked Zucchini Chips, Moroccan Mint Tea," Lentil curry - 200 calories per portion, 6 portions, contains gluten (India)
"
272,200.0,100.0,120.0,20.0,200.0," Spinach and feta stuffed mushrooms - 200 calories per portion, 2 portions, contains dairy, origin", Watermelon Fruit Pizza, Spinach and Feta Stuffed Mushrooms, Moroccan Mint Tea, Ratatouille
273,300.0,100.0,160.0,20.0,210.0, Mediterranean Chickpea Scramble, Guacamole Stuffed Cherry Tomatoes," Vegan Broccoli and Cheese Bites - 160 kcals per portion, 4 portions, no allergic warnings, origin", Moroccan Mint Tea, Quinoa and Kale Salad
274,300.0,80.0,300.0,20.0,200.0," Nigerian moi moi (bean pudding) - 300 calories per portion, 2 portions, no allergic warnings, origin", Baked Apple Chips, Cheese and fruit platter, Moroccan Mint Tea," Indian Vegetable Samosas - 200 calories/portion, 4 portions, contains gluten (India)
"
275,50.0,80.0,250.0,20.0,200.0, Vegan Breakfast Sushi Burrito, Fruit Salad, Spinach and Feta Rolls, Moroccan Mint Tea," Stuffed Acorn Squash - 200 calories/portion, 4 portions, Origin"
276,250.0,100.0,120.0,20.0,200.0, Vegan Breakfast Shakshuka, Tomato Basil Bruschetta, Yogurt Covered Strawberries, Moroccan Mint Tea," Vegan Creamy Cauliflower Soup - 200 calories per portion, 4 portions, None, Various
"
277,300.0,100.0,130.0,20.0,200.0, Veggie Breakfast Quesadilla, Watermelon and feta skewers," Sweet and Spicy Roasted Cashews - 130 kcals per portion, 4 portions, allergic warning (cashews), origin", Moroccan Mint Tea," Greek stuffed bell peppers - 200 calories per portion, 4 portions, none (Greece)
"
278,300.0,90.0,250.0,20.0,221.0, Vegan Omelette, Vegetarian Spring Rolls, Greek Stuffed Grape Leaves (Dolmades), Moroccan Mint Tea, Zucchini Noodles with Pesto
279,300.0,90.0,160.0,20.0,220.0," Singaporean kaya toast - 300 calories per portion, 2 portions, contains gluten and dairy, origin", Vegetarian Spring Rolls," Chia Seed Pudding - 160 kcals per portion, 4 portions, gluten-free (Various)", Moroccan Mint Tea, Quinoa and Vegetable Stir Fry
280,300.0,80.0,160.0,20.0,210.0, Irish Soda Bread, Avocado Deviled Eggs, Black Olive Tapenade with Crackers, Moroccan Mint Tea," Greek Briam - 210kcals per portion, 4 portions
"
281,250.0,100.0,90.0,20.0,200.0," Banana walnut muffins (250 calories per portion, 2 portions, contains nuts, American origin)
"," Apple Slices with Caramel Dip - 100kcals per portion, 2 portions
    Origin", Baked Parmesan Zucchini Bites, Moroccan Mint Tea," Vegan Tomato Soup - 200 calories per portion, 4 portions, None, Various
"
282,280.0,100.0,250.0,20.0,150.0," Avocado toast with smoked salmon (280 calories per portion, 2 portions, contains fish, American origin)
", Roasted Chickpeas," Lentil Soup - 250 kcals per portion, 2 portions, gluten-free (Mediterranean)", Moroccan Mint Tea, Chickpea Salad
283,70.0,100.0,250.0,20.0,200.0, Fruit Salad, Boiled chickpeas, Mini Falafel Burgers, Moroccan Mint Tea," Lentil Spinach Soup - 200 calories per portion, 4 portions, None, Various
"
284,300.0,90.0,180.0,20.0,220.0, Avocado Toast - 300 calories per portion | 1 portion | None | Origin, Fruit Salad, Kale smoothie with pineapple and coconut water, Moroccan Mint Tea, Lentil Soup with Quinoa
285,200.0,100.0,180.0,20.0,120.0, Vegan Green Smoothie - 200 calories per portion | 2 portions | None | Origin, Frozen Grapes, Broccoli and cheese bites, Moroccan Mint Tea," Grilled vegetable skewers - 120 calories per portion, 4 portions, none
"
286,200.0,100.0,250.0,20.0,200.0, Vegan Matcha Chia Pudding - 200 calories per portion | 1 portion | None | Origin, Stuffed Dates - Approx, Stuffed Avocado with Quinoa, Moroccan Mint Tea, Lentil and Vegetable Soup
287,250.0,100.0,250.0,20.0,220.0, Vegan Banana Muffins, Caprese Skewers, Mini chicken pot pies, Moroccan Mint Tea," Greek Salad - 220kcals per portion, 4 portions, contains dairy
"
288,300.0,100.0,100.0,20.0,200.0, Vegan Breakfast Stromboli, Greek yogurt with berries, Spinach and feta triangles, Moroccan Mint Tea, Quinoa Salad
289,250.0,60.0,200.0,20.0,200.0, Vegan Breakfast Sushi Rolls, Fruit Salad - Approx, Cheese and Spinach Puffs, Moroccan Mint Tea," Miso soup with tofu and seaweed – 200 calories per portion, 6 portions, vegan-friendly (origin"
290,250.0,80.0,120.0,20.0,220.0, Vegan Breakfast Bruschetta, Fruit Salad, Ricotta Stuffed Cherry Tomatoes, Moroccan Mint Tea," Greek Salad - 220kcals per portion, 4 portions, contains dairy
"
291,250.0,100.0,160.0,20.0,200.0, Vegan Overnight Chia Pudding - 250 calories per portion | 2 portions | None | Origin, Roasted Edamame, Zucchini Fritters, Moroccan Mint Tea, Quinoa Stuffed Mushrooms
292,200.0,100.0,200.0,20.0,220.0, Vegan Breakfast Quiche Lorraine, Zesty Lime Popcorn - Approx, Green smoothie bowl, Moroccan Mint Tea, Quinoa and Vegetable Stir Fry
293,250.0,100.0,300.0,20.0,200.0, Cucumber Sandwich, Boiled chickpeas, Cheese and Crackers, Moroccan Mint Tea, Mexican Rice Bowl
294,200.0,80.0,200.0,20.0,200.0, Mini Vegetable Quiche, Cheesy Popcorn, Stuffed Eggplant, Moroccan Mint Tea, Vegetable Stir-Fry
295,300.0,80.0,100.0,20.0,200.0, Idli and Sambar, Stuffed Dates," Baked Tofu Nuggets - 100 kcals per portion, 4 portions, no allergic warnings, origin", Moroccan Mint Tea," Minestrone soup - 200 calories per portion, 6 portions, contains gluten (Italy)
"
296,200.0,60.0,180.0,20.0,180.0, Mexican Black Bean Breakfast Wrap, Cucumber and tomato salad, Cranberry Orange Muffins, Moroccan Mint Tea," Cauliflower Shawarma - 180 calories per portion, 6 portions, None, Middle East
"
297,300.0,50.0,100.0,20.0,200.0, Feta and Spinach Muffins," Fruit Salad - 50kcals per portion, 2 portions
   Origin", Greek yogurt with mixed berries, Moroccan Mint Tea, Stuffed Zucchini Boats
298,280.0,80.0,200.0,20.0,180.0," Avocado toast with smoked salmon (280 calories per portion, 2 portions, contains fish, American origin)
", Apple with Cinnamon, Chicken Fajita Skewers, Moroccan Mint Tea," Cauliflower Shawarma - 180 calories per portion, 6 portions, None, Middle East
"
299,200.0,80.0,100.0,20.0,221.0, Avocado Toast, Kale Chips, Baked Buffalo Cauliflower Bites, Moroccan Mint Tea, Zucchini Noodles with Pesto
300,300.0,100.0,200.0,20.0,120.0, Blueberry Coconut Overnight Oats, Roasted Almonds," Quinoa Salad - 200 kcals per portion, 4 portions, gluten-free (South America)", Moroccan Mint Tea," Grilled vegetable skewers - 120 calories per portion, 4 portions, none
"
301,300.0,80.0,250.0,20.0,200.0," Greek yogurt parfait with mixed berries and honey (300kcals per portion, 1 portion, origin", Cheesy Popcorn, Baked salmon cakes, Moroccan Mint Tea," Tomato and mozzarella tart - 200 calories per portion, 4 portions, contains gluten and dairy (Italy)
"
302,300.0,100.0,90.0,20.0,200.0, Veggie Breakfast Burrito Bowl," Mediterranean Style Feta Stuffed Dates - 100kcals per portion, 2 portions
    Origin", Zucchini Pizza Bites, Moroccan Mint Tea, Spanish Gazpacho
303,250.0,100.0,300.0,20.0,200.0, Vegan Banana Bread, Rice Paper Spring Rolls, Roasted Vegetable Pizza, Moroccan Mint Tea," Greek-style stuffed zucchini - 200 calories per portion, 4 portions, none (Greece)
"
304,200.0,100.0,120.0,20.0,200.0, Veggie Breakfast Wrap with Tofu Scramble, Frozen Grapes," Vegan Chocolate Chip Cookies - 120 kcals per portion, 4 portions, no allergic warnings, origin", Moroccan Mint Tea," Vegan BBQ Tofu - 200 calories per portion, 4 portions, Soy, United States
"
305,250.0,100.0,100.0,20.0,200.0, Veggie Omelette, Greek yogurt with berries, Cheese and bacon stuffed mushrooms, Moroccan Mint Tea, Mediterranean Stuffed Eggplant
306,300.0,80.0,180.0,20.0,221.0," Brazilian pão de queijo (cheese bread) with coffee (300kcals per portion, 2 portions, dairy allergies, origin"," Carrot Sticks with Hummus - 80kcals per portion, 2 portions
   Origin", Veggie Fritters, Moroccan Mint Tea, Zucchini Noodles with Pesto
307,320.0,100.0,250.0,20.0,180.0," Tomato and mozzarella bruschetta (320 calories per portion, 2 portions, contains dairy, Italian origin)
", Corn on the Cob, Tomato Basil Bruschetta Pizza, Moroccan Mint Tea, Ratatouille
308,300.0,100.0,100.0,20.0,150.0, Greek Yogurt with Honey and Pistachios, Frozen Grapes," Vegan Chocolate Covered Strawberries - 100 kcals per portion, 4 portions, no allergic warnings, origin", Moroccan Mint Tea, Ratatouille
309,250.0,100.0,180.0,20.0,200.0, Buckwheat Porridge, Mini Frittatas - Approx, Mini zucchini and cheese frittatas, Moroccan Mint Tea," Spinach and Goat Cheese Stuffed Tomatoes - 200 calories/portion, 4 portions, Origin"
310,200.0,100.0,180.0,20.0,220.0, Veggie Breakfast Fritters, Cucumber Rolls with Cream Cheese, Greek Stuffed Grape Leaves (Dolmas), Moroccan Mint Tea, Lentil and Kale Soup
311,250.0,100.0,200.0,20.0,200.0, Vegan Berry Chia Smoothie - 250 calories per portion | 2 portions | None | Origin, Energy Balls - Approx, Mini chicken empanadas, Moroccan Mint Tea," Caprese Salad - 200 calories/portion, 4 portions, contains dairy (Italy)
"
312,200.0,80.0,90.0,20.0,200.0, Vegetarian Quiche, Stuffed Dates," Baked Apple Chips - 90 kcals per portion, 4 portions, gluten-free (USA)", Moroccan Mint Tea," Avocado and Tomato Salad - 200 calories/portion, 2 portions, Origin"
313,300.0,50.0,150.0,20.0,225.0, Fruit Smoothie Bowl, Baked Apple Chips - Approx, Vegetable samosa, Moroccan Mint Tea, Vegan Stuffed Mushrooms
314,250.0,100.0,160.0,20.0,200.0, Vegan Sausage and Biscuits, Caprese Skewers, Vegan Mexican Street Corn, Moroccan Mint Tea, Mexican Street Corn Salad
315,250.0,80.0,230.0,20.0,200.0," Blueberry almond muffins (250 calories per portion, 2 portions, contains nuts, American origin)
", Avocado Deviled Eggs, Mediterranean bruschetta, Moroccan Mint Tea," Spinach and Goat Cheese Stuffed Tomatoes - 200 calories/portion, 4 portions, Origin"
316,250.0,80.0,120.0,20.0,240.0, Vegan Breakfast Sushi Rolls, Fresh Watermelon Slices - Approx, Greek Yogurt Dip with Veggies, Moroccan Mint Tea," Greek Feta Spinach Pie - 240kcals per portion, 4 portions, contains dairy (Greece)
"
317,300.0,90.0,180.0,20.0,200.0, Shakarkandi ki Chaat (Sweet Potato Chaat), Quinoa Energy Bites, Tabbouleh, Moroccan Mint Tea, Vegetable Stir-Fry
318,300.0,100.0,150.0,20.0,200.0, Vegan Apple Cinnamon Quinoa - 300 calories per portion | 1 portion | None | Origin, Cucumber and Hummus Rolls, Mini cheese and vegetable calzones, Moroccan Mint Tea," Greek-style stuffed zucchini - 200 calories per portion, 4 portions, none (Greece)
"
319,300.0,100.0,150.0,20.0,200.0," Filipino champorado (chocolate rice porridge) - 300 calories per portion, 2 portions, contains gluten, origin", Fruit Smoothie Popsicles - Approx, Bruschetta, Moroccan Mint Tea," Vegetable Stir-Fry with Tofu - 200 calories per portion, 4 portions, no allergic warnings, Origin"
320,150.0,100.0,250.0,20.0,180.0, Vegan Egg Muffins - 150 calories per portion | 2 portions | None | Origin, Zesty Lime Popcorn - Approx, Spinach and Mushroom Stuffed Phyllo Triangles, Moroccan Mint Tea, Ratatouille
321,250.0,90.0,100.0,20.0,160.0," British eggy soldiers - 250 calories per portion, 1 portion, contains gluten, origin", Fruit Salad, Greek yogurt with mixed berries, Moroccan Mint Tea," Vegan Mediterranean Couscous Salad - 160 calories per portion, 3 portions, may contain gluten"
322,250.0,100.0,160.0,20.0,200.0, Tropical Smoothie, Fresh Fruit Salad, Portobello Mushroom Pizza Bites, Moroccan Mint Tea," Caprese Stuffed Avocado - 200 calories/portion, 4 portions, contains dairy (Italy)
"
323,300.0,60.0,220.0,20.0,150.0," Banana chocolate chip muffins (300 calories per portion, 2 portions, contains dairy, American origin)
", Cucumber and tomato salad, Sesame Ginger Edamame, Moroccan Mint Tea," Caprese salad - 150 calories per portion, 4 portions, contains dairy (Italy)
"
324,300.0,100.0,190.0,20.0,200.0, Apple Cinnamon Porridge, Greek yogurt with berries, Greek Spinach and Feta Pinwheels, Moroccan Mint Tea," Vegan Tomato Soup - 200 calories per portion, 4 portions, None, Various
"
325,250.0,80.0,300.0,20.0,180.0, Tomato Basil Bruschetta, Apple with Cinnamon, Mini Pita Pizzas, Moroccan Mint Tea, Lentil Soup
326,300.0,100.0,120.0,20.0,200.0, Vegan Mango Turmeric Smoothie Bowl - 300 calories per portion | 1 portion | None | Origin," Dates Stuffed with Almond Butter - 100kcals per portion, 2 portions
    Origin", Roasted Chickpeas, Moroccan Mint Tea," Ratatouille - 200 calories per portion, 6 portions, no allergic warnings, Origin"
327,200.0,90.0,250.0,20.0,200.0, Avocado Toast, Quinoa Energy Bites, Baked salmon cakes, Moroccan Mint Tea," Miso soup with tofu and seaweed – 200 calories per portion, 6 portions, vegan-friendly (origin"
328,250.0,100.0,180.0,20.0,200.0, Vegan Chocolate Banana Chia Pudding - 250 calories per portion | 2 portions | None | Origin, Quinoa Energy Bites," Stuffed Grape Leaves - 180 kcals per portion, 5 portions, may contain nuts (Middle East)", Moroccan Mint Tea," Lentil curry - 200 calories per portion, 6 portions, contains gluten (India)
"
329,200.0,50.0,80.0,20.0,150.0, Mexican Black Bean Breakfast Wrap, Baked Apple Chips - Approx, Energy Balls, Moroccan Mint Tea," Ratatouille - 150 calories per portion, 6 portions, None, France
"
330,200.0,100.0,180.0,20.0,180.0, Mediterranean Vegetable Omelette, Rice Cake with Hummus and Cucumber, Mini Pizza Bagels, Moroccan Mint Tea," Cauliflower Shawarma - 180 calories per portion, 6 portions, None, Middle East
"
331,300.0,80.0,120.0,20.0,120.0," Chia pudding with mixed berries - 300 calories per portion, 2 portions, no allergic warnings, origin", Avocado Deviled Eggs, Greek Yogurt Fruit Dip, Moroccan Mint Tea," Grilled vegetable skewers - 120 calories per portion, 4 portions, none
"
332,250.0,100.0,160.0,20.0,200.0, Overnight Oats, Fruit Smoothie Popsicles - Approx," Mini Pizza Bagels - 160 kcals per portion, 4 portions, contains gluten, dairy (USA)", Moroccan Mint Tea," Vegan Tomato Soup - 200 calories per portion, 4 portions, None, Various
"
333,200.0,80.0,180.0,20.0,150.0," Oatmeal with banana and almond (200kcals per portion, 2 portions, nut allergies, origin", Avocado Deviled Eggs, Greek Spanakopita, Moroccan Mint Tea, Caprese Salad
334,300.0,60.0,280.0,20.0,230.0, Avocado Toast, Fruit Salad - Approx, Mini Margherita Pizzas, Moroccan Mint Tea," Quinoa-Stuffed Bell Peppers - 230kcals per portion, 4 portions, gluten-free
"
335,300.0,100.0,290.0,20.0,220.0, Veggie Tofu Scramble Wrap - 300 calories per portion | 1 portion | None | Origin, Kiwi and Strawberry Smoothie," Antipasto Skewers - 290 kcals per portion, 3 portions, contains dairy (Italy)", Moroccan Mint Tea," Greek Salad - 220kcals per portion, 4 portions, contains dairy
"
336,300.0,50.0,160.0,20.0,150.0," Egyptian foul medames (fava bean stew) - 300 calories per portion, 2 portions, no allergic warnings, origin"," Fruit Salad - 50kcals per portion, 2 portions
   Origin", Veggie Sausage Rolls, Moroccan Mint Tea," Low-Calorie Veggie Stir-Fry (150 calories/portion, 3 portions) - China
"
337,300.0,80.0,180.0,20.0,200.0," Acai bowl - 300 calories per portion, 1 portion, no allergic warnings, origin", Fruit Salad, Mediterranean Couscous Salad, Moroccan Mint Tea," Greek Veggie Skewers - 200 calories/portion, 4 portions, Origin"
338,250.0,100.0,80.0,20.0,100.0, Vegan Maple Pecan Overnight Oats - 250 calories per portion | 2 portions | Contains nuts | Origin, Cucumber Sandwiches," Baked Zucchini Chips - 80 kcals per portion, 3 portions, contains dairy (Italy)", Moroccan Mint Tea," Ratatouille - 100 calories per portion, 4 portions, none (France)
"
