,breakfast_calories,morning snacks_calories,afternoon snacks_calories,lunch_calories,dinner_calories,breakfast,morning snacks,afternoon snacks,lunch,dinner
215,400.0,60.0,180.0,20.0,260.0, Vegan Breakfast Tamales - 400 calories per portion | 1 portion | Contains gluten | Origin, Cucumber and tomato salad, Cheese and tomato bruschetta, Moroccan Mint Tea," Greek Style Lemon Potatoes - 260kcals per portion, 4 portions
"
216,350.0,80.0,80.0,20.0,200.0, Vegan Kale and Potato Frittata - 350 calories per portion | 1 portion | None | Origin, Energy Balls," Popcorn - 80 kcals per portion, 4 portions, gluten-free (World)", Moroccan Mint Tea," Lentil curry - 200 calories per portion, 6 portions, contains gluten (India)
"
217,500.0,80.0,240.0,20.0,300.0," English full breakfast with bacon, sausages, eggs, beans, mushrooms, and toast (500kcals per portion, 2 portions, pork allergies, origin", Baked Apple Chips, Vegan Spinach Dip with Pita Chips, Moroccan Mint Tea, Eggplant Parmesan Sliders
218,300.0,80.0,180.0,20.0,200.0," Carrot cake oatmeal (300 calories per portion, 2 portions, nut-free, American origin)
", Apple with Cinnamon, Grilled Halloumi Skewers, Moroccan Mint Tea," Spinach and Feta Stuffed Mushrooms - 200 calories/portion, 4 portions, Origin"
219,250.0,80.0,150.0,20.0,250.0, Tofu Scramble - 250 calories per portion | 2 portions | None | Origin, Fresh Watermelon Slices - Approx, Mexican Street Corn, Moroccan Mint Tea," Spinach and feta stuffed phyllo rolls - 250 calories per portion, 4 portions, contains gluten and dairy (Greece)
"
220,400.0,80.0,120.0,20.0,300.0, Vegan Breakfast Spanakopita, Cheesy Popcorn, Roasted Chickpeas, Moroccan Mint Tea," Vegan Bulgogi - 300 calories per portion, 4 portions, None, Korea
"
221,450.0,80.0,300.0,20.0,200.0," Persian barbari bread with feta and cucumber (450kcals per portion, 2 portions, origin", Avocado Deviled Eggs, Mini Spinach and Feta Pizzas, Moroccan Mint Tea, Stuffed Mushrooms
222,300.0,80.0,150.0,20.0,320.0, Vegan Breakfast Burrito, Fresh Watermelon Slices - Approx, Baked Buffalo Cauliflower Bites, Moroccan Mint Tea," Sesame ginger tofu with broccoli – 320 calories per portion, 3 portions, vegan-friendly
"
223,250.0,80.0,150.0,20.0,300.0, Vegan Banana Bread, Fruit Salad, Mango salsa with tortilla chips, Moroccan Mint Tea," Greek Chickpea Patties - 300 calories/portion, 4 portions, contains gluten (Greece)
"
224,350.0,80.0,70.0,20.0,200.0, Vegan Blueberry Acai Smoothie Bowl - 350 calories per portion | 1 portion | None | Origin, Cheesy Popcorn," Cinnamon Apple Chips - 70 kcals per portion, 4 portions, gluten-free (USA)", Moroccan Mint Tea, Greek Stuffed Peppers
225,350.0,80.0,200.0,20.0,250.0, Vegan Mushroom and Spinach Omelette - 350 calories per portion | 1 portion | None | Origin, Fruit Salad, Vegetable Dumplings, Moroccan Mint Tea," Vegetable Stir Fry - 250 calories/portion, 4 portions, Origin"
226,350.0,60.0,100.0,20.0,250.0, Breakfast Bruschetta, Fruit Salad - Approx," Roasted Cauliflower Hummus - 100 kcals per portion, 4 portions, no allergic warnings, origin", Moroccan Mint Tea, Sushi Roll
227,400.0,80.0,200.0,20.0,200.0, Vegetarian Quiche Lorraine, Hard-Boiled Eggs, Smashed Avocado Toast, Moroccan Mint Tea," Caprese Stuffed Avocado - 200 calories/portion, 4 portions, contains dairy (Italy)
"
228,300.0,70.0,70.0,20.0,300.0, Vegan Pumpkin Muffins - 300 calories per portion | 2 portions | Contains gluten | Origin, Fresh Fruit Salad, Stuffed Cherry Tomatoes, Moroccan Mint Tea, Veggie Fajitas
229,400.0,80.0,200.0,20.0,100.0," Polish jajecznica (scrambled eggs with kielbasa) - 400 calories per portion, 2 portions, no allergic warnings, origin", Kale Chips, Cilantro Lime Shrimp Skewers, Moroccan Mint Tea," Japanese Miso Soup with Tofu (100 calories/portion, 4 portions) - Japan
"
230,350.0,80.0,90.0,20.0,300.0," Afghan bolani (stuffed flatbread) with yogurt sauce - 350 calories per portion, 2 portions, contains gluten and dairy, origin", Fresh Watermelon Slices - Approx," Caprese Skewers with Vegan Mozzarella - 90 kcals per portion, 4 portions, no allergic warnings, origin", Moroccan Mint Tea," Baked Ziti - 300 calories/portion, 4 portions, Origin"
231,400.0,80.0,200.0,20.0,300.0," Chinese congee with chicken and ginger (400kcals per portion, 2 portions, origin", Hard-Boiled Eggs, Mini Chicken and Vegetable Skewers, Moroccan Mint Tea, Ratatouille Stuffed Portobello Mushrooms
232,400.0,80.0,160.0,20.0,320.0, Pancakes with Maple Syrup, Baked Apple Chips," Mini Pizza Bagels - 160 kcals per portion, 4 portions, contains gluten, dairy (USA)", Moroccan Mint Tea, Vegan Gumbo
233,300.0,80.0,230.0,20.0,200.0, Vegan Berry Protein Smoothie Bowl," Carrot Sticks with Hummus - 80kcals per portion, 2 portions
   Origin"," Smoked Salmon Canapés - 230 kcals per portion, 4 portions, contains gluten, fish (Various)", Moroccan Mint Tea," Cauliflower Fried Rice - 200 calories/portion, 4 portions, contains soy (China)
"
234,200.0,80.0,100.0,20.0,250.0, Banana Pancakes, Mango with Chili Powder, Stuffed Dates, Moroccan Mint Tea," Thai Vegan Green Papaya Salad (250 calories/portion, 4 portions) - Thailand
"
235,500.0,80.0,240.0,20.0,220.0, Vegan Breakfast Cookies, Cheesy Popcorn," Matzah with Cream Cheese - 240 kcals per portion, 3 portions, contains dairy (Jewish)", Moroccan Mint Tea, Chickpea Salad
236,400.0,80.0,120.0,20.0,300.0, Bagel with Cream Cheese and Smoked Salmon, Energy Balls," Roasted Chickpeas - 120 kcals per portion, 4 portions, no allergic warnings, origin", Moroccan Mint Tea, Sweet Potato Curry
237,400.0,80.0,300.0,20.0,250.0, Vegan Spinach and Mushroom Breakfast Wrap - 400 calories per portion | 1 portion | None | Origin, Fresh Squeezed Orange Juice, Veggie Sushi Bowls, Moroccan Mint Tea, Zucchini Noodles with Pesto
238,350.0,80.0,120.0,20.0,300.0," Veggie breakfast wrap with scrambled eggs (350kcals per portion, 2 portions, origin", Hard-Boiled Eggs, Greek Yogurt Fruit Dip, Moroccan Mint Tea," Vegetable Curry - 300kcals per portion, 4 portions (Various)
"
239,450.0,50.0,120.0,20.0,250.0, Vegan Breakfast Pho," Fruit Salad - 50kcals per portion, 2 portions
   Origin", Caprese stuffed mushrooms, Moroccan Mint Tea," Vegan Tomato and Vegetable Paella - 250 calories per portion, 3 portions, may contain gluten"
240,550.0,70.0,300.0,20.0,250.0, Vegan Smoothie Bowl, Kale chips, Mini Pita Pizzas, Moroccan Mint Tea," Veggie Noodle Stir Fry - 250 calories/portion, 4 portions, Origin"
241,350.0,60.0,150.0,20.0,250.0, Vegan Breakfast Banana Bread, Fruit Salad - Approx, Mango Salsa with Tortilla Chips, Moroccan Mint Tea," Vegan Korean Bibimbap - 250 calories per portion, 2 portions, may contain soy"
242,350.0,80.0,300.0,20.0,200.0," Greek yogurt and berry parfait (350 calories per portion, 2 portions, contains dairy, Greek origin)
", Stuffed Dates, Veggie Spring Rolls, Moroccan Mint Tea," Mexican Stuffed Portobello Mushrooms - 200 calories/portion, 4 portions, contains gluten (Mexico)
"
243,400.0,80.0,80.0,20.0,320.0," Savory oatmeal with bacon and eggs (400 calories per portion, 2 portions, contains eggs, American origin)
"," Carrot Sticks with Hummus - 80kcals per portion, 2 portions
   Origin", Zucchini Chips, Moroccan Mint Tea, Thai Noodle Salad
244,500.0,80.0,180.0,20.0,200.0," Iranian kaleh pacheh (sheep's head and hoof soup) - 500 calories per portion, 2 portions, no allergic warnings, origin", Fresh Watermelon Slices - Approx, Apple and Cheese Quesadillas, Moroccan Mint Tea," Tomato and mozzarella tart - 200 calories per portion, 4 portions, contains gluten and dairy (Italy)
"
245,400.0,80.0,150.0,20.0,200.0," Nigerian plantain porridge - 400 calories per portion, 2 portions, no allergic warnings, origin", Avocado Deviled Eggs, Beetroot Hummus with Crackers, Moroccan Mint Tea," Lentil Curry (200 calories/portion, 4 portions) - India
"
246,250.0,60.0,280.0,20.0,325.0, Overnight Chia Pudding, Fruit Salad - Approx, Vegan Nachos, Moroccan Mint Tea, Vegan Burritos
247,300.0,80.0,200.0,20.0,305.0," Thai coconut rice pudding with mango (300kcals per portion, 2 portions, origin", Mango with Chili Powder, Chicken and Vegetable Potstickers, Moroccan Mint Tea, Vegan Pho
248,350.0,60.0,250.0,20.0,200.0," Yogurt and granola parfait with mixed berries (350 calories per portion, 2 portions, contains dairy, American origin)
", Fruit Salad - Approx, Thai Peanut Noodle Salad, Moroccan Mint Tea," Veggie Stir-Fry with Tofu - 200 calories/portion, 4 portions, contains soy (China)
"
249,350.0,60.0,120.0,20.0,290.0," Israeli shakshuka with eggplant and tahini (350kcals per portion, 2 portions, origin", Fruit Salad - Approx," Vegan Cucumber Sushi Rolls - 120 kcals per portion, 4 portions, no allergic warnings, origin", Moroccan Mint Tea," Black Bean Soup - 290kcals per portion, 4 portions, contains legumes (Various)

"
250,300.0,70.0,180.0,20.0,220.0," Singaporean kaya toast - 300 calories per portion, 2 portions, contains gluten and dairy, origin", Kale chips, Veggie Sausage Rolls, Moroccan Mint Tea, Grilled Vegetable Skewers
251,350.0,80.0,150.0,20.0,180.0, Vegan Sweet Potato Hash Browns - 350 calories per portion | 1 portion | None | Origin, Fruit Salad, Greek Yogurt Parfait, Moroccan Mint Tea, Rainbow Salad
252,400.0,70.0,150.0,20.0,320.0," Bangladeshi panta bhat (fermented rice) with fried hilsa fish - 400 calories per portion, 2 portions, contains gluten, origin", Kale chips, Baked Parmesan Zucchini Fries, Moroccan Mint Tea, Vegan Gumbo
253,350.0,60.0,90.0,20.0,320.0, Vegan Breakfast Baked Potato - 350 calories per portion | 1 portion | None | Origin, Fruit Salad - Approx, Vegan Energy Balls, Moroccan Mint Tea," Cauliflower fried rice with tofu – 320 calories per portion, 3 portions, vegan-friendly
"
254,250.0,80.0,90.0,20.0,300.0, Vegan Breakfast Shakshuka, Fruit Salad," Guacamole with Tortilla Chips - 90 kcals per portion, 4 portions, allergic warning (avocado), origin", Moroccan Mint Tea," Greek Stuffed Eggplant - 300 calories/portion, 4 portions, contains gluten and dairy (Greece)
"
255,350.0,80.0,240.0,20.0,300.0," English crumpets with butter and jam (350kcals per portion, 2 portions, dairy allergies, origin", Fresh Squeezed Orange Juice, Greek Stuffed Grape Leaves, Moroccan Mint Tea, Vegan Chickpea Curry
256,150.0,80.0,180.0,20.0,300.0, Chia Pudding - 150 calories per portion | 1 portion | None | Origin, Hard-Boiled Eggs," Baked Falafel Salad - 180 kcals per portion, 4 portions, allergic warning (sesame), origin", Moroccan Mint Tea," Vegetable and tofu stir-fry - 300 calories per portion, 4 portions, contains soy
"
257,250.0,80.0,160.0,20.0,250.0, Banana and Almond Butter Toast, Fruit Salad," Salsa Verde Hummus with Pita Chips - 160 kcals per portion, 4 portions, contains gluten (Various)", Moroccan Mint Tea, Vegan Caesar Salad
258,300.0,80.0,180.0,20.0,250.0, Hash Brown Casserole, Avocado Deviled Eggs, Veggie Snack Wrap, Moroccan Mint Tea, Vegan Sushi Bowl
259,300.0,60.0,200.0,20.0,250.0, Avocado Toast - 300 calories per portion | 1 portion | None | Origin, Fruit Salad - Approx, Greek yogurt and honey with walnuts, Moroccan Mint Tea," Italian Wedding Soup - 250 calories per portion, 6 portions, contains gluten (pasta), Origin"
260,250.0,80.0,90.0,20.0,300.0, Tropical Smoothie, Avocado Deviled Eggs, Zucchini fritters, Moroccan Mint Tea," Mexican Vegan Tortilla Soup (300 calories/portion, 4 portions) - Mexico
"
261,50.0,60.0,200.0,20.0,300.0, Vegan Breakfast Sushi Burrito, Cucumber and tomato salad," Vegan Broccoli Pesto Pasta - 200 kcals per portion, 4 portions, no allergic warnings, origin", Moroccan Mint Tea," Spinach and Feta Stuffed Chicken Breast - 300 calories per portion, 4 portions, contains dairy (cheese), Origin"
262,300.0,80.0,220.0,20.0,300.0," Strawberry banana overnight oats (300 calories per portion, 2 portions, nut-free, American origin)
", Avocado Deviled Eggs, Baked Mini Samosas with Mint Chutney, Moroccan Mint Tea, Lentil Sloppy Joes
263,400.0,50.0,80.0,20.0,320.0, Vegan Breakfast Hash," Homemade Fruit Popsicles - 50kcals per portion, 2 portions
    Origin", Fruit Salad, Moroccan Mint Tea," Vegan lasagna with cashew cheese – 320 calories per portion, 4 portions, vegan-friendly (origin"
264,250.0,80.0,160.0,20.0,300.0, Raspberry Chia Jam Toast, Fruit Salad," Cinnamon Sugar Pretzels - 160 kcals per portion, 3 portions, contains gluten (USA)", Moroccan Mint Tea, Quinoa-Stuffed Bell Peppers
265,400.0,80.0,150.0,20.0,250.0," Chicken sausage and vegetable stir-fry (400kcals per portion, 2 portions, origin", Avocado Deviled Eggs, Greek Yogurt with Fresh Berries, Moroccan Mint Tea, Chickpea Flour Pancakes
266,350.0,80.0,90.0,20.0,250.0, Vegan Vegetable Frittata - 350 calories per portion | 1 portion | None | Origin, Fruit Salad, Watermelon Feta Bites, Moroccan Mint Tea, Lentil Salad
267,250.0,80.0,80.0,20.0,200.0, Vegan Breakfast Sushi, Kale Chips," Baked Apple Chips - 80 kcals per portion, 4 portions, no allergic warnings, origin", Moroccan Mint Tea," Spinach and Goat Cheese Stuffed Tomatoes - 200 calories/portion, 4 portions, Origin"
268,400.0,80.0,180.0,20.0,320.0," Quiche Lorraine with spinach (400 calories per portion, 2 portions, contains dairy, French origin)
", Fruit Salad, Strawberry and banana smoothie, Moroccan Mint Tea," Sesame ginger tofu with broccoli – 320 calories per portion, 3 portions, vegan-friendly
"
269,550.0,80.0,620.0,20.0,250.0, Smoked Salmon Bagel Sandwich, Cheesy Popcorn, Bean Burritos, Moroccan Mint Tea," Thai Vegan Green Papaya Salad (250 calories/portion, 4 portions) - Thailand
"
270,400.0,80.0,170.0,20.0,250.0," Huevos divorciados (Mexican-style eggs with red and green salsa) (400 calories per portion, 2 portions, nut-free, Mexican origin)
", Fresh Squeezed Orange Juice," Egg Salad Lettuce Wraps - 170 kcals per portion, 3 portions, contains egg (USA)", Moroccan Mint Tea," Moroccan Chickpea Pancakes (250 calories/portion, 4 portions) - Morocco
"
271,280.0,70.0,580.0,20.0,320.0," Cinnamon raisin oatmeal with apples (280 calories per portion, 2 portions, nut-free, American origin)
", Kale chips, Falafel with Tahini Sauce, Moroccan Mint Tea," Caprese quinoa salad – 320 calories per portion, 4 portions, contains dairy
"
272,550.0,80.0,180.0,20.0,300.0, Spanish Tortilla," Carrot Sticks with Hummus - 80kcals per portion, 2 portions
   Origin", Grilled Halloumi Skewers, Moroccan Mint Tea," Moroccan Couscous with Roasted Vegetables - 300 calories/portion, 4 portions, contains gluten (Morocco)
"
273,400.0,60.0,200.0,20.0,300.0," Chinese congee with chicken and ginger (400kcals per portion, 2 portions, origin", Cucumber and tomato salad, Chicken lettuce wraps, Moroccan Mint Tea," Ratatouille Pasta - 300 calories/portion, 4 portions, Origin"
274,350.0,80.0,120.0,20.0,250.0, Greek Yogurt with Fig Compote, Energy Balls, No-Bake Energy Bars, Moroccan Mint Tea," Greek Vegan Fava Beans (250 calories/portion, 4 portions) - Greece
"
275,250.0,80.0,150.0,20.0,320.0, Cheesy Spinach Pita Pocket, Hard-Boiled Eggs, Caprese bruschetta, Moroccan Mint Tea, Mediterranean Stuffed Peppers
276,380.0,70.0,280.0,20.0,250.0," Israeli-style salad with scrambled eggs (380 calories per portion, 2 portions, nut-free, Israeli origin)
", Fresh Fruit Salad, Veggie Pita Pockets, Moroccan Mint Tea," Lentil Spinach Curry - 250 calories per portion, 4 portions, None, India
"
277,300.0,50.0,200.0,20.0,200.0, Veggie Breakfast Quesadilla," Fruit Salad - 50kcals per portion, 2 portions
   Origin", Baked Mini Samosas, Moroccan Mint Tea, Spaghetti Aglio e Olio
278,300.0,50.0,150.0,20.0,300.0," Blueberry almond smoothie (300 calories per portion, 2 portions, contains nuts, American origin)
", Baked Apple Chips - Approx, Carrot Hummus with Pita Chips, Moroccan Mint Tea," Broccoli and Cheddar Stuffed Potatoes - 300 calories/portion, 4 portions, Origin"
279,150.0,60.0,150.0,20.0,250.0, Vegan Energy Balls - 150 calories per portion | 2 portions | Contains nuts | Origin, Cucumber and tomato salad, Edamame Salad, Moroccan Mint Tea," Moroccan Lentil Salad - 250 calories/portion, 4 portions, contains nuts (Morocco)
"
280,350.0,50.0,160.0,20.0,300.0, Scrambled Eggs with Smoked Salmon," Homemade Fruit Popsicles - 50kcals per portion, 2 portions
    Origin"," Vegan Spinach and Mushroom Tartlets - 160 kcals per portion, 4 portions, no allergic warnings, origin", Moroccan Mint Tea," Greek Moussaka-Stuffed Bell Peppers - 300 calories/portion, 4 portions, contains gluten and dairy (Greece)
"
281,300.0,80.0,180.0,20.0,300.0," Scottish porridge with honey and berries - 300 calories per portion, 2 portions, no allergic warnings, origin", Fruit Salad, Baked buffalo chicken meatballs, Moroccan Mint Tea," Zucchini Noodles with Pesto - 300 calories per portion, 4 portions, contains nuts (pine nuts), Origin"
282,300.0,70.0,300.0,20.0,250.0, Chia Seed Smoothie, Kale chips, Mini Veggie Pizzas, Moroccan Mint Tea," Greek Vegan Melitzanosalata (250 calories/portion, 4 portions) - Greece
"
283,400.0,50.0,150.0,20.0,320.0, Tomato Basil Quiche," Fruit Salad - 50kcals per portion, 2 portions
   Origin", Bruschetta with Tomato and Basil, Moroccan Mint Tea," Greek Gigantes Plaki - 320kcals per portion, 4 portions
"
284,350.0,80.0,230.0,20.0,250.0," Veggie fajita scramble with tofu (350 calories per portion, 2 portions, nut-free, Mexican origin)
", Fruit Salad, Roasted Red Pepper Hummus with Pita Chips, Moroccan Mint Tea, Vegetable Stir-Fry
285,300.0,80.0,210.0,20.0,250.0, Feta and Spinach Muffins, Baked Apple Chips," Savory Cheese Bites - 210 kcals per portion, 4 portions, contains gluten, dairy (Various)", Moroccan Mint Tea," Panzanella salad - 250 calories per portion, 4 portions, contains gluten (Italy)
"
286,200.0,80.0,200.0,20.0,250.0, Vegan Chocolate Chia Pudding - 200 calories per portion | 2 portions | None | Origin, Fruit Salad, Baked buffalo cauliflower bites, Moroccan Mint Tea," Mexican Corn Salad - 250 calories/portion, 4 portions, contains cilantro (Mexico)
"
287,250.0,50.0,120.0,20.0,300.0, Buckwheat Porridge," Homemade Fruit Popsicles - 50kcals per portion, 2 portions
    Origin", Granola Bar, Moroccan Mint Tea, Vegan Spaghetti Carbonara
288,350.0,80.0,180.0,20.0,280.0," Veggie breakfast burrito with black beans (350 calories per portion, 2 portions, nut-free, Mexican origin)
", Fresh Squeezed Orange Juice, Crispy Tofu Bites, Moroccan Mint Tea," Sweet Potato Curry - 280 calories per portion, 4 portions, None, India
"
289,300.0,80.0,180.0,20.0,300.0, Pancakes with Maple Syrup, Stuffed Dates," Chocolate Banana Bread - 180 kcals per portion, 6 portions, contains gluten (USA)", Moroccan Mint Tea," Zucchini Noodles with Pesto - 300 calories/portion, 4 portions, Origin"
290,160.0,50.0,360.0,20.0,150.0," Cream cheese stuffed strawberries (160 calories per portion, 2 portions, contains dairy, American origin)
"," Fruit Salad - 50kcals per portion, 2 portions
   Origin", Vegan Mushroom Soup, Moroccan Mint Tea," Grilled Vegetable Skewers - 150 calories/portion, 4 portions, contains garlic (Various)
"
291,350.0,70.0,150.0,20.0,170.0," Turkish simit (sesame bread rings) with cheese - 350 calories per portion, 1 portion, contains gluten and dairy, origin", Fresh Fruit Salad, Veggie Sushi Rolls, Moroccan Mint Tea, Vegan Caprese Salad
292,300.0,80.0,80.0,20.0,220.0, Vegan Sweet Potato Pancakes - 300 calories per portion | 1 portion | Contains gluten | Origin, Mango with Chili Powder, Greek Salad Skewers, Moroccan Mint Tea, Spicy Black Bean Soup
293,450.0,80.0,120.0,20.0,250.0, Vegan Biscuits and Gravy - 450 calories per portion | 1 portion | Contains gluten | Origin, Hard-Boiled Eggs," Ceviche - 120 kcals per portion, 2 portions, contains fish (Peru)", Moroccan Mint Tea, Chickpea Flour Pancakes
294,400.0,60.0,100.0,20.0,180.0," Shakshuka with bell peppers and tomatoes (400kcals per portion, 2 portions, origin", Fruit Salad - Approx, Basil and Tomato Skewers, Moroccan Mint Tea," Greek Roasted Vegetables - 180kcals per portion, 4 portions
"
295,400.0,50.0,150.0,20.0,300.0," Huevos Rancheros with refried beans and salsa (400kcals per portion, 2 portions, origin"," Homemade Fruit Popsicles - 50kcals per portion, 2 portions
    Origin", Mini Quiche, Moroccan Mint Tea, Greek Lemon Chicken Soup
296,300.0,70.0,200.0,20.0,300.0," Chia pudding with mixed berries - 300 calories per portion, 2 portions, no allergic warnings, origin", Kale chips, Stuffed bell peppers with quinoa and black beans, Moroccan Mint Tea," Mediterranean Quinoa Salad - 300 calories/portion, 4 portions, contains gluten (Greece)
"
297,400.0,50.0,120.0,20.0,250.0," Breakfast tacos with egg, cheese, and salsa (400 calories per portion, 2 portions, contains dairy, Mexican origin)
", Baked Apple Chips - Approx, Cucumber Sandwiches, Moroccan Mint Tea," Vegan Tofu and Vegetable Skewers - 250 calories per portion, 2 portions, may contain soy"
298,200.0,80.0,180.0,20.0,300.0, Mediterranean Vegetable Omelette, Fresh Watermelon Slices - Approx, Apple Slices with Cinnamon Yogurt Dip, Moroccan Mint Tea, Vegan Pho
299,300.0,80.0,120.0,20.0,300.0, Veggie Breakfast Scramble, Mango with Chili Powder, Mini crab cakes, Moroccan Mint Tea," Mexican Rice and Beans - 300 calories/portion, 4 portions, contains cilantro (Mexico)
"
300,350.0,60.0,180.0,20.0,300.0, Vegan Spinach and Mushroom Quiche - 350 calories per portion | 1 portion | Contains gluten | Origin, Fruit Salad - Approx, Stuffed Jalapeno Poppers, Moroccan Mint Tea, Sweet Potato Curry
301,500.0,80.0,300.0,20.0,250.0," American biscuits and gravy with sausage (500kcals per portion, 2 portions, pork allergies, origin", Fresh Squeezed Orange Juice, Chicken Fried Rice, Moroccan Mint Tea, Vegan Zucchini Bread
302,350.0,80.0,180.0,20.0,300.0," Jamaican cornmeal porridge with cinnamon and nutmeg (350kcals per portion, 2 portions, origin", Fruit Salad," Greek Yogurt Bark - 180 kcals per portion, 4 portions, contains dairy (Greece)", Moroccan Mint Tea, Vegan Fajitas
303,500.0,80.0,180.0,20.0,250.0, Turkish Breakfast Platter, Kale Chips, Cucumber and Avocado Sushi Rolls, Moroccan Mint Tea," Greek Vegan Melitzanosalata (250 calories/portion, 4 portions) - Greece
"
304,200.0,80.0,100.0,20.0,300.0, Spanish Tortilla, Apple with Cinnamon, Baba Ganoush, Moroccan Mint Tea, Caprese Stuffed Portobello Mushrooms
305,350.0,80.0,220.0,20.0,250.0," Japanese tamagoyaki (rolled omelette) with rice - 350 calories per portion, 2 portions, no allergic warnings, origin", Fruit Salad," Falafel with Tahini Sauce - 220 kcals per portion, 3 portions, contains sesame (Middle East)", Moroccan Mint Tea," Stuffed Zucchini Boats - 250 calories/portion, 4 portions, contains dairy (Italy)
"
306,400.0,80.0,200.0,20.0,320.0, Vegan Chocolate Waffles, Kale Chips, Stuffed Grape Leaves, Moroccan Mint Tea, Vegan Lentil Meatballs
307,300.0,50.0,180.0,20.0,220.0, Vegan Blueberry Muffins - 300 calories per portion | 1 portion | Contains gluten | Origin," Fruit Salad - 50kcals per portion, 2 portions
   Origin", Cheesy Garlic Breadsticks, Moroccan Mint Tea, Lentil and Vegetable Stir Fry
308,400.0,70.0,240.0,20.0,300.0, Sourdough Biscuits and Mushroom Gravy, Fresh Fruit Salad, Spinach and Artichoke Dip, Moroccan Mint Tea," Peanut Noodle Salad - 300 calories per portion, 4 portions, Peanuts, Various
"
309,350.0,80.0,160.0,20.0,150.0, Vegan Spinach and Mushroom Quiche - 350 calories per portion | 1 portion | Contains gluten | Origin, Fruit Salad," Cinnamon Sugar Pretzels - 160 kcals per portion, 3 portions, contains gluten (USA)", Moroccan Mint Tea, Veggie Stir-Fry
310,550.0,80.0,150.0,20.0,250.0, Sausage and Cheese Quiche, Fruit Salad, Quinoa salad with vegetables, Moroccan Mint Tea, Moroccan Quinoa Salad
311,450.0,80.0,250.0,20.0,220.0, Waffle Breakfast Sandwich, Fresh Watermelon Slices - Approx, Stuffed Bell Peppers with Quinoa, Moroccan Mint Tea, Quinoa and Vegetable Stir Fry
312,350.0,70.0,120.0,20.0,320.0," Veggie sausage and hash browns (350 calories per portion, 2 portions, contains soy, American origin)
", Fresh Fruit Salad," Black Bean Salsa with Tortilla Chips - 120 kcals per portion, 4 portions, no allergic warnings, origin", Moroccan Mint Tea, Moroccan Vegetable Tagine
313,350.0,50.0,150.0,20.0,300.0," Pancetta and mushroom omelette (350 calories per portion, 2 portions, nut-free, Italian origin)
", Baked Apple Chips - Approx, Baked chicken drumsticks, Moroccan Mint Tea, Caprese Quiche
314,250.0,50.0,120.0,20.0,300.0, Vegan Protein Pancakes, Baked Apple Chips - Approx," Vegan Avocado Toast - 120 kcals per portion, 4 portions, allergic warning (avocado), origin", Moroccan Mint Tea," Vegan Italian Wedding Soup - 300 calories per portion, 4 portions, Gluten, Italy
"
315,300.0,80.0,90.0,20.0,300.0, Vegan Blueberry Muffins - 300 calories per portion | 1 portion | Contains gluten | Origin," Carrot Sticks with Hummus - 80kcals per portion, 2 portions
   Origin", Shrimp cocktail, Moroccan Mint Tea," Moroccan vegetable tagine with couscous - 300 kcals per portion, 4 portions, vegetarian, contains gluten
"
316,400.0,80.0,180.0,20.0,300.0, French Toast, Fresh Watermelon Slices - Approx, Baked Jalapeno Poppers, Moroccan Mint Tea," Vegetable curry with coconut milk – 300 calories per portion, 4 portions, vegan-friendly (origin"
317,160.0,80.0,350.0,20.0,250.0," Cream cheese stuffed strawberries (160 calories per portion, 2 portions, contains dairy, American origin)
", Baked Apple Chips, Eggplant rollatini, Moroccan Mint Tea," Mexican Zucchini Boats - 250 calories/portion, 4 portions, contains cheese (Mexico)
"
318,300.0,60.0,150.0,20.0,300.0, Veggie Tofu Scramble Wrap - 300 calories per portion | 1 portion | None | Origin, Cucumber and tomato salad, Spinach and feta stuffed chicken breast, Moroccan Mint Tea," Mexican Quinoa Bowl - 300 calories/portion, 4 portions, contains cilantro (Mexico)
"
319,430.0,80.0,160.0,20.0,300.0," Cinnamon raisin French toast (430 calories per portion, 2 portions, contains dairy, American origin)
", Hard-Boiled Eggs, Vegan Mexican Street Corn, Moroccan Mint Tea, Lentil and Vegetable Soup
